event_title,administrative_title,location_name,address,city,state,zip,country,time,date,timezone,host,attendee_pitch,attendee_instructions,host_contact_info,van_id,shift_id,role_id,status_id,custom_fields,rsvp_limit,automatic_notifications,display_sharing_options,submit_button_title,end_date,end_time,disable_discussions,reminder_message,reminder_from,reminder_subject,reminder_reply_to,allow_guests,language,redirect_url,email_response,response_message,response_from,response_subject,response_reply_to,twitter_share,email_share,facebook_title,facebook_link,facebook_description,direct_link
"Developing Digital Dexterity: Introduction to JavaScript","Developing Digital Dexterity: Introduction to JavaScript (at  on January 29, 2022)","","","","","","","13:30","01/29/22","","techlearningcollective@riseup.net","<p>JavaScript is known for being “the Web programming language,” and while its capabilities in a Web browser have grown considerably, today JavaScript can also be used to automate mundane office jobs (e.g., Google Apps Script, Microsoft Office’s JavaScript API), develop PC games (using GDevelop), and much more. Learn what you need to know to get started with JavaScript in any environment in this workshop covering some common programming concepts as well as the quirks of the JavaScript language itself (functional scope, prototype-based object inheritance, etc.) so you can increase your digital dexterity whether in a Web browser, office job, or your own project.</p><h2 id=""workshop-description"">Workshop Description</h2><blockquote>  <p>Over the course of ten days in 1995, the Web changed forever when Brendan Eich was hired by Netscape, Inc. and developed a programming language that could be embedded in Web pages. Briefly named LiveScript, the language became known as JavaScript three months later, and was officially standardized as ECMAScript in 1997 after taking the Internet by storm only two years later. Today, JavaScript is arguably the single most popular and prolific high-level language available to many people for many projects.</p>  <p>Although most people know of JavaScript as the programming language of the Web, where <a href=""https://developer.mozilla.org/en-US/docs/Web/API"">its capabilities</a> have increased dramatically over the years, many other environments outside of the Web browser or traditional Web application now embed or rely on JavaScript engines to work. Entire back-end applications can be created with “server-side JavaScript” (<a href=""https://nodejs.org/"">Node.js</a>, <a href=""https://www.ringojs.org/"">RingoJS</a>); Internet-of-Things (IoT) devices like sensors and larger microcontrollers offer JavaScript scriptable interfaces (<a href=""https://www.espruino.com/"">Espruino</a>, <a href=""https://www.neonious.com/lowjs/"">low.js</a>); mundane office jobs and “paperwork” can be accomplished in JavaScript (<a href=""https://wiki.openoffice.org/wiki/Documentation/DevGuide/Scripting/JavaScript_Editor"">OpenOffice</a>/LibreOffice Script Provider, <a href=""https://developers.google.com/apps-script/"">Google Apps Script</a>, <a href=""https://docs.microsoft.com/en-us/javascript/api/overview"">Microsoft Office JavaScript API</a>); JavaScript can be used to write smart contracts for blockchain-based distributed ledger technologies (<a href=""https://www.hyperledger.org/use/fabric"">Hyperledger Fabric</a>); desktop and PC game programming can be done entirely in JavaScript (<a href=""https://gdevelop-app.com/javascript-game-engine/"">GDevelop</a>, <a href=""https://www.babylonjs.com/"">Babylon.js</a>); some other programming languages are implemented in JavaScript (<a href=""https://scratch.mit.edu/"">Scratch</a>); and JavaScript can even be used for macOS system automation tasks using the <a href=""https://en.wikipedia.org/wiki/AppleScript#Open_Scripting_Architecture"">Open Scripting Architecture (OSA) JavaScript for Automation extension</a>. Almost no other programming language is as easy to learn while offering the breadth of options that JavaScript does, which is one clear reason for the language’s popularity among developers and desirability among employers.</p>  <p>In this workshop, you’ll learn what you need to know to get started with JavaScript in any environment. By focusing on the language’s built-in constructs, you’ll be able to avoid many common pitfalls and understand what makes JavaScript tick. We’ll cover some programming basics common to all languages, but we’ll also show how JavaScript’s unusual rules (functional scope, prototype-based object inheritance, etc.) make it possible to write especially elegant—or especially dangerous—code, as well as showing you why developing even minimal proficiency with JavaScript will drastically increase your “digital dexterity” as you browse the Web.</p></blockquote><p>As this is a remote/online-only event, there is no physical class space, but attendance is still limited to 15 students, so <a href=""#tickets-workshop-2022-01-29-developing-digital-dexterity-introduction-to-javascript"">purchase your ticket now</a> to reserve your spot.</p><p>To participate in our webinars, you will need access to a modern Web browser such as an up-to-date copy of <a href=""https://www.mozilla.org/firefox/"">Mozilla Firefox</a> or <a href=""https://www.google.com/chrome/"">Google Chrome</a>. You will also need a reliable Internet connection. We recommend disabling Wi-Fi and plugging your computer in to a hard-wired Ethernet network cable for the duration of the webinar, if possible.</p><p>If you would like to share your video screen or appear on camera, you will need to have and activate your own camera, such as the one built-in to many modern laptops. Similarly, to speak with the rest of the webinar participants, you will need a microphone. If you do choose to activate your microphone, we ask that you please plug in headphones/ear buds or use a headset in order to help reduce audio feedback loops that can degrade the webinar experience for other participants.</p><p>Please refer to <a href=""https://techlearningcollective.com/faq/#workshops-and-webinars"">our workshops and webinars FAQ</a> for additional tips and advice before you join the video conference.</p><p>As with all Tech Learning Collective events, racism, queerphobia, transphobia, sexism, “brogrammer,” “manarchist,” or any kind of similarly awful behavior <em>will</em> result in immediate removal from class without a refund. Please refer to <a href=""https://github.com/AnarchoTechNYC/meta/wiki/Social-rules"">our lightweight social rules</a> for details on our strictly enforced no-tolerance policy against bigotry of any kind.</p><h2 id=""about-tech-learning-collective"">About Tech Learning Collective</h2><p>Tech Learning Collective is an apprenticeship-based technology school that trains politically self-motivated individuals in the arts of hypermedia, Information Technology, and radical political practice. We offer unparalleled free, by-donation, and low-cost computer classes on topics ranging from fundamental computer literacy to the same offensive computer hacking techniques used by national intelligence agencies and military powers (cyber armies). For more information and to enroll, visit <a href=""https://techlearningcollective.com/"">TechLearningCollective.com</a>.</p>","There are no special instructions for this event.","techlearningcollective@riseup.net","","","","","","15","","","","15:00","01/29/22","true","","","","","","en","http://techlearningcollective.com/events/2022/01/workshop-2022-01-29-developing-digital-dexterity-introduction-to-javascript","","","","","","","","","","","http://techlearningcollective.com/events/2022/01/workshop-2022-01-29-developing-digital-dexterity-introduction-to-javascript"
"Gone Phishing: How to Recognize Fake Websites and Other Online Scams","Gone Phishing: How to Recognize Fake Websites and Other Online Scams (at  on January 30, 2022)","","","","","","","13:30","01/30/22","","techlearningcollective@riseup.net","<p>The most common way hackers steal passwords, install malware on a victim’s computer, or get employees to grant them unauthorized access to critical business systems is through so-called phishing attacks. A phishing attack is surprisingly low-tech, which is part of what makes it so devastatingly effective. Learning to spot these attacks is one of the most important things you can do to protect yourself online, since a hacker’s tricks, called “lures,” can appear anywhere from an email, to a Facebook message, to a real Web site that looks exactly like one you recognize! In this workshop, you’ll learn how frighteningly easy it is to build these scam sites, and all about the tricks they use to fool you into falling for them.</p><h2 id=""workshop-description"">Workshop Description</h2><blockquote>  <p>Whether it’s corporate espionage, ransomware, or online fraud, most cyber attacks don’t start with sophisticated software exploits, but rather by employing relatively simple tricks. These tricks are called “phishing” attacks because, much like baiting a lure, they won’t work unless you bite. However, <em>many</em> people do get caught up by them.</p>  <p>In 2019, <a href=""https://retruster.com/blog/2019-phishing-and-email-fraud-statistics.html"">ninety percent (90%!)</a> of reported <a href=""https://www.privacyrights.org/data-breaches"">data breaches</a> began with a simple phishing scam, costing businesses <a href=""https://retruster.com/blog/2019-phishing-and-email-fraud-statistics.html"">over $12 billion in losses</a>. Phishing attacks are the most common type of cyberattack on the Internet today, with <a href=""https://www.webroot.com/us/en/about/press-room/releases/nearly-15-million-new-phishing-sites"">one and a half million new phishing websites launched every month</a>. Thankfully, it’s easy to spot—and even to perform—these tricks if you have the right guidance.</p>  <p>For example, when you’re at a cafe and you ask the patron next to you to watch your belongings, your stuff will probably be safe when you return. But how safe would you feel if the patron at the next table turned to you and <em>offered</em> to watch your belongings when you next needed to use the restroom? If you had two different reactions to these scenarios, you already have the intuition you need to understand how the overwhelming majority of cybercrime gets a foothold inside your company, home, or organization’s network.</p>  <p>In this workshop, derived from a portion of the <a href=""https://techlearningcollective.com/courses/sec101.html"">Tech Learning Collective’s popular “Hacking with Mr. Robot” Security 101 course</a>, you will have the opportunity to create and deploy your own phishing Web site that can steal usernames and passwords from unsuspecting victims. By learning how attackers build pixel-perfect replicas of familiar sites like the Facebook login screen, you will also gain the skills you need to more quickly recognize the signs of a malicious web site, email, or other online scam.</p></blockquote><p>As this is a remote/online-only event, there is no physical class space, but attendance is still limited to 15 students, so <a href=""#tickets-workshop-2022-01-30-gone-phishing-how-to-recognize-fake-websites-and-other-online-scams"">purchase your ticket now</a> to reserve your spot.</p><p>To participate in our webinars, you will need access to a modern Web browser such as an up-to-date copy of <a href=""https://www.mozilla.org/firefox/"">Mozilla Firefox</a> or <a href=""https://www.google.com/chrome/"">Google Chrome</a>. You will also need a reliable Internet connection. We recommend disabling Wi-Fi and plugging your computer in to a hard-wired Ethernet network cable for the duration of the webinar, if possible.</p><p>If you would like to share your video screen or appear on camera, you will need to have and activate your own camera, such as the one built-in to many modern laptops. Similarly, to speak with the rest of the webinar participants, you will need a microphone. If you do choose to activate your microphone, we ask that you please plug in headphones/ear buds or use a headset in order to help reduce audio feedback loops that can degrade the webinar experience for other participants.</p><p>Please refer to <a href=""https://techlearningcollective.com/faq/#workshops-and-webinars"">our workshops and webinars FAQ</a> for additional tips and advice before you join the video conference.</p><p>As with all Tech Learning Collective events, racism, queerphobia, transphobia, sexism, “brogrammer,” “manarchist,” or any kind of similarly awful behavior <em>will</em> result in immediate removal from class without a refund. Please refer to <a href=""https://github.com/AnarchoTechNYC/meta/wiki/Social-rules"">our lightweight social rules</a> for details on our strictly enforced no-tolerance policy against bigotry of any kind.</p><h2 id=""about-tech-learning-collective"">About Tech Learning Collective</h2><p>Tech Learning Collective is an apprenticeship-based technology school that trains politically self-motivated individuals in the arts of hypermedia, Information Technology, and radical political practice. We offer unparalleled free, by-donation, and low-cost computer classes on topics ranging from fundamental computer literacy to the same offensive computer hacking techniques used by national intelligence agencies and military powers (cyber armies). For more information and to enroll, visit <a href=""https://techlearningcollective.com/"">TechLearningCollective.com</a>.</p>","There are no special instructions for this event.","techlearningcollective@riseup.net","","","","","","15","","","","15:00","01/30/22","true","","","","","","en","http://techlearningcollective.com/events/2022/01/workshop-2022-01-30-gone-phishing-how-to-recognize-fake-websites-and-other-online-scams","","","","","","","","","","","http://techlearningcollective.com/events/2022/01/workshop-2022-01-30-gone-phishing-how-to-recognize-fake-websites-and-other-online-scams"
"Faster Than Light: Getting Started with Configuration Management","Faster Than Light: Getting Started with Configuration Management (at  on February  5, 2022)","","","","","","","13:30","02/05/22","","techlearningcollective@riseup.net","<p>Learn how to beat back configuration drift on your servers by leveraging automation tools like Ansible in this deep dive workshop demonstrating modern DevOps practices for deploying, maintaining, and auditing compute clusters. Whether for a Web application, big data processing, or other project, you need to turn old-school runbooks into computerized playbooks that can execute Standard Operating Procedures quickly and reliably so you can deploy complex systems simply and predictably. Come learn about key concepts like idempotence and change control, and learn how giant corporations implement security principles like RBAC, all using free and open source software.</p><h2 id=""workshop-description"">Workshop Description</h2><blockquote>  <p>Today, all but the most trivial of computer systems rely on an interdependent set of servers working in concert. You don’t just have one server, you have a group of them. Commonly called a <em>cluster</em>, these servers need to be managed as a group, ensuring that their software configurations, security patches, and installed packages are deployed, maintained, and eventually updated or retired in a predictable way.</p>  <p>In this deep dive workshop, we’ll set up our own small cluster and use <a href=""https://ansible.com/"">Ansible</a>, which is an agentless, cross-platform, enterprise-grade, free software <a href=""https://en.wikipedia.org/wiki/Configuration_management"">Configuration Management (CM)</a> and <a href=""https://techlearningcollective.com/workshops/Automate-All-the-Things-Infrastructure-as-Code-Primer"">Infrastructure as Code (IaC)</a> framework used by giant corporations like IBM and Cisco, to turn old-school operator runbooks into computerized playbooks that can be executed quickly and easily even by novice operators. Through several hands-on exercises, you’ll learn about the entire CM lifecycle from planning through auditing so that you understand critical CM concepts like idempotence, change control, and more, which are common to all CM systems including <a href=""https://www.chef.io/configuration-management/"">Chef</a>, <a href=""https://puppet.com/use-cases/configuration-management/"">Puppet</a>, and <a href=""https://docs.saltstack.com/en/latest/topics/states/"">Salt</a>.</p>  <p>Along the way, you’ll be exposed to key concepts such as <a href=""https://techlearningcollective.com/workshops/Ship-Shape-Computing-Working-with-Containers-and-Containzerizing-Digital-Workloads"">containerization</a> through Ansible’s support for automating container builds, <a href=""https://techlearningcollective.com/con"">Role-Based Access Control (RBAC)</a> via Ansible’s AWX Project, and more. By adopting configuration management workflows with tools like Ansible, you can reduce operator errors, and beat back configuration drift on any long-lived infrastructure components.</p></blockquote><p>As this is a remote/online-only event, there is no physical class space, but attendance is still limited to 15 students, so <a href=""#tickets-workshop-2022-02-05-faster-than-light-getting-started-with-configuration-management"">purchase your ticket now</a> to reserve your spot.</p><p>To participate in our webinars, you will need access to a modern Web browser such as an up-to-date copy of <a href=""https://www.mozilla.org/firefox/"">Mozilla Firefox</a> or <a href=""https://www.google.com/chrome/"">Google Chrome</a>. You will also need a reliable Internet connection. We recommend disabling Wi-Fi and plugging your computer in to a hard-wired Ethernet network cable for the duration of the webinar, if possible.</p><p>If you would like to share your video screen or appear on camera, you will need to have and activate your own camera, such as the one built-in to many modern laptops. Similarly, to speak with the rest of the webinar participants, you will need a microphone. If you do choose to activate your microphone, we ask that you please plug in headphones/ear buds or use a headset in order to help reduce audio feedback loops that can degrade the webinar experience for other participants.</p><p>Please refer to <a href=""https://techlearningcollective.com/faq/#workshops-and-webinars"">our workshops and webinars FAQ</a> for additional tips and advice before you join the video conference.</p><p>As with all Tech Learning Collective events, racism, queerphobia, transphobia, sexism, “brogrammer,” “manarchist,” or any kind of similarly awful behavior <em>will</em> result in immediate removal from class without a refund. Please refer to <a href=""https://github.com/AnarchoTechNYC/meta/wiki/Social-rules"">our lightweight social rules</a> for details on our strictly enforced no-tolerance policy against bigotry of any kind.</p><h2 id=""about-tech-learning-collective"">About Tech Learning Collective</h2><p>Tech Learning Collective is an apprenticeship-based technology school that trains politically self-motivated individuals in the arts of hypermedia, Information Technology, and radical political practice. We offer unparalleled free, by-donation, and low-cost computer classes on topics ranging from fundamental computer literacy to the same offensive computer hacking techniques used by national intelligence agencies and military powers (cyber armies). For more information and to enroll, visit <a href=""https://techlearningcollective.com/"">TechLearningCollective.com</a>.</p>","There are no special instructions for this event.","techlearningcollective@riseup.net","","","","","","15","","","","15:00","02/05/22","true","","","","","","en","http://techlearningcollective.com/events/2022/02/workshop-2022-02-05-faster-than-light-getting-started-with-configuration-management","","","","","","","","","","","http://techlearningcollective.com/events/2022/02/workshop-2022-02-05-faster-than-light-getting-started-with-configuration-management"
