event_title,administrative_title,location_name,address,city,state,zip,country,time,date,timezone,host,attendee_pitch,attendee_instructions,host_contact_info,van_id,shift_id,role_id,status_id,custom_fields,rsvp_limit,automatic_notifications,display_sharing_options,submit_button_title,end_date,end_time,disable_discussions,reminder_message,reminder_from,reminder_subject,reminder_reply_to,allow_guests,language,redirect_url,email_response,response_message,response_from,response_subject,response_reply_to,twitter_share,email_share,facebook_title,facebook_link,facebook_description,direct_link
"Hex90: Cold Boot","Hex90: Cold Boot (at Wonderville on January 15, 2022)","Wonderville","1186 Broadway","Brooklyn","NY","11221","","21:00","01/15/22","","techlearningcollective@riseup.net","<p>Queer hackers of the world, unite! Tech Learning Collective is excited to invite you to <a href=""https://hex90.party/"">Hex90’s latest queer hacker salon, “Cold Boot,”</a> hosted at <a href=""https://wonderville.nyc/"">Wonderville</a>, where some of our teaching staff will be on-hand to assist players as they navigate <a href=""https://hex90.party/trailer.html"">the party’s “cybersecurity alternate reality experience” game</a> produced in partnership with the semi-elusive NYC-based hacklab, <a href=""https://shiftctrl.space/"">Shift-CTRL Space</a>.</p><p>Meet other queerdos and 1337 femmes revolutionizing New York City’s burgeoning cyber underground. Then test your pinball wizardry on A Place to Bury Strangers, navigate Particle Mace’s deadly asteroid fields, or survive the single-pixel gauntlet of Line Wobbler.</p><p>Connect with your laptop or smartphone to plug into the <a href=""https://hex90.party/trailer.html"">party’s exclusive alternate reality cybersecurity experience</a> where you’ll help save the world from evil corporations and top-secret government cover ups.</p><pre style=""white-space: pre-wrap;""><code class=""language-txt"">R  2021-11-15FM HEX90TO QUEER HACKERS OF THE WORLDCOLD BOOT (SECRET//NOFORN)HEX90 — a queer hacker salon in nycThe most powerful magic of all is the power of language.Perhaps you are still becoming aware of yourself as a magician. Perhaps you can already code, but don't feel connected to the vibrating silicon enchanting your every keypress when you inscribe your intentions as spell-craft into your computer. Perhaps you don't yet know how to write the proper incantations, but already feel strangely drawn to the arcane sigils and symbols animating the metal and electric fires in your machine.We are witches, wizards, and techno-sorceresses. The shape shifters, the body-changers, the tele-mindful whose technology is humanity and connection itself. We were the original programmers, the first hackers. And now, we are returning.info_January 15, 2022 @ Wonderville1186 Broadway, Brooklyn, NY 112219pm - 2am~ this venue is accessible~ this venue has gender-neutral restrooms# dressing up is encouraged but not requiredfeaturing_~ music performance by DJ Niyah West (XOXA)~ visuals &amp; livecoding by Char Stiles (Livecode.NYC)~ indie arcade cabinets by Death By Audio~ hacking demos &amp; education by Tech Learning Collective~ augmented reality cybersecurity game by Shift-CTRL Space#------------------------##  TICKETS ON SALE SOON  ##------------------------#Advance cover:$15.00 - str8t cismen$10.00 - queers and femmesAt the door:$20.00 - str8t cismen$15.00 - queers and femmes/** * Hex90 is an inclusive event. * Door staff is instructed to respect your self-identification. */NOTICE:This is an intentionally queer space. Consent and respect are not optional! Anyone acting shitty will be removed immediately without a refund. No amount of racism, queerphobia, transphobia, or sexism will be tolerated. This event is a celebration of queer hacking for queer hackers, not for Silicon Valley entrepreneurs, brogrammers, or BitCoin bros. Don't piss off the hackers. ;)Hex90###</code></pre><p><a href=""https://hex90.party/"">Start playing immediately and buy your ticket at the invitation site</a>.</p><ul>  <li>    <p><a href=""https://hex90.techlearningcollective.com/#buy-tickets"">$15 - General Admission</a></p>  </li>  <li>    <p><a href=""https://hex90.techlearningcollective.com/#buy-tickets"">$10 - Queers and Femmes</a></p>  </li></ul><p>As with all Tech Learning Collective events, racism, queerphobia, transphobia, sexism, “brogrammer,” “manarchist,” or any kind of similarly awful behavior <em>will</em> result in immediate removal from the event without a refund. Please refer to <a href=""https://github.com/AnarchoTechNYC/meta/wiki/Social-rules"">our lightweight social rules</a> for details on our strictly enforced no-tolerance policy against bigotry of any kind.</p><h2 id=""about-shift-ctrl-space"">About <a href=""https://shiftctrl.space/"">Shift-CTRL Space</a></h2><p>We are anti-(techno)capitalists, solarpunks, and radical technologists. Our ethics place us against “Adtech,” “Fintech,” and Silicon Valley. We believe technology is an intangible earth, with which we can and should have an earthly relationship. It is power that we can harness through holistic methods as individuals and cooperative networks for the empowerment of oneself and of one’s actual communities. Our approach stands in contrast to isolationism, sterility, and authoritarianism by being participatory, flexible, and adaptive.</p><h2 id=""about-xoxa"">About XOXA</h2><p>XOXA (pronounced ex-oh-ex-ay) is a Brooklyn based queer collective of DJs, artists and performers founded in 2017. Their mission is to provide a supportive platform for women and LGBTQ+ artists to perform while creating an intentional party space for women, non-binary and trans individuals. You can follow <a href=""https://www.facebook.com/xoxanyc"">@xoxanyc on Facebook</a> and <a href=""https://www.instagram.com/xoxanyc"">Instagram</a> for more information on upcoming events and projects.</p><h2 id=""about-dj-niyah-west"">About DJ Niyah West</h2><p>Niyah West (she/they) is a DJ, music curator and digital artist based in New York City. From the living rooms of dear friends to the night clubs, Niyah made her professional debut just this year during pride month. Thus, making her a bright newcomer in the queer DJ scene. She has amplified parties and dancefloors all over the boroughs, some recently including MEOW NYC, Gayjoy &amp; a residency at Kind Regards in the Lower East Side. She’s also a resident of Brooklyn based queer DJ collective XOXA NYC.</p><h2 id=""about-livecodenyc"">About <a href=""https://livecode.nyc/"">LiveCode.NYC</a></h2><p>We are primarily a meetup group who gets together to discuss programming in real time. We view live coding as a methodology and not medium specific. Some of our members code graphics, games, VR and a handful live code music. Many languages are used within the group, without one being prioritised. Many of us are artists. Sometimes we run events. The core of what we do is share live coding, whether discussing types at our meetups or teaching a system one of us built. We hope to continue to find ways in which we can do this, as a collective.</p><h2 id=""about-char-stiles"">About <a href=""http://charstiles.com/"">Char Stiles</a></h2><p>Char Stiles is an artist, educator and programmer based in Brooklyn, NY. She works creatively in the lower levels of computational systems to bring to light how computers work. Char works and collaborates across mediums such as interactive installation, video, performance and web. She is a part of the Livecode.nyc collective, where she organizes shows, and livecodes music and visuals.</p><h2 id=""about-death-by-audio"">About Death By Audio</h2><p>The <a href=""https://www.deathbyaudioarcade.com/"">Death By Audio Arcade</a> is a series of lovingly crafted local multiplayer arcade cabinets produced by local indie game developers. We are also a progressive, open community of like-minded artists, artisans, and enthusiasts. We host events at least once a month, in NYC and at events across the country, from SXSW to the Smithsonian.</p><h2 id=""about-tech-learning-collective"">About Tech Learning Collective</h2><p>Tech Learning Collective is an apprenticeship-based technology school that trains politically self-motivated individuals in the arts of hypermedia, Information Technology, and radical political practice. We offer unparalleled free, by-donation, and low-cost computer classes on topics ranging from fundamental computer literacy to the same offensive computer hacking techniques used by national intelligence agencies and military powers (cyber armies). For more information and to enroll, visit <a href=""https://techlearningcollective.com/"">TechLearningCollective.com</a>.</p>","There are no special instructions for this event.","techlearningcollective@riseup.net","","","","","","","","","","02:00","01/16/22","true","","","","","","en","http://techlearningcollective.com/events/2022/01/event-2022-01-15-hex90-cold-boot","","","","","","","","","","","http://techlearningcollective.com/events/2022/01/event-2022-01-15-hex90-cold-boot"
"Computer Language Foundations: Command Line Basics","Computer Language Foundations: Command Line Basics (at  on January 22, 2022)","","","","","","","13:30","01/22/22","","techlearningcollective@riseup.net","<p>You have read about people who can talk to machines. Maybe you imagined secret chambers, hidden away behind locked doors, with dark rooms basking in blue from electric fires. Some of these people seemed friendly, others scary, but all of them were powerful. How did they learn to communicate with their computers? This is your chance to learn the foundations of all computer languages, the command line, and actually begin to talk to a machine yourself.</p><h2 id=""workshop-description"">Workshop Description</h2><blockquote>  <p>To be useful, every computer must offer some way for you to control it. Generically, the way you can control a computer is called a <em>user interface</em> because it allows you (the user) to interact with (that is, “to interface with”) the computer system. Most people may already be familiar with <em>Graphical User Interfaces</em> or GUIs, which are the buttons, windows, and other controls that you can point-and-click on, but this way of controlling a computer comes with severe limitations. Chief among these is the fact that you are limited to using only one tip of one finger on one of your hands (called your <em>pointer</em> or <em>mouse cursor</em>) and, worse, you have no access to anything outside of your immediate reach. In a GUI, if you cannot see it or touch it with the mouse, you cannot manipulate it.</p>  <p>This is why almost all hackers, programmers, and system administrators prefer a Command Line Interface or CLI over the graphical options for many, if not most, of their day-to-day tasks. In a command-line, or “terminal,” you can use the complete expressive power of spoken language to control your computer. You can use symbolism and metaphor to express any idea that you have the words for. Moreover, you always have all the words you know at your disposal at any time, even if they refer to things that are far away or that you cannot currently see.</p>  <p>In this beginner’s workshop, you’ll learn how to access the command line interface of your computer, and you’ll learn the basic grammar of command line languages such as that provided by the ubiquitous Bash command interpreter. You’ll also be introduced to the basic set of utilities required to quickly accomplish tasks that require working with files and folders, processing text, and automating common workflows that would take dozens or even hundreds of clicks with a mouse to complete in a Graphical User Interface. By learning how to “speak” to your computer using a command language, you can save hours every day and take your first step toward using your computer the way the best hackers would.</p></blockquote><p>As this is a remote/online-only event, there is no physical class space, but attendance is still limited to 15 students, so <a href=""#tickets-workshop-2022-01-22-computer-language-foundations-command-line-basics"">purchase your ticket now</a> to reserve your spot.</p><p>To participate in our webinars, you will need access to a modern Web browser such as an up-to-date copy of <a href=""https://www.mozilla.org/firefox/"">Mozilla Firefox</a> or <a href=""https://www.google.com/chrome/"">Google Chrome</a>. You will also need a reliable Internet connection. We recommend disabling Wi-Fi and plugging your computer in to a hard-wired Ethernet network cable for the duration of the webinar, if possible.</p><p>If you would like to share your video screen or appear on camera, you will need to have and activate your own camera, such as the one built-in to many modern laptops. Similarly, to speak with the rest of the webinar participants, you will need a microphone. If you do choose to activate your microphone, we ask that you please plug in headphones/ear buds or use a headset in order to help reduce audio feedback loops that can degrade the webinar experience for other participants.</p><p>Please refer to <a href=""https://techlearningcollective.com/faq/#workshops-and-webinars"">our workshops and webinars FAQ</a> for additional tips and advice before you join the video conference.</p><p>As with all Tech Learning Collective events, racism, queerphobia, transphobia, sexism, “brogrammer,” “manarchist,” or any kind of similarly awful behavior <em>will</em> result in immediate removal from class without a refund. Please refer to <a href=""https://github.com/AnarchoTechNYC/meta/wiki/Social-rules"">our lightweight social rules</a> for details on our strictly enforced no-tolerance policy against bigotry of any kind.</p><h2 id=""about-tech-learning-collective"">About Tech Learning Collective</h2><p>Tech Learning Collective is an apprenticeship-based technology school that trains politically self-motivated individuals in the arts of hypermedia, Information Technology, and radical political practice. We offer unparalleled free, by-donation, and low-cost computer classes on topics ranging from fundamental computer literacy to the same offensive computer hacking techniques used by national intelligence agencies and military powers (cyber armies). For more information and to enroll, visit <a href=""https://techlearningcollective.com/"">TechLearningCollective.com</a>.</p>","There are no special instructions for this event.","techlearningcollective@riseup.net","","","","","","15","","","","15:00","01/22/22","true","","","","","","en","http://techlearningcollective.com/events/2022/01/workshop-2022-01-22-computer-language-foundations-command-line-basics","","","","","","","","","","","http://techlearningcollective.com/events/2022/01/workshop-2022-01-22-computer-language-foundations-command-line-basics"
"Digital Defenses for the People: Practical Digital Security","Digital Defenses for the People: Practical Digital Security (at  on January 23, 2022)","","","","","","","13:30","01/23/22","","techlearningcollective@riseup.net","<p>This beginner-friendly introduction to digital safety will cut through the fear, uncertainty, and doubt generated by the frenetic news cycle and the latest Internet privacy listicle, and offer an opportunity to ask your most pressing online privacy and digital security questions. By learning about foundational frameworks that cybersecurity professionals use to assess risk and safety such as the CIA triad and the three states of data, you’ll build an understanding of information security from first principles to advanced techniques. By the end of this workshop, you will be able to apply these building blocks to anything and everything you do online, or in the streets.</p><h2 id=""workshop-description"">Workshop Description</h2><blockquote>  <p>Learning how to stay safe online is on many people’s minds, but how do you start this process? With so many tools and suggestions from “experts,” how do you know which tool to use, when, and in what situation? Do you really need a VPN? (And what even is that?) What are the tools you really <em>should</em> use, and which tools aren’t worth it? Moreover, without being a cybersecurity expert yourself, how do you learn to sniff out the useful stuff from the placebos?</p>  <p>This beginner’s workshop taught by the <a href=""https://techlearningcollective.com/"">Tech Learning Collective</a>’s cybersecurity trainers offers <a href=""https://techlearningcollective.com/about/persona-matrix/"">a simple framework</a> anyone can use to understand what risks they might face and how to protect themselves from those risks. <a href=""https://github.com/AnarchoTechNYC/meta/wiki/Persona-based-training-matrix"">Developed and maintained by the Anarcho-Tech NYC Collective</a>, an independent cybersecurity research group that provides digital security services to anti-fascist groups in New York City, this framework now forms the basis of many digital safety workshops. It is a simple three-by-three grid in which you can place both yourself and your online safety concerns by answering a few intuitive questions like “How likely is it that I will be targeted?” and “How many resources (money, people, etcetera) does my attacker have?”</p>  <p>Although <a href=""https://prism-break.org/en/"">there are many good and free tools available</a>, most people only need to use a few basic ones: a secure messaging application (like <a href=""https://techlearningcollective.com/workshops/Signal-and-Surveillance-How-to-Exercise-Digital-Civil-Liberties-in-a-Surveillance-State"">Signal</a>), a password manager (like <a href=""https://keepass.info/"">KeePass</a> or <a href=""https://bitwarden.com/"">Bitwarden</a>, and a few of the built-in features of their existing computers, like the full-disk encryption software available for free on every modern laptop and smartphone. This short, calming introduction to digital safety cuts through the fear, uncertainty, and doubt generated by the frenetic news cycle and the latest Internet privacy listicle. You’ll leave this workshop with a security plan in place, and a much clearer picture of the first few steps you <em>should</em> take to protect yourself and your information both online and offline.</p></blockquote><p>As this is a remote/online-only event, there is no physical class space, but attendance is still limited to 15 students, so <a href=""#tickets-workshop-2022-01-23-digital-defenses-for-the-people-practical-digital-security"">purchase your ticket now</a> to reserve your spot.</p><p>To participate in our webinars, you will need access to a modern Web browser such as an up-to-date copy of <a href=""https://www.mozilla.org/firefox/"">Mozilla Firefox</a> or <a href=""https://www.google.com/chrome/"">Google Chrome</a>. You will also need a reliable Internet connection. We recommend disabling Wi-Fi and plugging your computer in to a hard-wired Ethernet network cable for the duration of the webinar, if possible.</p><p>If you would like to share your video screen or appear on camera, you will need to have and activate your own camera, such as the one built-in to many modern laptops. Similarly, to speak with the rest of the webinar participants, you will need a microphone. If you do choose to activate your microphone, we ask that you please plug in headphones/ear buds or use a headset in order to help reduce audio feedback loops that can degrade the webinar experience for other participants.</p><p>Please refer to <a href=""https://techlearningcollective.com/faq/#workshops-and-webinars"">our workshops and webinars FAQ</a> for additional tips and advice before you join the video conference.</p><p>As with all Tech Learning Collective events, racism, queerphobia, transphobia, sexism, “brogrammer,” “manarchist,” or any kind of similarly awful behavior <em>will</em> result in immediate removal from class without a refund. Please refer to <a href=""https://github.com/AnarchoTechNYC/meta/wiki/Social-rules"">our lightweight social rules</a> for details on our strictly enforced no-tolerance policy against bigotry of any kind.</p><h2 id=""about-tech-learning-collective"">About Tech Learning Collective</h2><p>Tech Learning Collective is an apprenticeship-based technology school that trains politically self-motivated individuals in the arts of hypermedia, Information Technology, and radical political practice. We offer unparalleled free, by-donation, and low-cost computer classes on topics ranging from fundamental computer literacy to the same offensive computer hacking techniques used by national intelligence agencies and military powers (cyber armies). For more information and to enroll, visit <a href=""https://techlearningcollective.com/"">TechLearningCollective.com</a>.</p>","There are no special instructions for this event.","techlearningcollective@riseup.net","","","","","","15","","","","15:00","01/23/22","true","","","","","","en","http://techlearningcollective.com/events/2022/01/workshop-2022-01-23-digital-defenses-for-the-people-practical-digital-security","","","","","","","","","","","http://techlearningcollective.com/events/2022/01/workshop-2022-01-23-digital-defenses-for-the-people-practical-digital-security"
