event_title,administrative_title,location_name,address,city,state,zip,country,time,date,timezone,host,attendee_pitch,attendee_instructions,host_contact_info,van_id,shift_id,role_id,status_id,custom_fields,rsvp_limit,automatic_notifications,display_sharing_options,submit_button_title,end_date,end_time,disable_discussions,reminder_message,reminder_from,reminder_subject,reminder_reply_to,allow_guests,language,redirect_url,email_response,response_message,response_from,response_subject,response_reply_to,twitter_share,email_share,facebook_title,facebook_link,facebook_description,direct_link
"The Web as a Language: What No One Ever Told You About HTML That You Didn't Know To Ask","The Web as a Language: What No One Ever Told You About HTML That You Didn't Know To Ask (at  on February 13, 2021)","","","","","","","15:30","02/13/21","","techlearningcollective@riseup.net","<p>To take full advantage of the Web, especially as a digital publishing medium, you need to start by using the full expressive power of its most fundamental part: the simple HTML “Web page.” This workshop covers HTML, the HyperText Markup Language, as though it were a language in which you can write poems as well as tables of facts and figures, because it is! Learn how to structure your pages in digital rhyme and meter and find out why this approach results in better code for both beautiful designs and automated processes.</p><h2 id=""workshop-description"">Workshop Description</h2><blockquote>  <p>The Hypertext Markup Language (HTML) is the de-facto standard for publishing information online, a kind of digital equivalent to learning to read and write. Why, then, is it so rarely explained in terms of the <em>language</em> that it actually is? What is HTML’s grammar, where do HTML “sentences” begin and end, and how is meaning represented in its elements? You don’t need a computer science degree to learn a foreign language, and that includes HTML.</p>  <p>This workshop is designed for anyone who ever wanted to toy with HTML once or twice, whether it was in the 90’s or just last week. Based on a portion of the <a href=""https://techlearningcollective.com/courses/web101.html"">Tech Learning Collective’s WEB101 course</a>, it is a remarkably thorough treatment of some of the Web’s most powerful and most-often overlooked parts. Covering the structure of HTML and extending to the richness of semantic data formats like <a href=""https://en.wikipedia.org/wiki/Microdata_%28HTML%29"">Microdata</a> and <a href=""https://en.wikipedia.org/wiki/RDFa"">RDFa</a>, learn how to write in the Web’s native language so that both humans (like your friends and comrades) and machines (like Google!) can find, use, and most importantly <em>understand</em> what you’re saying.</p></blockquote><p>As this is a remote/online-only event, there is no physical class space, but attendance is still limited to 15 students, so <a href=""#tickets-workshop-2021-02-13-the-web-as-a-language-what-no-one-ever-told-you-about-html-that-you-didnt-know-to-ask"">purchase your ticket now</a> to reserve your spot.</p><p>To participate in our webinars, you will need access to a modern Web browser such as an up-to-date copy of <a href=""https://www.mozilla.org/firefox/"">Mozilla Firefox</a> or <a href=""https://www.google.com/chrome/"">Google Chrome</a>. You will also need a reliable Internet connection. We recommend disabling Wi-Fi and plugging your computer in to a hard-wired Ethernet network cable for the duration of the webinar, if possible.</p><p>If you would like to share your video screen or appear on camera, you will need to have and activate your own camera, such as the one built-in to many modern laptops. Similarly, to speak with the rest of the webinar participants, you will need a microphone. If you do choose to activate your microphone, we ask that you please plug in headphones/ear buds or use a headset in order to help reduce audio feedback loops that can degrade the webinar experience for other participants.</p><p>Please refer to <a href=""https://techlearningcollective.com/faq/#workshops-and-webinars"">our workshops and webinars FAQ</a> for additional tips and advice before you join the video conference.</p><p>As with all Tech Learning Collective events, racism, queerphobia, transphobia, sexism, “brogrammer,” “manarchist,” or any kind of similarly awful behavior <em>will</em> result in immediate removal from class without a refund. Please refer to <a href=""https://github.com/AnarchoTechNYC/meta/wiki/Social-rules"">our lightweight social rules</a> for details on our strictly enforced no-tolerance policy against bigotry of any kind.</p><h2 id=""about-tech-learning-collective"">About Tech Learning Collective</h2><p>Tech Learning Collective is an apprenticeship-based technology school that trains politically self-motivated individuals in the arts of hypermedia, Information Technology, and radical political practice. We offer unparalleled free, by-donation, and low-cost computer classes on topics ranging from fundamental computer literacy to the same offensive computer hacking techniques used by national intelligence agencies and military powers (cyber armies). For more information and to enroll, visit <a href=""https://techlearningcollective.com/"">TechLearningCollective.com</a>.</p>","There are no special instructions for this event.","techlearningcollective@riseup.net","","","","","","15","","","","17:00","02/13/21","true","","","","","","en","http://techlearningcollective.com/events/2021/02/workshop-2021-02-13-the-web-as-a-language-what-no-one-ever-told-you-about-html-that-you-didnt-know-to-ask","","","","","","","","","","","http://techlearningcollective.com/events/2021/02/workshop-2021-02-13-the-web-as-a-language-what-no-one-ever-told-you-about-html-that-you-didnt-know-to-ask"
"Gone Phishing: How to Recognize Fake Websites and Other Online Scams","Gone Phishing: How to Recognize Fake Websites and Other Online Scams (at  on February 14, 2021)","","","","","","","15:30","02/14/21","","techlearningcollective@riseup.net","<p>The most common way hackers steal passwords, install malware on a victim’s computer, or get employees to grant them unauthorized access to critical business systems is through so-called phishing attacks. A phishing attack is surprisingly low-tech, which is part of what makes it so devastatingly effective. Learning to spot these attacks is one of the most important things you can do to protect yourself online, since a hacker’s tricks, called “lures,” can appear anywhere from an email, to a Facebook message, to a real Web site that looks exactly like one you recognize! In this workshop, you’ll learn how frighteningly easy it is to build these scam sites, and all about the tricks they use to fool you into falling for them.</p><h2 id=""workshop-description"">Workshop Description</h2><blockquote>  <p>Whether it’s corporate espionage, ransomware, or online fraud, most cyber attacks don’t start with sophisticated software exploits, but rather by employing relatively simple tricks. These tricks are called “phishing” attacks because, much like baiting a lure, they won’t work unless you bite. However, <em>many</em> people do get caught up by them.</p>  <p>In 2019, <a href=""https://retruster.com/blog/2019-phishing-and-email-fraud-statistics.html"">ninety percent (90%!)</a> of reported <a href=""https://www.privacyrights.org/data-breaches"">data breaches</a> began with a simple phishing scam, costing businesses <a href=""https://retruster.com/blog/2019-phishing-and-email-fraud-statistics.html"">over $12 billion in losses</a>. Phishing attacks are the most common type of cyberattack on the Internet today, with <a href=""https://www.webroot.com/us/en/about/press-room/releases/nearly-15-million-new-phishing-sites"">one and a half million new phishing websites launched every month</a>. Thankfully, it’s easy to spot—and even to perform—these tricks if you have the right guidance.</p>  <p>For example, when you’re at a cafe and you ask the patron next to you to watch your belongings, your stuff will probably be safe when you return. But how safe would you feel if the patron at the next table turned to you and <em>offered</em> to watch your belongings when you next needed to use the restroom? If you had two different reactions to these scenarios, you already have the intuition you need to understand how the overwhelming majority of cybercrime gets a foothold inside your company, home, or organization’s network.</p>  <p>In this workshop, derived from a portion of the <a href=""https://techlearningcollective.com/courses/sec101.html"">Tech Learning Collective’s popular “Hacking with Mr. Robot” Security 101 course</a>, you will have the opportunity to create and deploy your own phishing Web site that can steal usernames and passwords from unsuspecting victims. By learning how attackers build pixel-perfect replicas of familiar sites like the Facebook login screen, you will also gain the skills you need to more quickly recognize the signs of a malicious web site, email, or other online scam.</p></blockquote><p>As this is a remote/online-only event, there is no physical class space, but attendance is still limited to 15 students, so <a href=""#tickets-workshop-2021-02-14-gone-phishing-how-to-recognize-fake-websites-and-other-online-scams"">purchase your ticket now</a> to reserve your spot.</p><p>To participate in our webinars, you will need access to a modern Web browser such as an up-to-date copy of <a href=""https://www.mozilla.org/firefox/"">Mozilla Firefox</a> or <a href=""https://www.google.com/chrome/"">Google Chrome</a>. You will also need a reliable Internet connection. We recommend disabling Wi-Fi and plugging your computer in to a hard-wired Ethernet network cable for the duration of the webinar, if possible.</p><p>If you would like to share your video screen or appear on camera, you will need to have and activate your own camera, such as the one built-in to many modern laptops. Similarly, to speak with the rest of the webinar participants, you will need a microphone. If you do choose to activate your microphone, we ask that you please plug in headphones/ear buds or use a headset in order to help reduce audio feedback loops that can degrade the webinar experience for other participants.</p><p>Please refer to <a href=""https://techlearningcollective.com/faq/#workshops-and-webinars"">our workshops and webinars FAQ</a> for additional tips and advice before you join the video conference.</p><p>As with all Tech Learning Collective events, racism, queerphobia, transphobia, sexism, “brogrammer,” “manarchist,” or any kind of similarly awful behavior <em>will</em> result in immediate removal from class without a refund. Please refer to <a href=""https://github.com/AnarchoTechNYC/meta/wiki/Social-rules"">our lightweight social rules</a> for details on our strictly enforced no-tolerance policy against bigotry of any kind.</p><h2 id=""about-tech-learning-collective"">About Tech Learning Collective</h2><p>Tech Learning Collective is an apprenticeship-based technology school that trains politically self-motivated individuals in the arts of hypermedia, Information Technology, and radical political practice. We offer unparalleled free, by-donation, and low-cost computer classes on topics ranging from fundamental computer literacy to the same offensive computer hacking techniques used by national intelligence agencies and military powers (cyber armies). For more information and to enroll, visit <a href=""https://techlearningcollective.com/"">TechLearningCollective.com</a>.</p>","There are no special instructions for this event.","techlearningcollective@riseup.net","","","","","","15","","","","17:00","02/14/21","true","","","","","","en","http://techlearningcollective.com/events/2021/02/workshop-2021-02-14-gone-phishing-how-to-recognize-fake-websites-and-other-online-scams","","","","","","","","","","","http://techlearningcollective.com/events/2021/02/workshop-2021-02-14-gone-phishing-how-to-recognize-fake-websites-and-other-online-scams"
"Collaboration Across Universes: Basics of Version Control with Git","Collaboration Across Universes: Basics of Version Control with Git (at  on February 20, 2021)","","","","","","","15:30","02/20/21","","techlearningcollective@riseup.net","<p>Ever work on a project with other people? Of course you do. If you’ve been saving files with names like “Project-outline-1” and then saving another version of that file as “Project-outline-2” then you already understand the importance of a Version Control System (VCS). In this beginner’s workshop, you’ll see the popular Git version control system in action and learn how to improve your collaborative workflow whether you’re a software engineer, novelist, or art designer.</p><h2 id=""workshop-description"">Workshop Description</h2><blockquote>  <p>As most of us know first-hand, the creative process involves many edits and revisions. Adding a little bit here, trimming a little bit there, but then hitting “undo” a bunch and experimenting with a new direction is quite normal! When your project is a single file, pressing “Save As…” many times might suffice, but what if your project spans dozens or even hundreds of files?</p>  <p>This is where version control systems (VCSs) shine. Designed to track, compare, and merge different versions of the same project, these tools give you the ability to make a snapshot of the state of your work at a given point in time so that you can “undo” or “redo” any number of times, across any number of files. Moreover, by naming different snapshots, you can create an infinite number of variations of your project and then build on those unique versions without affecting the others; it’s as though the new version is in its own alternate universe. This makes it possible to easily and safely experiment in one universe (called a <em>branch</em>) without throwing away or overwriting the original version of the project on which your changes were based.</p>  <p>In this beginner’s workshop, you’ll learn the basics of <a href=""https://git-scm.com/"">Git</a>, a free distributed version control system on which popular sites like <a href=""https://github.com/"">GitHub</a> are based. Git is lovingly called “the stupid content tracker” because it can track changes to everything and anything that can be digitized. Although it was originally invented for software programmers, Git is also useful for novelists, researchers, and anyone else whose work involves creativity in a digital medium.</p></blockquote><p>As this is a remote/online-only event, there is no physical class space, but attendance is still limited to 15 students, so <a href=""#tickets-workshop-2021-02-20-collaboration-across-universes-basics-of-version-control-with-git"">purchase your ticket now</a> to reserve your spot.</p><p>To participate in our webinars, you will need access to a modern Web browser such as an up-to-date copy of <a href=""https://www.mozilla.org/firefox/"">Mozilla Firefox</a> or <a href=""https://www.google.com/chrome/"">Google Chrome</a>. You will also need a reliable Internet connection. We recommend disabling Wi-Fi and plugging your computer in to a hard-wired Ethernet network cable for the duration of the webinar, if possible.</p><p>If you would like to share your video screen or appear on camera, you will need to have and activate your own camera, such as the one built-in to many modern laptops. Similarly, to speak with the rest of the webinar participants, you will need a microphone. If you do choose to activate your microphone, we ask that you please plug in headphones/ear buds or use a headset in order to help reduce audio feedback loops that can degrade the webinar experience for other participants.</p><p>Please refer to <a href=""https://techlearningcollective.com/faq/#workshops-and-webinars"">our workshops and webinars FAQ</a> for additional tips and advice before you join the video conference.</p><p>As with all Tech Learning Collective events, racism, queerphobia, transphobia, sexism, “brogrammer,” “manarchist,” or any kind of similarly awful behavior <em>will</em> result in immediate removal from class without a refund. Please refer to <a href=""https://github.com/AnarchoTechNYC/meta/wiki/Social-rules"">our lightweight social rules</a> for details on our strictly enforced no-tolerance policy against bigotry of any kind.</p><h2 id=""about-tech-learning-collective"">About Tech Learning Collective</h2><p>Tech Learning Collective is an apprenticeship-based technology school that trains politically self-motivated individuals in the arts of hypermedia, Information Technology, and radical political practice. We offer unparalleled free, by-donation, and low-cost computer classes on topics ranging from fundamental computer literacy to the same offensive computer hacking techniques used by national intelligence agencies and military powers (cyber armies). For more information and to enroll, visit <a href=""https://techlearningcollective.com/"">TechLearningCollective.com</a>.</p>","There are no special instructions for this event.","techlearningcollective@riseup.net","","","","","","15","","","","17:00","02/20/21","true","","","","","","en","http://techlearningcollective.com/events/2021/02/workshop-2021-02-20-collaboration-across-universes-basics-of-version-control-with-git","","","","","","","","","","","http://techlearningcollective.com/events/2021/02/workshop-2021-02-20-collaboration-across-universes-basics-of-version-control-with-git"
"Developing Digital Dexterity: Introduction to JavaScript","Developing Digital Dexterity: Introduction to JavaScript (at  on February 21, 2021)","","","","","","","15:30","02/21/21","","techlearningcollective@riseup.net","<p>JavaScript is known for being “the Web programming language,” and while its capabilities in a Web browser have grown considerably, today JavaScript can also be used to automate mundane office jobs (e.g., Google Apps Script, Microsoft Office’s JavaScript API), develop PC games (using GDevelop), and much more. Learn what you need to know to get started with JavaScript in any environment in this workshop covering some common programming concepts as well as the quirks of the JavaScript language itself (functional scope, prototype-based object inheritance, etc.) so you can increase your digital dexterity whether in a Web browser, office job, or your own project.</p><h2 id=""workshop-description"">Workshop Description</h2><blockquote>  <p>Over the course of ten days in 1995, the Web changed forever when Brendan Eich was hired by Netscape, Inc. and developed a programming language that could be embedded in Web pages. Briefly named LiveScript, the language became known as JavaScript three months later, and was officially standardized as ECMAScript in 1997 after taking the Internet by storm only two years later. Today, JavaScript is arguably the single most popular and prolific high-level language available to many people for many projects.</p>  <p>Although most people know of JavaScript as the programming language of the Web, where <a href=""https://developer.mozilla.org/en-US/docs/Web/API"">its capabilities</a> have increased dramatically over the years, many other environments outside of the Web browser or traditional Web application now embed or rely on JavaScript engines to work. Entire back-end applications can be created with “server-side JavaScript” (<a href=""https://nodejs.org/"">Node.js</a>, <a href=""https://www.ringojs.org/"">RingoJS</a>); Internet-of-Things (IoT) devices like sensors and larger microcontrollers offer JavaScript scriptable interfaces (<a href=""https://www.espruino.com/"">Espruino</a>, <a href=""https://www.neonious.com/lowjs/"">low.js</a>); mundane office jobs and “paperwork” can be accomplished in JavaScript (<a href=""https://wiki.openoffice.org/wiki/Documentation/DevGuide/Scripting/JavaScript_Editor"">OpenOffice</a>/LibreOffice Script Provider, <a href=""https://developers.google.com/apps-script/"">Google Apps Script</a>, <a href=""https://docs.microsoft.com/en-us/javascript/api/overview"">Microsoft Office JavaScript API</a>); JavaScript can be used to write smart contracts for blockchain-based distributed ledger technologies (<a href=""https://www.hyperledger.org/use/fabric"">Hyperledger Fabric</a>); desktop and PC game programming can be done entirely in JavaScript (<a href=""https://gdevelop-app.com/javascript-game-engine/"">GDevelop</a>, <a href=""https://www.babylonjs.com/"">Babylon.js</a>); some other programming languages are implemented in JavaScript (<a href=""https://scratch.mit.edu/"">Scratch</a>); and JavaScript can even be used for macOS system automation tasks using the <a href=""https://en.wikipedia.org/wiki/AppleScript#Open_Scripting_Architecture"">Open Scripting Architecture (OSA) JavaScript for Automation extension</a>. Almost no other programming language is as easy to learn while offering the breadth of options that JavaScript does, which is one clear reason for the language’s popularity among developers and desirability among employers.</p>  <p>In this workshop, you’ll learn what you need to know to get started with JavaScript in any environment. By focusing on the language’s built-in constructs, you’ll be able to avoid many common pitfalls and understand what makes JavaScript tick. We’ll cover some programming basics common to all languages, but we’ll also show how JavaScript’s unusual rules (functional scope, prototype-based object inheritance, etc.) make it possible to write especially elegant—or especially dangerous—code, as well as showing you why developing even minimal proficiency with JavaScript will drastically increase your “digital dexterity” as you browse the Web.</p></blockquote><p>As this is a remote/online-only event, there is no physical class space, but attendance is still limited to 15 students, so <a href=""#tickets-workshop-2021-02-21-developing-digital-dexterity-introduction-to-javascript"">purchase your ticket now</a> to reserve your spot.</p><p>To participate in our webinars, you will need access to a modern Web browser such as an up-to-date copy of <a href=""https://www.mozilla.org/firefox/"">Mozilla Firefox</a> or <a href=""https://www.google.com/chrome/"">Google Chrome</a>. You will also need a reliable Internet connection. We recommend disabling Wi-Fi and plugging your computer in to a hard-wired Ethernet network cable for the duration of the webinar, if possible.</p><p>If you would like to share your video screen or appear on camera, you will need to have and activate your own camera, such as the one built-in to many modern laptops. Similarly, to speak with the rest of the webinar participants, you will need a microphone. If you do choose to activate your microphone, we ask that you please plug in headphones/ear buds or use a headset in order to help reduce audio feedback loops that can degrade the webinar experience for other participants.</p><p>Please refer to <a href=""https://techlearningcollective.com/faq/#workshops-and-webinars"">our workshops and webinars FAQ</a> for additional tips and advice before you join the video conference.</p><p>As with all Tech Learning Collective events, racism, queerphobia, transphobia, sexism, “brogrammer,” “manarchist,” or any kind of similarly awful behavior <em>will</em> result in immediate removal from class without a refund. Please refer to <a href=""https://github.com/AnarchoTechNYC/meta/wiki/Social-rules"">our lightweight social rules</a> for details on our strictly enforced no-tolerance policy against bigotry of any kind.</p><h2 id=""about-tech-learning-collective"">About Tech Learning Collective</h2><p>Tech Learning Collective is an apprenticeship-based technology school that trains politically self-motivated individuals in the arts of hypermedia, Information Technology, and radical political practice. We offer unparalleled free, by-donation, and low-cost computer classes on topics ranging from fundamental computer literacy to the same offensive computer hacking techniques used by national intelligence agencies and military powers (cyber armies). For more information and to enroll, visit <a href=""https://techlearningcollective.com/"">TechLearningCollective.com</a>.</p>","There are no special instructions for this event.","techlearningcollective@riseup.net","","","","","","15","","","","17:00","02/21/21","true","","","","","","en","http://techlearningcollective.com/events/2021/02/workshop-2021-02-21-developing-digital-dexterity-introduction-to-javascript","","","","","","","","","","","http://techlearningcollective.com/events/2021/02/workshop-2021-02-21-developing-digital-dexterity-introduction-to-javascript"
