event_title,administrative_title,location_name,address,city,state,zip,country,time,date,timezone,host,attendee_pitch,attendee_instructions,host_contact_info,van_id,shift_id,role_id,status_id,custom_fields,rsvp_limit,automatic_notifications,display_sharing_options,submit_button_title,end_date,end_time,disable_discussions,reminder_message,reminder_from,reminder_subject,reminder_reply_to,allow_guests,language,redirect_url,email_response,response_message,response_from,response_subject,response_reply_to,twitter_share,email_share,facebook_title,facebook_link,facebook_description,direct_link
"Collaboration Across Universes: Basics of Version Control with Git","Collaboration Across Universes: Basics of Version Control with Git (at  on February  3, 2020)","","","","","","","15:00","02/03/20","","techlearningcollective@riseup.net","<p>Ever work on a project with other people? Of course you do. If you’ve been saving files with names like “Project-outline-1” and then saving another version of that file as “Project-outline-2” then you already understand the importance of a Version Control System (VCS). In this beginner’s workshop, you’ll see the popular Git version control system in action and learn how to improve your collaborative workflow whether you’re a software engineer, novelist, or art designer.</p><h2 id=""workshop-description"">Workshop Description</h2><blockquote>  <p>As most of us know first-hand, the creative process involves many edits and revisions. Adding a little bit here, trimming a little bit there, but then hitting “undo” a bunch and experimenting with a new direction is quite normal! When your project is a single file, pressing “Save As…” many times might suffice, but what if your project spans dozens or even hundreds of files?</p>  <p>This is where version control systems (VCSs) shine. Designed to track, compare, and merge different versions of the same project, these tools give you the ability to make a snapshot of the state of your work at a given point in time so that you can “undo” or “redo” any number of times, across any number of files. Moreover, by naming different snapshots, you can create an infinite number of variations of your project and then build on those unique versions without affecting the others; it’s as though the new version is in its own alternate universe. This makes it possible to easily and safely experiment in one universe (called a <em>branch</em>) without throwing away or overwriting the original version of the project on which your changes were based.</p>  <p>In this beginner’s workshop, you’ll learn the basics of <a href=""https://git-scm.com/"">Git</a>, a free distributed version control system on which popular sites like <a href=""https://github.com/"">GitHub</a> are based. Git is lovingly called “the stupid content tracker” because it can track changes to everything and anything that can be digitized. Although it was originally invented for software programmers, Git is also useful for novelists, researchers, and anyone else whose work involves creativity in a digital medium.</p></blockquote><p>As this is a remote/online-only event, there is no physical class space, but attendance is still limited to 15 students, so <a href=""#tickets-workshop-2020-02-03-collaboration-across-universes-basics-of-version-control-with-git"">purchase your ticket now</a> to reserve your spot.</p><p>To participate in our webinars, you will need access to a modern Web browser such as an up-to-date copy of <a href=""https://www.mozilla.org/firefox/"">Mozilla Firefox</a> or <a href=""https://www.google.com/chrome/"">Google Chrome</a>. You will also need a reliable Internet connection. We recommend disabling Wi-Fi and plugging your computer in to a hard-wired Ethernet network cable for the duration of the webinar, if possible.</p><p>If you would like to share your video screen or appear on camera, you will need to have and activate your own camera, such as the one built-in to many modern laptops. Similarly, to speak with the rest of the webinar participants, you will need a microphone. If you do choose to activate your microphone, we ask that you please plug in headphones/ear buds or use a headset in order to help reduce audio feedback loops that can degrade the webinar experience for other participants.</p><p>Please refer to <a href=""https://techlearningcollective.com/faq/#workshops-and-webinars"">our workshops and webinars FAQ</a> for additional tips and advice before you join the video conference.</p><p>As with all Tech Learning Collective events, racism, queerphobia, transphobia, sexism, “brogrammer,” “manarchist,” or any kind of similarly awful behavior <em>will</em> result in immediate removal from class without a refund. Please refer to <a href=""https://github.com/AnarchoTechNYC/meta/wiki/Social-rules"">our lightweight social rules</a> for details on our strictly enforced no-tolerance policy against bigotry of any kind.</p><h2 id=""about-the-tech-learning-collective"">About the Tech Learning Collective</h2><p>Tech Learning Collective is an apprenticeship-based technology school that trains politically self-motivated individuals in the arts of hypermedia, Information Technology, and radical political practice. We offer unparalleled free, by-donation, and low-cost computer classes on topics ranging from fundamental computer literacy to the same offensive computer hacking techniques used by national intelligence agencies and military powers (cyber armies). For more information and to enroll, visit <a href=""https://techlearningcollective.com/"">TechLearningCollective.com</a>.</p>","There are no special instructions for this event.","techlearningcollective@riseup.net","","","","","","15","","","","16:30","02/03/20","true","","","","","","en","http://techlearningcollective.com/events/2020/02/workshop-2020-02-03-collaboration-across-universes-basics-of-version-control-with-git","","","","","","","","","","","http://techlearningcollective.com/events/2020/02/workshop-2020-02-03-collaboration-across-universes-basics-of-version-control-with-git"
"Clearing Away the Clouds: How Computer Networks, Servers, and the Internet Work","Clearing Away the Clouds: How Computer Networks, Servers, and the Internet Work (at  on February  8, 2020)","","","","","","","17:00","02/08/20","","techlearningcollective@riseup.net","<p>This two-hour workshop is all about the basics of computer networking. If you’ve ever been curious about what happens “on the wire” when you’re browsing a Web site, or if you ever wanted to take a look “under the hood” of your Wi-Fi connection, this is the class for you!</p><h2 id=""workshop-description"">Workshop Description</h2><blockquote>  <p>Our ability to browse Web sites, send and receive digital messages like emails and text messages, and make phone or video calls depends on the connections our digital devices make with one another. That makes it critical to understand how these connections are made, and where they lead to. Far from being an amorphous “cloud,” modern telecommunications networks and services like the Internet are made up of physical devices. Some of these you can see, like your own computer or the router and modem in your house, and others you can’t, like distant servers or Layer 2 switches that make up the network infrastructure itself.</p>  <p>In this workshop derived from a portion of the <a href=""https://techlearningcollective.com/courses/net101.html"">Tech Learning Collective’s NET101 course</a>, you’ll have the opportunity to actually look—visually and with great detail—at how your computer “talks” to other computers like those that power Google Drive, Facebook, and other cloud services. By using an industry-standard tool called <a href=""https://wireshark.org/"">Wireshark</a>, we’ll dissect a conversation between your computer and a server and walk through the process of encapsulating a packet of application layer data, emitting it onto a network, and watching it travel to its destination. We’ll also touch on some illustrative counter-examples to explore how things can go wrong on a network, such as <a href=""https://en.wikipedia.org/wiki/Dynamic_Host_Configuration_Protocol"">DHCP</a> server misconfigurations, <a href=""https://en.wikipedia.org/wiki/ARP_spoofing"">ARP spoofing attacks</a>, and unsecured or weakly-secured Wi-Fi networks.</p></blockquote><p>As this is a remote/online-only event, there is no physical class space, but attendance is still limited to 15 students, so <a href=""#tickets-workshop-2020-02-08-clearing-away-the-clouds-how-computer-networks-servers-and-the-internet-work"">purchase your ticket now</a> to reserve your spot.</p><p>To participate in our webinars, you will need access to a modern Web browser such as an up-to-date copy of <a href=""https://www.mozilla.org/firefox/"">Mozilla Firefox</a> or <a href=""https://www.google.com/chrome/"">Google Chrome</a>. You will also need a reliable Internet connection. We recommend disabling Wi-Fi and plugging your computer in to a hard-wired Ethernet network cable for the duration of the webinar, if possible.</p><p>If you would like to share your video screen or appear on camera, you will need to have and activate your own camera, such as the one built-in to many modern laptops. Similarly, to speak with the rest of the webinar participants, you will need a microphone. If you do choose to activate your microphone, we ask that you please plug in headphones/ear buds or use a headset in order to help reduce audio feedback loops that can degrade the webinar experience for other participants.</p><p>Please refer to <a href=""https://techlearningcollective.com/faq/#workshops-and-webinars"">our workshops and webinars FAQ</a> for additional tips and advice before you join the video conference.</p><p>As with all Tech Learning Collective events, racism, queerphobia, transphobia, sexism, “brogrammer,” “manarchist,” or any kind of similarly awful behavior <em>will</em> result in immediate removal from class without a refund. Please refer to <a href=""https://github.com/AnarchoTechNYC/meta/wiki/Social-rules"">our lightweight social rules</a> for details on our strictly enforced no-tolerance policy against bigotry of any kind.</p><h2 id=""about-the-tech-learning-collective"">About the Tech Learning Collective</h2><p>Tech Learning Collective is an apprenticeship-based technology school that trains politically self-motivated individuals in the arts of hypermedia, Information Technology, and radical political practice. We offer unparalleled free, by-donation, and low-cost computer classes on topics ranging from fundamental computer literacy to the same offensive computer hacking techniques used by national intelligence agencies and military powers (cyber armies). For more information and to enroll, visit <a href=""https://techlearningcollective.com/"">TechLearningCollective.com</a>.</p>","There are no special instructions for this event.","techlearningcollective@riseup.net","","","","","","15","","","","19:00","02/08/20","true","","","","","","en","http://techlearningcollective.com/events/2020/02/workshop-2020-02-08-clearing-away-the-clouds-how-computer-networks-servers-and-the-internet-work","","","","","","","","","","","http://techlearningcollective.com/events/2020/02/workshop-2020-02-08-clearing-away-the-clouds-how-computer-networks-servers-and-the-internet-work"
"Signal and Surveillance: How to Exercise Digital Civil Liberties in a Surveillance State","Signal and Surveillance: How to Exercise Digital Civil Liberties in a Surveillance State (at  on February 11, 2020)","","","","","","","15:00","02/11/20","","techlearningcollective@riseup.net","<p>This introductory cybersecurity workshop will show you why Signal, a free, secure, private message app is simple enough to schedule drinks with, yet secure enough to use for planning a protest. As dragnet surveillance practices are legalized at alarming speed, there has never been a more important time to flex your digital civil liberties muscle than right now.</p><h2 id=""workshop-description"">Workshop Description</h2><blockquote>  <p>Whether you’re an individual chatting with friends or an organizer planning a political action, all effective coordination depends on safe and reliable communication. Lacking integrity for our communications dooms any effort from the outset, whether mundane or revolutionary. As dragnet surveillance practices are legalized at alarming speed and continue to be fueled by a dramatic expansion of the law enforcement and private defense contractor economies, there has never been a more important time to flex your digital civil liberties muscle than right now.</p>  <p><a href=""https://signal.org/"">Signal</a> is the name of a Free Software, secure, private message application built on a cryptographic protocol of the same name. Formerly known as the Axolotl Ratchet or, more commonly, the <a href=""https://en.wikipedia.org/wiki/Double_Ratchet_Algorithm"">Double-Ratchet Algorithm</a>, its features are robust enough for the revolutionary activist (i.e., end-to-end encryption, message authentication, plausible deniability or message repudiation, perfect forward secrecy, and more) and yet simple enough to use as a drop-in replacement for your existing text messaging application. Signal also sports Skype-like voice and video calling, location- and file-sharing features, and even iMessage-style large font emojis!</p>  <p>If you’ve never heard of Signal before, now’s the time to switch. If you think you already know how to use Signal, let us show you some pro-tips (trusted third-party Safety Number verification, disappearing messages, registering Signal accounts with pseudonymous phone numbers, inactivity lock-outs, and Signal relay server IP address protection). This introductory cybersecurity workshop will show you why Signal is simple enough to schedule drinks at the bar with, yet secure enough to use for planning a protest.</p></blockquote><p>As this is a remote/online-only event, there is no physical class space, but attendance is still limited to 15 students, so <a href=""#tickets-workshop-2020-02-11-signal-and-surveillance-how-to-exercise-digital-civil-liberties-in-a-surveillance-state"">purchase your ticket now</a> to reserve your spot.</p><p>To participate in our webinars, you will need access to a modern Web browser such as an up-to-date copy of <a href=""https://www.mozilla.org/firefox/"">Mozilla Firefox</a> or <a href=""https://www.google.com/chrome/"">Google Chrome</a>. You will also need a reliable Internet connection. We recommend disabling Wi-Fi and plugging your computer in to a hard-wired Ethernet network cable for the duration of the webinar, if possible.</p><p>If you would like to share your video screen or appear on camera, you will need to have and activate your own camera, such as the one built-in to many modern laptops. Similarly, to speak with the rest of the webinar participants, you will need a microphone. If you do choose to activate your microphone, we ask that you please plug in headphones/ear buds or use a headset in order to help reduce audio feedback loops that can degrade the webinar experience for other participants.</p><p>Please refer to <a href=""https://techlearningcollective.com/faq/#workshops-and-webinars"">our workshops and webinars FAQ</a> for additional tips and advice before you join the video conference.</p><p>As with all Tech Learning Collective events, racism, queerphobia, transphobia, sexism, “brogrammer,” “manarchist,” or any kind of similarly awful behavior <em>will</em> result in immediate removal from class without a refund. Please refer to <a href=""https://github.com/AnarchoTechNYC/meta/wiki/Social-rules"">our lightweight social rules</a> for details on our strictly enforced no-tolerance policy against bigotry of any kind.</p><h2 id=""about-the-tech-learning-collective"">About the Tech Learning Collective</h2><p>Tech Learning Collective is an apprenticeship-based technology school that trains politically self-motivated individuals in the arts of hypermedia, Information Technology, and radical political practice. We offer unparalleled free, by-donation, and low-cost computer classes on topics ranging from fundamental computer literacy to the same offensive computer hacking techniques used by national intelligence agencies and military powers (cyber armies). For more information and to enroll, visit <a href=""https://techlearningcollective.com/"">TechLearningCollective.com</a>.</p>","There are no special instructions for this event.","techlearningcollective@riseup.net","","","","","","15","","","","16:30","02/11/20","true","","","","","","en","http://techlearningcollective.com/events/2020/02/workshop-2020-02-11-signal-and-surveillance-how-to-exercise-digital-civil-liberties-in-a-surveillance-state","","","","","","","","","","","http://techlearningcollective.com/events/2020/02/workshop-2020-02-11-signal-and-surveillance-how-to-exercise-digital-civil-liberties-in-a-surveillance-state"
"Securing Our Servers: Basic Network Operations for Autonomous Communities","Securing Our Servers: Basic Network Operations for Autonomous Communities (at  on February 13, 2020)","","","","","","","17:00","02/13/20","","techlearningcollective@riseup.net","<p>Learn the basics of securing digital infrastructure by taking a deep-dive into the Secure Shell (SSH) protocol, a fundamental component of safe administrative access to remote servers. Regardless of whether you rely on one or many thousands of servers to power your daily operations, securely managing those machines is essential to the success of your efforts. This intermediate-level workshop shows you how to securely set up, access, and debug connection issues over the SSH protocol so that you’ll be ready to operate self-hosted digital infrastructure for yourself, friends, or comrades.</p><h2 id=""workshop-description"">Workshop Description</h2><blockquote>  <p>Every app you use—from messengers like <a href=""https://signal.org/"">Signal</a> or WhatsApp to blogs and websites like <a href=""https://wordpress.org/"">WordPress</a> and even other coordination tools like digital calendars and <a href=""https://techlearningcollective.com/workshops/Our-Streets,-Our-Maps-Introduction-to-OpenStreetMap"">online maps</a>—relies on a computer called a server. Whether that computer is one in your hand (your smartphone), or a computer somewhere across the Internet (“in the cloud”), no meaningful digital communication happens without servers offering services, somewhere. So, do you know where <em>your</em> servers are? If not, you can’t know how safe your data is!</p>  <p>When you don’t have a clear map of how your messages and other data gets from here to there, you might be at risk of someone listening in on your conversations. When you rely on services that you don’t own yourself for critical day-to-day operations (like Google Calendar, or Facebook…) you risk losing access to those capabilities by having your account banned, even by mistake. Regardless of your specific situation, knowing more about the digital servers that are serving you is a vital first step for supporting communities or companies large and small.</p>  <p>This intermediate-level workshop combines various topics from the <a href=""https://techlearningcollective.com/courses/sys101.html"">Tech Learning Collective’s System Administration</a>, <a href=""https://techlearningcollective.com/courses/net101.html"">Networking</a>, and <a href=""https://techlearningcollective.com/courses/sec101.html"">Security</a> courses to offer an intensive crash course in secure server setup, monitoring, and maintenance. By taking a <a href=""https://github.com/AnarchoTechNYC/meta/blob/master/train-the-trainers/practice-labs/introduction-to-securing-virtualized-secure-shell-servers/README.md"">deep dive into the SSH protocol</a>, you’ll learn how to set up remote administrative access to a server in a safe way, and you’ll be exposed to the potential risks of network eavesdroppers, <a href=""https://en.wikipedia.org/wiki/Man-in-the-middle_attack"">Machine-in-the-Middle (MITM) attacks</a>, and much more. By the end of this workshop, you’ll have a basic understanding of how to safely operate self-hosted digital infrastructures for yourself, your friends, and your comrades, as well as what first steps you need to take to keep intruders and enemies at bay.</p></blockquote><p>As this is a remote/online-only event, there is no physical class space, but attendance is still limited to 15 students, so <a href=""#tickets-workshop-2020-02-13-securing-our-servers-basic-network-operations-for-autonomous-communities"">purchase your ticket now</a> to reserve your spot.</p><p>To participate in our webinars, you will need access to a modern Web browser such as an up-to-date copy of <a href=""https://www.mozilla.org/firefox/"">Mozilla Firefox</a> or <a href=""https://www.google.com/chrome/"">Google Chrome</a>. You will also need a reliable Internet connection. We recommend disabling Wi-Fi and plugging your computer in to a hard-wired Ethernet network cable for the duration of the webinar, if possible.</p><p>If you would like to share your video screen or appear on camera, you will need to have and activate your own camera, such as the one built-in to many modern laptops. Similarly, to speak with the rest of the webinar participants, you will need a microphone. If you do choose to activate your microphone, we ask that you please plug in headphones/ear buds or use a headset in order to help reduce audio feedback loops that can degrade the webinar experience for other participants.</p><p>Please refer to <a href=""https://techlearningcollective.com/faq/#workshops-and-webinars"">our workshops and webinars FAQ</a> for additional tips and advice before you join the video conference.</p><p>As with all Tech Learning Collective events, racism, queerphobia, transphobia, sexism, “brogrammer,” “manarchist,” or any kind of similarly awful behavior <em>will</em> result in immediate removal from class without a refund. Please refer to <a href=""https://github.com/AnarchoTechNYC/meta/wiki/Social-rules"">our lightweight social rules</a> for details on our strictly enforced no-tolerance policy against bigotry of any kind.</p><h2 id=""about-the-tech-learning-collective"">About the Tech Learning Collective</h2><p>Tech Learning Collective is an apprenticeship-based technology school that trains politically self-motivated individuals in the arts of hypermedia, Information Technology, and radical political practice. We offer unparalleled free, by-donation, and low-cost computer classes on topics ranging from fundamental computer literacy to the same offensive computer hacking techniques used by national intelligence agencies and military powers (cyber armies). For more information and to enroll, visit <a href=""https://techlearningcollective.com/"">TechLearningCollective.com</a>.</p>","There are no special instructions for this event.","techlearningcollective@riseup.net","","","","","","15","","","","19:00","02/13/20","true","","","","","","en","http://techlearningcollective.com/events/2020/02/workshop-2020-02-13-securing-our-servers-basic-network-operations-for-autonomous-communities","","","","","","","","","","","http://techlearningcollective.com/events/2020/02/workshop-2020-02-13-securing-our-servers-basic-network-operations-for-autonomous-communities"
