event_title,administrative_title,location_name,address,city,state,zip,country,time,date,timezone,host,attendee_pitch,attendee_instructions,host_contact_info,van_id,shift_id,role_id,status_id,custom_fields,rsvp_limit,automatic_notifications,display_sharing_options,submit_button_title,end_date,end_time,disable_discussions,reminder_message,reminder_from,reminder_subject,reminder_reply_to,allow_guests,language,redirect_url,email_response,response_message,response_from,response_subject,response_reply_to,twitter_share,email_share,facebook_title,facebook_link,facebook_description,direct_link
"Faster Than Light: Getting Started with Configuration Management","Faster Than Light: Getting Started with Configuration Management (at  on March  6, 2021)","","","","","","","15:30","03/06/21","","techlearningcollective@riseup.net","<p>Learn how to beat back configuration drift on your servers by leveraging automation tools like Ansible in this deep dive workshop demonstrating modern DevOps practices for deploying, maintaining, and auditing compute clusters. Whether for a Web application, big data processing, or other project, you need to turn old-school runbooks into computerized playbooks that can execute Standard Operating Procedures quickly and reliably so you can deploy complex systems simply and predictably. Come learn about key concepts like idempotence and change control, and learn how giant corporations implement security principles like RBAC, all using free and open source software.</p><h2 id=""workshop-description"">Workshop Description</h2><blockquote>  <p>Today, all but the most trivial of computer systems rely on an interdependent set of servers working in concert. You don’t just have one server, you have a group of them. Commonly called a <em>cluster</em>, these servers need to be managed as a group, ensuring that their software configurations, security patches, and installed packages are deployed, maintained, and eventually updated or retired in a predictable way.</p>  <p>In this deep dive workshop, we’ll set up our own small cluster and use <a href=""https://ansible.com/"">Ansible</a>, which is an agentless, cross-platform, enterprise-grade, free software <a href=""https://en.wikipedia.org/wiki/Configuration_management"">Configuration Management (CM)</a> and <a href=""https://techlearningcollective.com/workshops/Automate-All-the-Things-Infrastructure-as-Code-Primer"">Infrastructure as Code (IaC)</a> framework used by giant corporations like IBM and Cisco, to turn old-school operator runbooks into computerized playbooks that can be executed quickly and easily even by novice operators. Through several hands-on exercises, you’ll learn about the entire CM lifecycle from planning through auditing so that you understand critical CM concepts like idempotence, change control, and more, which are common to all CM systems including <a href=""https://www.chef.io/configuration-management/"">Chef</a>, <a href=""https://puppet.com/use-cases/configuration-management/"">Puppet</a>, and <a href=""https://docs.saltstack.com/en/latest/topics/states/"">Salt</a>.</p>  <p>Along the way, you’ll be exposed to key concepts such as <a href=""https://techlearningcollective.com/workshops/Ship-Shape-Computing-Working-with-Containers-and-Containzerizing-Digital-Workloads"">containerization</a> through Ansible’s support for automating container builds, <a href=""https://techlearningcollective.com/con"">Role-Based Access Control (RBAC)</a> via Ansible’s AWX Project, and more. By adopting configuration management workflows with tools like Ansible, you can reduce operator errors, and beat back configuration drift on any long-lived infrastructure components.</p></blockquote><p>As this is a remote/online-only event, there is no physical class space, but attendance is still limited to 15 students, so <a href=""#tickets-workshop-2021-03-06-faster-than-light-getting-started-with-configuration-management"">purchase your ticket now</a> to reserve your spot.</p><p>To participate in our webinars, you will need access to a modern Web browser such as an up-to-date copy of <a href=""https://www.mozilla.org/firefox/"">Mozilla Firefox</a> or <a href=""https://www.google.com/chrome/"">Google Chrome</a>. You will also need a reliable Internet connection. We recommend disabling Wi-Fi and plugging your computer in to a hard-wired Ethernet network cable for the duration of the webinar, if possible.</p><p>If you would like to share your video screen or appear on camera, you will need to have and activate your own camera, such as the one built-in to many modern laptops. Similarly, to speak with the rest of the webinar participants, you will need a microphone. If you do choose to activate your microphone, we ask that you please plug in headphones/ear buds or use a headset in order to help reduce audio feedback loops that can degrade the webinar experience for other participants.</p><p>Please refer to <a href=""https://techlearningcollective.com/faq/#workshops-and-webinars"">our workshops and webinars FAQ</a> for additional tips and advice before you join the video conference.</p><p>As with all Tech Learning Collective events, racism, queerphobia, transphobia, sexism, “brogrammer,” “manarchist,” or any kind of similarly awful behavior <em>will</em> result in immediate removal from class without a refund. Please refer to <a href=""https://github.com/AnarchoTechNYC/meta/wiki/Social-rules"">our lightweight social rules</a> for details on our strictly enforced no-tolerance policy against bigotry of any kind.</p><h2 id=""about-tech-learning-collective"">About Tech Learning Collective</h2><p>Tech Learning Collective is an apprenticeship-based technology school that trains politically self-motivated individuals in the arts of hypermedia, Information Technology, and radical political practice. We offer unparalleled free, by-donation, and low-cost computer classes on topics ranging from fundamental computer literacy to the same offensive computer hacking techniques used by national intelligence agencies and military powers (cyber armies). For more information and to enroll, visit <a href=""https://techlearningcollective.com/"">TechLearningCollective.com</a>.</p>","There are no special instructions for this event.","techlearningcollective@riseup.net","","","","","","15","","","","17:00","03/06/21","true","","","","","","en","http://techlearningcollective.com/events/2021/03/workshop-2021-03-06-faster-than-light-getting-started-with-configuration-management","","","","","","","","","","","http://techlearningcollective.com/events/2021/03/workshop-2021-03-06-faster-than-light-getting-started-with-configuration-management"
"Down the Rabbit Hole: Anonymous Publishing on the Darknet","Down the Rabbit Hole: Anonymous Publishing on the Darknet (at  on March  7, 2021)","","","","","","","15:30","03/07/21","","techlearningcollective@riseup.net","<p>Get your message out without revealing who you are by publishing anonymously on the “Darknet.” This workshop shows you how to create Tor Onion services for Web sites through free tools like OnionShare, and even by setting up Tor servers that are built and configured from scratch manually. You’ll learn about how Tor helps keep both publishers and consumers private and anonymous online, as well as how law enforcement might successfully de-anonymize poorly configured Onion services through host bypass, fingerprint correlation, and other similar attacks.</p><h2 id=""workshop-description"">Workshop Description</h2><blockquote>  <p>It’s often said that if you want to tell people the truth, you’d better make them laugh—or they’ll kill you. Sometimes, humor isn’t a sufficient defense. For these situations, the only remaining defense is to become anonymous. In this deep-dive workshop on anonymous Internet publishing, you’ll learn about a special class of proxy server called a Tor Onion service that makes it possible to publish Web sites or offer network-capable services more or, if you’re really skilled, completely anonymously.</p>  <p>Publishing something truly anonymously on the Internet today is getting more and more difficult. And yet, with “real name” requirements pushed by social media giants like Facebook, law enforcement agents demanding travelers’ online usernames and passwords at border crossings, and global political campaigns to undermine or outright backdoor privacy-preserving encryption technologies, anonymous publishing is also getting more and more important. Whistleblowers need to be able to leak or publish anonymously to stay safe from legal and especially extralegal reprisals, and so too do politically vocal bloggers, investigative journalists, and citizens.</p>  <p>In this specialized workshop, you’ll see how Darknet Web sites like the now-famous Silk Road, as well as less controversial Web sites like the New York Times, actually use the same underlying technology called Tor Onion services to create their respective censorship-resistant publications. You’ll also be exposed to some of the techniques that law enforcement often tries to use to de-anonymize Onion services, and learn how to defend against them. By the end of this workshop, you’ll have a working knowledge of numerous critical modern technologies including Web servers, network relays, and Tor’s famous onion-routing protocol.</p></blockquote><p>As this is a remote/online-only event, there is no physical class space, but attendance is still limited to 15 students, so <a href=""#tickets-workshop-2021-03-07-down-the-rabbit-hole-anonymous-publishing-on-the-darknet"">purchase your ticket now</a> to reserve your spot.</p><p>To participate in our webinars, you will need access to a modern Web browser such as an up-to-date copy of <a href=""https://www.mozilla.org/firefox/"">Mozilla Firefox</a> or <a href=""https://www.google.com/chrome/"">Google Chrome</a>. You will also need a reliable Internet connection. We recommend disabling Wi-Fi and plugging your computer in to a hard-wired Ethernet network cable for the duration of the webinar, if possible.</p><p>If you would like to share your video screen or appear on camera, you will need to have and activate your own camera, such as the one built-in to many modern laptops. Similarly, to speak with the rest of the webinar participants, you will need a microphone. If you do choose to activate your microphone, we ask that you please plug in headphones/ear buds or use a headset in order to help reduce audio feedback loops that can degrade the webinar experience for other participants.</p><p>Please refer to <a href=""https://techlearningcollective.com/faq/#workshops-and-webinars"">our workshops and webinars FAQ</a> for additional tips and advice before you join the video conference.</p><p>As with all Tech Learning Collective events, racism, queerphobia, transphobia, sexism, “brogrammer,” “manarchist,” or any kind of similarly awful behavior <em>will</em> result in immediate removal from class without a refund. Please refer to <a href=""https://github.com/AnarchoTechNYC/meta/wiki/Social-rules"">our lightweight social rules</a> for details on our strictly enforced no-tolerance policy against bigotry of any kind.</p><h2 id=""about-tech-learning-collective"">About Tech Learning Collective</h2><p>Tech Learning Collective is an apprenticeship-based technology school that trains politically self-motivated individuals in the arts of hypermedia, Information Technology, and radical political practice. We offer unparalleled free, by-donation, and low-cost computer classes on topics ranging from fundamental computer literacy to the same offensive computer hacking techniques used by national intelligence agencies and military powers (cyber armies). For more information and to enroll, visit <a href=""https://techlearningcollective.com/"">TechLearningCollective.com</a>.</p>","There are no special instructions for this event.","techlearningcollective@riseup.net","","","","","","15","","","","17:00","03/07/21","true","","","","","","en","http://techlearningcollective.com/events/2021/03/workshop-2021-03-07-down-the-rabbit-hole-anonymous-publishing-on-the-darknet","","","","","","","","","","","http://techlearningcollective.com/events/2021/03/workshop-2021-03-07-down-the-rabbit-hole-anonymous-publishing-on-the-darknet"
"Signal and Surveillance: How to Exercise Digital Civil Liberties in a Surveillance State","Signal and Surveillance: How to Exercise Digital Civil Liberties in a Surveillance State (at  on March 13, 2021)","","","","","","","15:30","03/13/21","","techlearningcollective@riseup.net","<p>This introductory cybersecurity workshop will show you why Signal, a free, secure, private message app is simple enough to schedule drinks with, yet secure enough to use for planning a protest. As dragnet surveillance practices are legalized at alarming speed, there has never been a more important time to flex your digital civil liberties muscle than right now.</p><h2 id=""workshop-description"">Workshop Description</h2><blockquote>  <p>Whether you’re an individual chatting with friends or an organizer planning a political action, all effective coordination depends on safe and reliable communication. Lacking integrity for our communications dooms any effort from the outset, whether mundane or revolutionary. As dragnet surveillance practices are legalized at alarming speed and continue to be fueled by a dramatic expansion of the law enforcement and private defense contractor economies, there has never been a more important time to flex your digital civil liberties muscle than right now.</p>  <p><a href=""https://signal.org/"">Signal</a> is the name of a Free Software, secure, private message application built on a cryptographic protocol of the same name. Formerly known as the Axolotl Ratchet or, more commonly, the <a href=""https://en.wikipedia.org/wiki/Double_Ratchet_Algorithm"">Double-Ratchet Algorithm</a>, its features are robust enough for the revolutionary activist (i.e., end-to-end encryption, message authentication, plausible deniability or message repudiation, perfect forward secrecy, and more) and yet simple enough to use as a drop-in replacement for your existing text messaging application. Signal also sports Skype-like voice and video calling, location- and file-sharing features, and even iMessage-style large font emojis!</p>  <p>If you’ve never heard of Signal before, now’s the time to switch. If you think you already know how to use Signal, let us show you some pro-tips (trusted third-party Safety Number verification, disappearing messages, registering Signal accounts with pseudonymous phone numbers, inactivity lock-outs, and Signal relay server IP address protection). This introductory cybersecurity workshop will show you why Signal is simple enough to schedule drinks at the bar with, yet secure enough to use for planning a protest.</p></blockquote><p>As this is a remote/online-only event, there is no physical class space, but attendance is still limited to 15 students, so <a href=""#tickets-workshop-2021-03-13-signal-and-surveillance-how-to-exercise-digital-civil-liberties-in-a-surveillance-state"">purchase your ticket now</a> to reserve your spot.</p><p>To participate in our webinars, you will need access to a modern Web browser such as an up-to-date copy of <a href=""https://www.mozilla.org/firefox/"">Mozilla Firefox</a> or <a href=""https://www.google.com/chrome/"">Google Chrome</a>. You will also need a reliable Internet connection. We recommend disabling Wi-Fi and plugging your computer in to a hard-wired Ethernet network cable for the duration of the webinar, if possible.</p><p>If you would like to share your video screen or appear on camera, you will need to have and activate your own camera, such as the one built-in to many modern laptops. Similarly, to speak with the rest of the webinar participants, you will need a microphone. If you do choose to activate your microphone, we ask that you please plug in headphones/ear buds or use a headset in order to help reduce audio feedback loops that can degrade the webinar experience for other participants.</p><p>Please refer to <a href=""https://techlearningcollective.com/faq/#workshops-and-webinars"">our workshops and webinars FAQ</a> for additional tips and advice before you join the video conference.</p><p>As with all Tech Learning Collective events, racism, queerphobia, transphobia, sexism, “brogrammer,” “manarchist,” or any kind of similarly awful behavior <em>will</em> result in immediate removal from class without a refund. Please refer to <a href=""https://github.com/AnarchoTechNYC/meta/wiki/Social-rules"">our lightweight social rules</a> for details on our strictly enforced no-tolerance policy against bigotry of any kind.</p><h2 id=""about-tech-learning-collective"">About Tech Learning Collective</h2><p>Tech Learning Collective is an apprenticeship-based technology school that trains politically self-motivated individuals in the arts of hypermedia, Information Technology, and radical political practice. We offer unparalleled free, by-donation, and low-cost computer classes on topics ranging from fundamental computer literacy to the same offensive computer hacking techniques used by national intelligence agencies and military powers (cyber armies). For more information and to enroll, visit <a href=""https://techlearningcollective.com/"">TechLearningCollective.com</a>.</p>","There are no special instructions for this event.","techlearningcollective@riseup.net","","","","","","15","","","","17:00","03/13/21","true","","","","","","en","http://techlearningcollective.com/events/2021/03/workshop-2021-03-13-signal-and-surveillance-how-to-exercise-digital-civil-liberties-in-a-surveillance-state","","","","","","","","","","","http://techlearningcollective.com/events/2021/03/workshop-2021-03-13-signal-and-surveillance-how-to-exercise-digital-civil-liberties-in-a-surveillance-state"
"Bare Bones Crypto: Understanding Critical Cryptographic Primitives","Bare Bones Crypto: Understanding Critical Cryptographic Primitives (at  on March 14, 2021)","","","","","","","15:30","03/14/21","","techlearningcollective@riseup.net","<p>You don’t need to have your doctorate in theoretical mathematics to understand crypto enough to use it safely, but you do need to use it safely to be secure! Come learn the magic behind the math in this cryptography primer for those of us who are not “number people.” Using simplified examples and hands-on demonstrations, this workshop (finally!) offers a practical, accessible introduction to the foundations of modern cryptographic security protocols such as RSA public-key cryptography, stream and block ciphers, digital signatures, one-way hash functions, Hash-based Message Authentication Codes (HMACs), and more.</p><h2 id=""workshop-description"">Workshop Description</h2><blockquote>  <p>Every time you use a modern computer, you invoke numerous simple mathematical functions that make it possible to do things like logging in to Web sites safely or “locking” (encrypting) your secret documents behind passwords. At their root, these functions, called <em><a href=""https://en.wikipedia.org/wiki/Cryptographic_primitive"">cryptographic primitives</a></em>, are not that much more complicated than simple addition or division. But when used in concert with the massive storage capacities and processing speeds of our modern electronic devices, they serve as the bedrock atop which every provably secure system works, from <a href=""https://techlearningcollective.com/workshops/Password-Superpowers-How-to-Crack-Hashes-and-Stump-Hackers"">password vaults</a> to <a href=""https://techlearningcollective.com/workshops/Two-Places-at-Once-Understanding-Virtual-Private-Networks"">Virtual Private Networks (VPNs)</a> to BitCoin and beyond.</p>  <p>Today, everyone has full access to bulletproof “military grade encryption” for free, even if they don’t realize it. <a href=""https://techlearningcollective.com/workshops/Signal-and-Surveillance-How-to-Exercise-Digital-Civil-Liberties-in-a-Surveillance-State"">Signal Private Messenger</a>’s “Safety Numbers?” Those are cryptographic hash functions! One-time passwords generated by apps like Google Authenticator or Authy? They use nonces! The <a href=""https://techlearningcollective.com/workshops/Tor-What-is-it-Good-For-(Absolutely-Everything!)"">Tor anonymity network</a>? That’s a mixnet! The padlock icon in the address bar of your Web browser? Block ciphers (and public-key cryptography, and digital signatures, oh my)!</p>  <p>Knowledge of cryptography was deemed so dangerous during the Cold War that ever since the end of World War II the United States and its military allies attempted to regulate access to these crypto powers by classifying them as “munitions” (i.e., mathematical <em>weapons</em>, literally) and criminalizing their sale or export. But as the Internet gained widespread commercial adoption and more people became familiar with the underlying math, the government largely relented. It eventually lost what is now retroactively known as the “<a href=""https://en.wikipedia.org/wiki/Crypto_Wars"">Crypto Wars</a>” in the 1990’s.</p>  <p>In this workshop, you’ll learn the kind of math that governments tried to keep secret for decades, even if you’re “not a math person.” You’ll see hash functions in practice, learn why longer “keys” are stronger by understanding how RSA secrets are generated, practice developing your own simple ciphers, and start combining primitives to create security protocols that satisfy multiple requirements like confidentiality (privacy), integrity-protection (authenticity), and more. By the end of this workshop, the dizzying vocabulary crytographers use will be well within your reach, as will the ability to understand any new “encryption” product on the market.</p></blockquote><p>As this is a remote/online-only event, there is no physical class space, but attendance is still limited to 15 students, so <a href=""#tickets-workshop-2021-03-14-bare-bones-crypto-understanding-critical-cryptographic-primitives"">purchase your ticket now</a> to reserve your spot.</p><p>To participate in our webinars, you will need access to a modern Web browser such as an up-to-date copy of <a href=""https://www.mozilla.org/firefox/"">Mozilla Firefox</a> or <a href=""https://www.google.com/chrome/"">Google Chrome</a>. You will also need a reliable Internet connection. We recommend disabling Wi-Fi and plugging your computer in to a hard-wired Ethernet network cable for the duration of the webinar, if possible.</p><p>If you would like to share your video screen or appear on camera, you will need to have and activate your own camera, such as the one built-in to many modern laptops. Similarly, to speak with the rest of the webinar participants, you will need a microphone. If you do choose to activate your microphone, we ask that you please plug in headphones/ear buds or use a headset in order to help reduce audio feedback loops that can degrade the webinar experience for other participants.</p><p>Please refer to <a href=""https://techlearningcollective.com/faq/#workshops-and-webinars"">our workshops and webinars FAQ</a> for additional tips and advice before you join the video conference.</p><p>As with all Tech Learning Collective events, racism, queerphobia, transphobia, sexism, “brogrammer,” “manarchist,” or any kind of similarly awful behavior <em>will</em> result in immediate removal from class without a refund. Please refer to <a href=""https://github.com/AnarchoTechNYC/meta/wiki/Social-rules"">our lightweight social rules</a> for details on our strictly enforced no-tolerance policy against bigotry of any kind.</p><h2 id=""about-tech-learning-collective"">About Tech Learning Collective</h2><p>Tech Learning Collective is an apprenticeship-based technology school that trains politically self-motivated individuals in the arts of hypermedia, Information Technology, and radical political practice. We offer unparalleled free, by-donation, and low-cost computer classes on topics ranging from fundamental computer literacy to the same offensive computer hacking techniques used by national intelligence agencies and military powers (cyber armies). For more information and to enroll, visit <a href=""https://techlearningcollective.com/"">TechLearningCollective.com</a>.</p>","There are no special instructions for this event.","techlearningcollective@riseup.net","","","","","","15","","","","17:00","03/14/21","true","","","","","","en","http://techlearningcollective.com/events/2021/03/workshop-2021-03-14-bare-bones-crypto-understanding-critical-cryptographic-primitives","","","","","","","","","","","http://techlearningcollective.com/events/2021/03/workshop-2021-03-14-bare-bones-crypto-understanding-critical-cryptographic-primitives"
