event_title,administrative_title,location_name,address,city,state,zip,country,time,date,timezone,host,attendee_pitch,attendee_instructions,host_contact_info,van_id,shift_id,role_id,status_id,custom_fields,rsvp_limit,automatic_notifications,display_sharing_options,submit_button_title,end_date,end_time,disable_discussions,reminder_message,reminder_from,reminder_subject,reminder_reply_to,allow_guests,language,redirect_url,email_response,response_message,response_from,response_subject,response_reply_to,twitter_share,email_share,facebook_title,facebook_link,facebook_description,direct_link
"The Web as a Language: What No One Ever Told You About HTML That You Didn't Know To Ask","The Web as a Language: What No One Ever Told You About HTML That You Didn't Know To Ask (at  on December 11, 2021)","","","","","","","13:30","12/11/21","","techlearningcollective@riseup.net","<p>To take full advantage of the Web, especially as a digital publishing medium, you need to start by using the full expressive power of its most fundamental part: the simple HTML “Web page.” This workshop covers HTML, the HyperText Markup Language, as though it were a language in which you can write poems as well as tables of facts and figures, because it is! Learn how to structure your pages in digital rhyme and meter and find out why this approach results in better code for both beautiful designs and automated processes.</p><h2 id=""workshop-description"">Workshop Description</h2><blockquote>  <p>The Hypertext Markup Language (HTML) is the de-facto standard for publishing information online, a kind of digital equivalent to learning to read and write. Why, then, is it so rarely explained in terms of the <em>language</em> that it actually is? What is HTML’s grammar, where do HTML “sentences” begin and end, and how is meaning represented in its elements? You don’t need a computer science degree to learn a foreign language, and that includes HTML.</p>  <p>This workshop is designed for anyone who ever wanted to toy with HTML once or twice, whether it was in the 90’s or just last week. Based on a portion of the <a href=""https://techlearningcollective.com/courses/web101.html"">Tech Learning Collective’s WEB101 course</a>, it is a remarkably thorough treatment of some of the Web’s most powerful and most-often overlooked parts. Covering the structure of HTML and extending to the richness of semantic data formats like <a href=""https://en.wikipedia.org/wiki/Microdata_%28HTML%29"">Microdata</a> and <a href=""https://en.wikipedia.org/wiki/RDFa"">RDFa</a>, learn how to write in the Web’s native language so that both humans (like your friends and comrades) and machines (like Google!) can find, use, and most importantly <em>understand</em> what you’re saying.</p></blockquote><p>As this is a remote/online-only event, there is no physical class space, but attendance is still limited to 15 students, so <a href=""#tickets-workshop-2021-12-11-the-web-as-a-language-what-no-one-ever-told-you-about-html-that-you-didnt-know-to-ask"">purchase your ticket now</a> to reserve your spot.</p><p>To participate in our webinars, you will need access to a modern Web browser such as an up-to-date copy of <a href=""https://www.mozilla.org/firefox/"">Mozilla Firefox</a> or <a href=""https://www.google.com/chrome/"">Google Chrome</a>. You will also need a reliable Internet connection. We recommend disabling Wi-Fi and plugging your computer in to a hard-wired Ethernet network cable for the duration of the webinar, if possible.</p><p>If you would like to share your video screen or appear on camera, you will need to have and activate your own camera, such as the one built-in to many modern laptops. Similarly, to speak with the rest of the webinar participants, you will need a microphone. If you do choose to activate your microphone, we ask that you please plug in headphones/ear buds or use a headset in order to help reduce audio feedback loops that can degrade the webinar experience for other participants.</p><p>Please refer to <a href=""https://techlearningcollective.com/faq/#workshops-and-webinars"">our workshops and webinars FAQ</a> for additional tips and advice before you join the video conference.</p><p>As with all Tech Learning Collective events, racism, queerphobia, transphobia, sexism, “brogrammer,” “manarchist,” or any kind of similarly awful behavior <em>will</em> result in immediate removal from class without a refund. Please refer to <a href=""https://github.com/AnarchoTechNYC/meta/wiki/Social-rules"">our lightweight social rules</a> for details on our strictly enforced no-tolerance policy against bigotry of any kind.</p><h2 id=""about-tech-learning-collective"">About Tech Learning Collective</h2><p>Tech Learning Collective is an apprenticeship-based technology school that trains politically self-motivated individuals in the arts of hypermedia, Information Technology, and radical political practice. We offer unparalleled free, by-donation, and low-cost computer classes on topics ranging from fundamental computer literacy to the same offensive computer hacking techniques used by national intelligence agencies and military powers (cyber armies). For more information and to enroll, visit <a href=""https://techlearningcollective.com/"">TechLearningCollective.com</a>.</p>","There are no special instructions for this event.","techlearningcollective@riseup.net","","","","","","15","","","","15:00","12/11/21","true","","","","","","en","http://techlearningcollective.com/events/2021/12/workshop-2021-12-11-the-web-as-a-language-what-no-one-ever-told-you-about-html-that-you-didnt-know-to-ask","","","","","","","","","","","http://techlearningcollective.com/events/2021/12/workshop-2021-12-11-the-web-as-a-language-what-no-one-ever-told-you-about-html-that-you-didnt-know-to-ask"
"Writing with Blue Fire: Shell Scripting for Beginners","Writing with Blue Fire: Shell Scripting for Beginners (at  on December 12, 2021)","","","","","","","13:30","12/12/21","","techlearningcollective@riseup.net","<p>Learn how to inscribe your thoughts, dreams, and desires into your computer and take your command line skills to the next level by learning how to write simple programs called shell scripts. In a way, invoking commands one at a time is like writing a program interactively, whereas writing a script inscribes that knowledge into a more permanent form. By learning how to turn commands into simple scripted programs, you can unlock the almost magical potential of your computer and more easily share that potential with others to whom you distribute your scripts.</p><h2 id=""workshop-description"">Workshop Description</h2><blockquote>  <p>At their core, digital computers are very complex writing instruments. Like pen and paper, they allow us to record our thoughts, dreams, and desires for later review. Unlike pen and paper, they allow us to do this at the speed of electricity and at a scale never before imagined possible, and their ability to directly manipulate the physical world through servomotors, industrial control systems, biomedical devices, and other robotic prosthesis means they can potentially supercharge every facet of our humanity.</p>  <p>When a system administrator or programmer uses a computer, they often issue instructions one by one using a special-purpose, text-only interface called a <em><a href=""https://techlearningcollective.com/foundations/"">command line</a></em>. Individually, these instructions are called <em>invocations</em>. (Yes, that’s their technical term!) In this beginner’s workshop, you’ll learn how to write whole spells, rituals, or (sacred) texts called <em>shell scripts</em> to inscribe your own thoughts, dreams, and desires in the electrified silicon and minerals of your computer.</p>  <p>By saving your scripts in files, you can invoke arbitrarily complex routines to reproduce tasks or automate complex procedures with a single command. Writing scripts also makes it possible to share what you can do with others and, as such, are one the simplest forms of computer program that you can write and distribute. Come learn how the magic of digital inscription can help you do your work, and increase your power to accomplish your dreams.</p></blockquote><p>As this is a remote/online-only event, there is no physical class space, but attendance is still limited to 15 students, so <a href=""#tickets-workshop-2021-12-12-writing-with-blue-fire-shell-scripting-for-beginners"">purchase your ticket now</a> to reserve your spot.</p><p>To participate in our webinars, you will need access to a modern Web browser such as an up-to-date copy of <a href=""https://www.mozilla.org/firefox/"">Mozilla Firefox</a> or <a href=""https://www.google.com/chrome/"">Google Chrome</a>. You will also need a reliable Internet connection. We recommend disabling Wi-Fi and plugging your computer in to a hard-wired Ethernet network cable for the duration of the webinar, if possible.</p><p>If you would like to share your video screen or appear on camera, you will need to have and activate your own camera, such as the one built-in to many modern laptops. Similarly, to speak with the rest of the webinar participants, you will need a microphone. If you do choose to activate your microphone, we ask that you please plug in headphones/ear buds or use a headset in order to help reduce audio feedback loops that can degrade the webinar experience for other participants.</p><p>Please refer to <a href=""https://techlearningcollective.com/faq/#workshops-and-webinars"">our workshops and webinars FAQ</a> for additional tips and advice before you join the video conference.</p><p>As with all Tech Learning Collective events, racism, queerphobia, transphobia, sexism, “brogrammer,” “manarchist,” or any kind of similarly awful behavior <em>will</em> result in immediate removal from class without a refund. Please refer to <a href=""https://github.com/AnarchoTechNYC/meta/wiki/Social-rules"">our lightweight social rules</a> for details on our strictly enforced no-tolerance policy against bigotry of any kind.</p><h2 id=""about-tech-learning-collective"">About Tech Learning Collective</h2><p>Tech Learning Collective is an apprenticeship-based technology school that trains politically self-motivated individuals in the arts of hypermedia, Information Technology, and radical political practice. We offer unparalleled free, by-donation, and low-cost computer classes on topics ranging from fundamental computer literacy to the same offensive computer hacking techniques used by national intelligence agencies and military powers (cyber armies). For more information and to enroll, visit <a href=""https://techlearningcollective.com/"">TechLearningCollective.com</a>.</p>","There are no special instructions for this event.","techlearningcollective@riseup.net","","","","","","15","","","","15:00","12/12/21","true","","","","","","en","http://techlearningcollective.com/events/2021/12/workshop-2021-12-12-writing-with-blue-fire-shell-scripting-for-beginners","","","","","","","","","","","http://techlearningcollective.com/events/2021/12/workshop-2021-12-12-writing-with-blue-fire-shell-scripting-for-beginners"
"The Genesis Project: Making and Maintaining Cloud Infrastructure with Terraform","The Genesis Project: Making and Maintaining Cloud Infrastructure with Terraform (at  on December 18, 2021)","","","","","","","13:30","12/18/21","","techlearningcollective@riseup.net","<p>Learn to manage your own Virtual Private Cloud (VPC) datacenter environment and make the most of cloud infrastructure providers (“IaaS platforms”) by automatically deploying underlying infrastructure, including network topology, firewall rulesets, DNS records, and other resources. This intermediate-level workshop introduces you to Terraform, a free, agentless, masterless, Infrastructure-as-Code (IaC) digital operations provisioning tool used by many of the largest organizations in the world but simple enough to use on a team of one.</p><h2 id=""workshop-description"">Workshop Description</h2><blockquote>  <p>In the beginning, there was the mainframe: a single, gigantic machine that held all the data and did all the work by itself, like a digital planet suspended in the vast emptiness of cyberspace. Then came networks, the personal computer, the Internet, Web 2.0, cloud computing, microservices, and containers—a whole <a href=""https://techlearningcollective.com/workshops/Exploring-Cyberspace-Network-Sniffing-and-Scanning"">cybergalaxy to explore</a>. While the world today looks very different than it did in the days of the mainframe, every project still needs to start at the beginning: get at least one computer to hold all project data and do all project work. So how do modern projects go from a single computer to a whole galaxy so quickly?</p>  <p>For many (including Tech Learning Collective!), the answer is <a href=""https://terraform.io/"">Terraform</a>, a free, open source, and extensible tool that can provision and manage any number of infrastructural resources from source code repositories to cloud compute instances to DNS records and much, much more. Using Terraform, engineers describe the digital environment they’d <em>like</em> to have by writing it down in a simple, declarative configuration language called <a href=""https://www.terraform.io/docs/configuration/syntax.html"">HCL</a>. Then, when instructed, Terraform does the work of metaphorically, well, terraforming cyberspace to match the engineer’s description.</p>  <p>In this workshop, you’ll learn the basics of how to set up Terraform for your organization. We’ll also go over best practices for ensuring testing, staging, and production infrastructures stay isolated from one another, how to compose reusable modules, and how to share your Terraform configurations as well as project state with collaborators. At the end of this workshop, you’ll understand how to bring the cloud down to earth.</p></blockquote><p>As this is a remote/online-only event, there is no physical class space, but attendance is still limited to 15 students, so <a href=""#tickets-workshop-2021-12-18-the-genesis-project-making-and-maintaining-cloud-infrastructure-with-terraform"">purchase your ticket now</a> to reserve your spot.</p><p>To participate in our webinars, you will need access to a modern Web browser such as an up-to-date copy of <a href=""https://www.mozilla.org/firefox/"">Mozilla Firefox</a> or <a href=""https://www.google.com/chrome/"">Google Chrome</a>. You will also need a reliable Internet connection. We recommend disabling Wi-Fi and plugging your computer in to a hard-wired Ethernet network cable for the duration of the webinar, if possible.</p><p>If you would like to share your video screen or appear on camera, you will need to have and activate your own camera, such as the one built-in to many modern laptops. Similarly, to speak with the rest of the webinar participants, you will need a microphone. If you do choose to activate your microphone, we ask that you please plug in headphones/ear buds or use a headset in order to help reduce audio feedback loops that can degrade the webinar experience for other participants.</p><p>Please refer to <a href=""https://techlearningcollective.com/faq/#workshops-and-webinars"">our workshops and webinars FAQ</a> for additional tips and advice before you join the video conference.</p><p>As with all Tech Learning Collective events, racism, queerphobia, transphobia, sexism, “brogrammer,” “manarchist,” or any kind of similarly awful behavior <em>will</em> result in immediate removal from class without a refund. Please refer to <a href=""https://github.com/AnarchoTechNYC/meta/wiki/Social-rules"">our lightweight social rules</a> for details on our strictly enforced no-tolerance policy against bigotry of any kind.</p><h2 id=""about-tech-learning-collective"">About Tech Learning Collective</h2><p>Tech Learning Collective is an apprenticeship-based technology school that trains politically self-motivated individuals in the arts of hypermedia, Information Technology, and radical political practice. We offer unparalleled free, by-donation, and low-cost computer classes on topics ranging from fundamental computer literacy to the same offensive computer hacking techniques used by national intelligence agencies and military powers (cyber armies). For more information and to enroll, visit <a href=""https://techlearningcollective.com/"">TechLearningCollective.com</a>.</p>","There are no special instructions for this event.","techlearningcollective@riseup.net","","","","","","15","","","","15:00","12/18/21","true","","","","","","en","http://techlearningcollective.com/events/2021/12/workshop-2021-12-18-the-genesis-project-making-and-maintaining-cloud-infrastructure-with-terraform","","","","","","","","","","","http://techlearningcollective.com/events/2021/12/workshop-2021-12-18-the-genesis-project-making-and-maintaining-cloud-infrastructure-with-terraform"
"The Imitation Game: Introduction to Administering Virtual Machine Systems","The Imitation Game: Introduction to Administering Virtual Machine Systems (at  on December 19, 2021)","","","","","","","13:30","12/19/21","","techlearningcollective@riseup.net","<p>This workshop is a practical introduction to creating, using, and administering virtual machine (VM) systems. Even if you’ve never heard of a virtual machine before, you probably already use the underlying technology. And you can get a lot out of using a virtual machine even if you aren’t a software developer because they can help secure your Web browsing activity, give you a sandbox in which to try out new software, and much more!</p><h2 id=""workshop-description"">Workshop Description</h2><blockquote>  <p>Virtualization and containerization are concepts almost as old as computing itself so, no matter what you’re doing on your computer, you’re probably using one form of it or another. For example, partitioning a hard disk chunks its total capacity into smaller units useful for specific purposes, much like the individual drawers in a dresser might separate undergarments from outerwear. Organizing, or “containerizing,” your closet this way is useful in its own right because it helps you keep things neat and orderly. But this organizing method also offers dramatic security enhancements because a misbehaving program (or dirty sock) will be confined to its own container.</p>  <p>Today, virtualization has become integral to how desktop computers, servers, and global data networks work, and cross-platform, Free Software virtualization programs have never been easier to use. Storage virtualization makes it possible for a single file on your computer to appear to be an entire hard disk drive (such as provided by <a href=""https://www.veracrypt.fr/"">VeraCrypt</a>), network virtualization makes it possible to simulate different networks (e.g., using <a href=""https://en.wikipedia.org/wiki/Virtual_LAN"">VLANs</a>) or even the whole Internet (using <a href=""https://www.inetsim.org/"">INetSim</a>), processor virtualization makes it possible to run programs built for one microchip architecture on computers running a completely different one (e.g., in <a href=""https://www.qemu.org/"">QEMU</a>), and fully-fledged virtual machine monitors (VMMs) or hypervisors can construct and modify entire hardware environments complete with virtual video monitors and other peripherals on the fly (as is offered by <a href=""https://www.proxmox.com/"">Proxmox</a>). Virtualization is even the bedrock of numerous Operating System and Web browser security features, such as in the <a href=""https://www.qubes-os.org/"">Qubes Operating System</a>, <a href=""https://developer.apple.com/library/archive/documentation/Security/Conceptual/AppSandboxDesignGuide/AboutAppSandbox/AboutAppSandbox.html"">macOS’s App Sandbox</a>, and <a href=""https://support.mozilla.org/kb/containers"">Firefox Containers</a>.</p>  <p>Whether you’re using your computer for fun or for profit, this workshop will get you up and running with Virtual Machines using the <a href=""https://virtualbox.org/"">VirtualBox</a> type-2 hypervisor so you can experiment with unfamiliar software more boldly, browse the Web more safely, and play games you otherwise wouldn’t have been able to. By learning how to take advantage of the virtualization capabilities your computer already offers, you can revive your love of that long-lost DOS point-and-click adventure, reliably build and test single- and multi-machine networked software systems, or simply create an almost unlimited number of purpose-built virtual machines that all exist, like inception, inside your existing laptop or other personal computer.</p></blockquote><p>As this is a remote/online-only event, there is no physical class space, but attendance is still limited to 15 students, so <a href=""#tickets-workshop-2021-12-19-the-imitation-game-introduction-to-administering-virtual-machine-systems"">purchase your ticket now</a> to reserve your spot.</p><p>To participate in our webinars, you will need access to a modern Web browser such as an up-to-date copy of <a href=""https://www.mozilla.org/firefox/"">Mozilla Firefox</a> or <a href=""https://www.google.com/chrome/"">Google Chrome</a>. You will also need a reliable Internet connection. We recommend disabling Wi-Fi and plugging your computer in to a hard-wired Ethernet network cable for the duration of the webinar, if possible.</p><p>If you would like to share your video screen or appear on camera, you will need to have and activate your own camera, such as the one built-in to many modern laptops. Similarly, to speak with the rest of the webinar participants, you will need a microphone. If you do choose to activate your microphone, we ask that you please plug in headphones/ear buds or use a headset in order to help reduce audio feedback loops that can degrade the webinar experience for other participants.</p><p>Please refer to <a href=""https://techlearningcollective.com/faq/#workshops-and-webinars"">our workshops and webinars FAQ</a> for additional tips and advice before you join the video conference.</p><p>As with all Tech Learning Collective events, racism, queerphobia, transphobia, sexism, “brogrammer,” “manarchist,” or any kind of similarly awful behavior <em>will</em> result in immediate removal from class without a refund. Please refer to <a href=""https://github.com/AnarchoTechNYC/meta/wiki/Social-rules"">our lightweight social rules</a> for details on our strictly enforced no-tolerance policy against bigotry of any kind.</p><h2 id=""about-tech-learning-collective"">About Tech Learning Collective</h2><p>Tech Learning Collective is an apprenticeship-based technology school that trains politically self-motivated individuals in the arts of hypermedia, Information Technology, and radical political practice. We offer unparalleled free, by-donation, and low-cost computer classes on topics ranging from fundamental computer literacy to the same offensive computer hacking techniques used by national intelligence agencies and military powers (cyber armies). For more information and to enroll, visit <a href=""https://techlearningcollective.com/"">TechLearningCollective.com</a>.</p>","There are no special instructions for this event.","techlearningcollective@riseup.net","","","","","","15","","","","15:00","12/19/21","true","","","","","","en","http://techlearningcollective.com/events/2021/12/workshop-2021-12-19-the-imitation-game-introduction-to-administering-virtual-machine-systems","","","","","","","","","","","http://techlearningcollective.com/events/2021/12/workshop-2021-12-19-the-imitation-game-introduction-to-administering-virtual-machine-systems"
