event_title,administrative_title,location_name,address,city,state,zip,country,time,date,timezone,host,attendee_pitch,attendee_instructions,host_contact_info,van_id,shift_id,role_id,status_id,custom_fields,rsvp_limit,automatic_notifications,display_sharing_options,submit_button_title,end_date,end_time,disable_discussions,reminder_message,reminder_from,reminder_subject,reminder_reply_to,allow_guests,language,redirect_url,email_response,response_message,response_from,response_subject,response_reply_to,twitter_share,email_share,facebook_title,facebook_link,facebook_description,direct_link
"Securing Email: Protecting Everyday Communications from GMail to ProtonMail","Securing Email: Protecting Everyday Communications from GMail to ProtonMail (at  on May  1, 2021)","","","","","","","15:30","05/01/21","","techlearningcollective@riseup.net","<p>This workshop shows you how to keep your emails private regardless of what email provider you use. By learning how to use the freely and widely available Pretty Good Privacy (PGP) cryptosystem in email, you will see how easy it is to not only encrypt messages so that they remain confidential, but also how to make sure the emails you get were really sent by the people they claim to be from. Once you’re able to verify the sender of email you receive, you’re far less likely to get caught up in an email phishing scam ever again.</p><h2 id=""workshop-description"">Workshop Description</h2><blockquote>  <p>As one of the oldest digital communication methods, email is used for everything from pointless chain letters to critical financial statements and legal actions. The name “e-mail” might make you think that electronic mail works the same way that writing a physical letter does, but this isn’t entirely true. From a technical perspective, it’s more like “e-postcards” because, just like sending a postcard through the postal service, anyone who handles your postcard can read what you wrote.</p>  <p>In the physical world, protecting your correspondence requires you to take the extra step of putting your letter inside an envelope and then sealing the envelope. That way, no one looking at the outside of the envelope can read what you wrote on the letter paper. To protect your email in the digital world, you still have to take this extra step of putting your letter inside a metaphorical envelope. Some services, like <a href=""https://github.com/AnarchoTechNYC/meta/wiki/ProtonMail"">ProtonMail, claim to do this for you, but fail to do so in many common scenarios</a>. Meanwhile, many people believe that just using Google’s GMail service means all your email content is always readable by Google, but this isn’t always true either.</p>  <p>This workshop will demystify the nuance of email privacy and security. By using <a href=""https://prism-break.org/en/protocols/gpg/"">freely available OpenPGP-compatible software</a>, which has been available since 1991, the Tech Learning Collective’s cybersecurity instructors will show you how you can keep your message contents private regardless of the email service provider you use. Never send paperwork with your social security number or other sensitive details on a digital postcard to your lawyer or accountant ever again!</p></blockquote><p>As this is a remote/online-only event, there is no physical class space, but attendance is still limited to 15 students, so <a href=""#tickets-workshop-2021-05-01-securing-email-protecting-everyday-communications-from-gmail-to-protonmail"">purchase your ticket now</a> to reserve your spot.</p><p>To participate in our webinars, you will need access to a modern Web browser such as an up-to-date copy of <a href=""https://www.mozilla.org/firefox/"">Mozilla Firefox</a> or <a href=""https://www.google.com/chrome/"">Google Chrome</a>. You will also need a reliable Internet connection. We recommend disabling Wi-Fi and plugging your computer in to a hard-wired Ethernet network cable for the duration of the webinar, if possible.</p><p>If you would like to share your video screen or appear on camera, you will need to have and activate your own camera, such as the one built-in to many modern laptops. Similarly, to speak with the rest of the webinar participants, you will need a microphone. If you do choose to activate your microphone, we ask that you please plug in headphones/ear buds or use a headset in order to help reduce audio feedback loops that can degrade the webinar experience for other participants.</p><p>Please refer to <a href=""https://techlearningcollective.com/faq/#workshops-and-webinars"">our workshops and webinars FAQ</a> for additional tips and advice before you join the video conference.</p><p>As with all Tech Learning Collective events, racism, queerphobia, transphobia, sexism, “brogrammer,” “manarchist,” or any kind of similarly awful behavior <em>will</em> result in immediate removal from class without a refund. Please refer to <a href=""https://github.com/AnarchoTechNYC/meta/wiki/Social-rules"">our lightweight social rules</a> for details on our strictly enforced no-tolerance policy against bigotry of any kind.</p><h2 id=""about-tech-learning-collective"">About Tech Learning Collective</h2><p>Tech Learning Collective is an apprenticeship-based technology school that trains politically self-motivated individuals in the arts of hypermedia, Information Technology, and radical political practice. We offer unparalleled free, by-donation, and low-cost computer classes on topics ranging from fundamental computer literacy to the same offensive computer hacking techniques used by national intelligence agencies and military powers (cyber armies). For more information and to enroll, visit <a href=""https://techlearningcollective.com/"">TechLearningCollective.com</a>.</p>","There are no special instructions for this event.","techlearningcollective@riseup.net","","","","","","15","","","","17:00","05/01/21","true","","","","","","en","http://techlearningcollective.com/events/2021/05/workshop-2021-05-01-securing-email-protecting-everyday-communications-from-gmail-to-protonmail","","","","","","","","","","","http://techlearningcollective.com/events/2021/05/workshop-2021-05-01-securing-email-protecting-everyday-communications-from-gmail-to-protonmail"
"Automate All the Things: A Primer to Infrastructure as Code","Automate All the Things: A Primer to Infrastructure as Code (at  on May  2, 2021)","","","","","","","15:30","05/02/21","","techlearningcollective@riseup.net","<p>Learn how to make your own Virtual Private Cloud (VPC), automatically install software on the servers in your cloud, and write executable runbooks to automatically perform upgrades and other maintenance with the press of a button. With today’s modern automation toolkits, a two-person hobby project can outperform a 100-person company, as long as they use the right tools the right way. In this workshop, you’ll get a practical introduction to cloud infrastructure automation with tools like Ansible, Vagrant, and Terraform, and a chance to solidify your understanding of fundamental DevOps skills that every IT professional needs.</p><h2 id=""workshop-description"">Workshop Description</h2><blockquote>  <p>In today’s IT environments, application servers, databases, file shares, and even network devices are too numerous for any individual or team to provision, configure, and administer one at a time. To deploy, maintain, and secure large digital fleets, site reliability engineers leverage the inherent power of computerized automation to perform everything from daily tasks (patching, updating code) to critical but rare operations (migrations, incident response). But even small groups can take advantage of this sort of automation to massively amplify their impact; today, a two-person hobby project can outperform a 100-person company if they use the right tools the right way.</p>  <p>Generically called <em>Infrastructure as Code (IaC)</em>, modern configuration management tools like <a href=""https://www.ansible.com/"">Ansible</a>, <a href=""https://chef.io/"">Chef</a>, <a href=""https://saltstack.com/"">SaltStack</a>, and <a href=""https://puppet.com/"">Puppet</a> make it possible for a single operator to paralellize executing Standard Operating Procedures (SOPs) like initiating backups or performing blue-green deployments on hundreds or thousands of machines at once. By using virtualization through IaC tools like <a href=""https://vagrantup.com/"">Vagrant</a>, entire “cloud” environments can be emulated for heterogenous development teams, massively streamlining everything from software development, to R&amp;D, to education and onboarding. (Tech Learning Collective’s own course exercises and practice labs are defined in code as Vagrant configurations!) Encoding your organization’s infrastructure requirements in standard, vendor-neutral, open formats such as <a href=""https://terraform.io/"">Terraform</a> means you can switch from one infrastructure provider to another with ease. But perhaps most important of all, “automating all the things” means that potential disasters like ransomware extortion attempts, outages, or even mere accidents can be audited, diagnosed, and remediated in a matter of minutes instead of days or weeks.</p>  <p>In this workshop, you’ll get a practical introduction to cloud infrastructure automation. You’ll learn how to create your first virtual private cloud (VPC), add multiple machines to it, automatically install server software on those machines, and write exectuable runbooks to automatically perform upgrades and other maintenance tasks on your new infrastructure. Whether you’re already administering a fleet of servers at work, or just want to slim your “weekend project” time down to size, this far-reaching workshop will solidify your understanding of the development operations (DevOps) skills every IT professional needs to hone to have success with modern digital infrastructure projects.</p></blockquote><p>As this is a remote/online-only event, there is no physical class space, but attendance is still limited to 15 students, so <a href=""#tickets-workshop-2021-05-02-automate-all-the-things-a-primer-to-infrastructure-as-code"">purchase your ticket now</a> to reserve your spot.</p><p>To participate in our webinars, you will need access to a modern Web browser such as an up-to-date copy of <a href=""https://www.mozilla.org/firefox/"">Mozilla Firefox</a> or <a href=""https://www.google.com/chrome/"">Google Chrome</a>. You will also need a reliable Internet connection. We recommend disabling Wi-Fi and plugging your computer in to a hard-wired Ethernet network cable for the duration of the webinar, if possible.</p><p>If you would like to share your video screen or appear on camera, you will need to have and activate your own camera, such as the one built-in to many modern laptops. Similarly, to speak with the rest of the webinar participants, you will need a microphone. If you do choose to activate your microphone, we ask that you please plug in headphones/ear buds or use a headset in order to help reduce audio feedback loops that can degrade the webinar experience for other participants.</p><p>Please refer to <a href=""https://techlearningcollective.com/faq/#workshops-and-webinars"">our workshops and webinars FAQ</a> for additional tips and advice before you join the video conference.</p><p>As with all Tech Learning Collective events, racism, queerphobia, transphobia, sexism, “brogrammer,” “manarchist,” or any kind of similarly awful behavior <em>will</em> result in immediate removal from class without a refund. Please refer to <a href=""https://github.com/AnarchoTechNYC/meta/wiki/Social-rules"">our lightweight social rules</a> for details on our strictly enforced no-tolerance policy against bigotry of any kind.</p><h2 id=""about-tech-learning-collective"">About Tech Learning Collective</h2><p>Tech Learning Collective is an apprenticeship-based technology school that trains politically self-motivated individuals in the arts of hypermedia, Information Technology, and radical political practice. We offer unparalleled free, by-donation, and low-cost computer classes on topics ranging from fundamental computer literacy to the same offensive computer hacking techniques used by national intelligence agencies and military powers (cyber armies). For more information and to enroll, visit <a href=""https://techlearningcollective.com/"">TechLearningCollective.com</a>.</p>","There are no special instructions for this event.","techlearningcollective@riseup.net","","","","","","15","","","","17:00","05/02/21","true","","","","","","en","http://techlearningcollective.com/events/2021/05/workshop-2021-05-02-automate-all-the-things-a-primer-to-infrastructure-as-code","","","","","","","","","","","http://techlearningcollective.com/events/2021/05/workshop-2021-05-02-automate-all-the-things-a-primer-to-infrastructure-as-code"
"Where the Sky Meets the Sea: Understanding Container Orchestration with Kubernetes","Where the Sky Meets the Sea: Understanding Container Orchestration with Kubernetes (at  on May  8, 2021)","","","","","","","15:30","05/08/21","","techlearningcollective@riseup.net","<p>Learn to pilot Kubernetes and find out how it helps you get the most value out of your hardware. Kubernetes is the free, enterprise-grade, cloud-native solution for automated deployment, scaling, and management of containerized applications. This workshop offers an introduction to container orchestration concepts and practices by showing you how to work effectively with <code class=""language-plaintext highlighter-rouge"">kubectl</code>, utilize Labels and Selectors, explore various components of the Kubernetes control plane, and more. You’ll get your own Kubernetes cluster where you can deploy apps, learn how to influence scheduling decisions, and monitor the health of clustered workloads.</p><h2 id=""workshop-description"">Workshop Description</h2><blockquote>  <p>As anyone who has ever moved house knows, the more effectively you can pack, the easier your move will be. It’s a big task, often requiring thousands of tiny decisions to make sure delicate items are wrapped appropriately, all one’s stuff fits neatly into all the available boxes, and so on. Once the boxes are all packed, loading them onto a moving vehicle requires that you distribute their weight more or less evenly so that there are no unpleasant surprises during the move. This is more or less what container orchestration tools are for, except instead of moving physical bins, we have to ship software inside containers. Each container requires resources, like CPU time and memory space, which means we’ll need to play a sort of Tetris game to make sure all our containers fit in the most dense, yet most balanced, arrangement to keep our hardware costs as low as possible.</p>  <p><a href=""https://kubernetes.io/"">Kubernetes</a> is the free and open source industry standard container orchestration platform that provides both system administrators and application developers with a set of tools for cooperatively building, deploying, and maintaining applications at all levels of scale. Its job is to help you get the most out of your hardware by “packing” all your containers (installed server software) into the fewest possible “bins” (physical or virtual machines), and then automatically monitoring, restarting, adding, removing, or shuffling those containers from one machine to another as demand for the services running on your cluster change. Your job is to tell Kubernetes what your ideal deployment situation is, and what to prioritize when resources get scarce.</p>  <p>In this intermediate-level workshop, we’ll build on our knowledge of Linux <a href=""https://techlearningcollective.com/workshops/Ship-Shape-Computing-Working-with-Containers-and-Containzerizing-Digital-Workloads"">containers</a> and fundamental system administration tasks to explore a Kubernetes cluster. You’ll learn how to inspect workloads using the <a href=""https://kubernetes.io/docs/reference/kubectl/overview/""><code class=""language-plaintext highlighter-rouge"">kubectl</code></a> command line utility, a graphical Web-based dashboard, and the Kubernetes API itself. By exploring the <a href=""https://kubernetes.io/docs/concepts/overview/components/"">Kubernetes control plane</a>, you’ll get insight into how Kubernetes makes scheduling decisions and, along with using <a href=""https://kubernetes.io/docs/concepts/overview/working-with-objects/labels/"">Labels and Selectors</a>, you’ll learn how to influence those scheduling decisions by <a href=""https://kubernetes.io/docs/concepts/scheduling-eviction/taint-and-toleration/"">tainting</a> certain resources in specific ways. Finally, you’ll see how Kubernetes provides a set of “cloud-native” services and APIs that developers can use to write apps that spawn more replicas of themselves when needed and perform other forms of automated or self-healing tasks, making the system administrator’s job that much easier.</p></blockquote><p>As this is a remote/online-only event, there is no physical class space, but attendance is still limited to 15 students, so <a href=""#tickets-workshop-2021-05-08-where-the-sky-meets-the-sea-understanding-container-orchestration-with-kubernetes"">purchase your ticket now</a> to reserve your spot.</p><p>To participate in our webinars, you will need access to a modern Web browser such as an up-to-date copy of <a href=""https://www.mozilla.org/firefox/"">Mozilla Firefox</a> or <a href=""https://www.google.com/chrome/"">Google Chrome</a>. You will also need a reliable Internet connection. We recommend disabling Wi-Fi and plugging your computer in to a hard-wired Ethernet network cable for the duration of the webinar, if possible.</p><p>If you would like to share your video screen or appear on camera, you will need to have and activate your own camera, such as the one built-in to many modern laptops. Similarly, to speak with the rest of the webinar participants, you will need a microphone. If you do choose to activate your microphone, we ask that you please plug in headphones/ear buds or use a headset in order to help reduce audio feedback loops that can degrade the webinar experience for other participants.</p><p>Please refer to <a href=""https://techlearningcollective.com/faq/#workshops-and-webinars"">our workshops and webinars FAQ</a> for additional tips and advice before you join the video conference.</p><p>As with all Tech Learning Collective events, racism, queerphobia, transphobia, sexism, “brogrammer,” “manarchist,” or any kind of similarly awful behavior <em>will</em> result in immediate removal from class without a refund. Please refer to <a href=""https://github.com/AnarchoTechNYC/meta/wiki/Social-rules"">our lightweight social rules</a> for details on our strictly enforced no-tolerance policy against bigotry of any kind.</p><h2 id=""about-tech-learning-collective"">About Tech Learning Collective</h2><p>Tech Learning Collective is an apprenticeship-based technology school that trains politically self-motivated individuals in the arts of hypermedia, Information Technology, and radical political practice. We offer unparalleled free, by-donation, and low-cost computer classes on topics ranging from fundamental computer literacy to the same offensive computer hacking techniques used by national intelligence agencies and military powers (cyber armies). For more information and to enroll, visit <a href=""https://techlearningcollective.com/"">TechLearningCollective.com</a>.</p>","There are no special instructions for this event.","techlearningcollective@riseup.net","","","","","","15","","","","17:00","05/08/21","true","","","","","","en","http://techlearningcollective.com/events/2021/05/workshop-2021-05-08-where-the-sky-meets-the-sea-understanding-container-orchestration-with-kubernetes","","","","","","","","","","","http://techlearningcollective.com/events/2021/05/workshop-2021-05-08-where-the-sky-meets-the-sea-understanding-container-orchestration-with-kubernetes"
"Clearing Away the Clouds: How Computer Networks, Servers, and the Internet Work","Clearing Away the Clouds: How Computer Networks, Servers, and the Internet Work (at  on May  9, 2021)","","","","","","","15:30","05/09/21","","techlearningcollective@riseup.net","<p>Learn the basics of computer networking in this workshop that starts by watching a “conversation” between two computers as it’s happening in real time. You’ll be introduced to the free professional network analysis application called Wireshark so that you can listen in on what the programs on your computer are saying to or hearing from other computers across the Internet. By the end of this workshop, you’ll understand all about the basics of computer networking. If you’ve ever been curious about what happens “on the wire” when you’re browsing a Web site, or if you ever wanted to take a look “under the hood” of your Wi-Fi connection, this is the class for you!</p><h2 id=""workshop-description"">Workshop Description</h2><blockquote>  <p>Our ability to browse Web sites, send and receive digital messages like emails and text messages, and make phone or video calls depends on the connections our digital devices make with one another. That makes it critical to understand how these connections are made, and where they lead to. Far from being an amorphous “cloud,” modern telecommunications networks and services like the Internet are made up of physical devices. Some of these you can see, like your own computer or the router and modem in your house, and others you can’t, like distant servers or Layer 2 switches that make up the network infrastructure itself.</p>  <p>In this workshop derived from a portion of the <a href=""https://techlearningcollective.com/courses/net101.html"">Tech Learning Collective’s NET101 course</a>, you’ll have the opportunity to actually look—visually and with great detail—at how your computer “talks” to other computers like those that power Google Drive, Facebook, and other cloud services. By using an industry-standard tool called <a href=""https://wireshark.org/"">Wireshark</a>, we’ll dissect a conversation between your computer and a server and walk through the process of encapsulating a packet of application layer data, emitting it onto a network, and watching it travel to its destination. We’ll also touch on some illustrative counter-examples to explore how things can go wrong on a network, such as <a href=""https://en.wikipedia.org/wiki/Dynamic_Host_Configuration_Protocol"">DHCP</a> server misconfigurations, <a href=""https://en.wikipedia.org/wiki/ARP_spoofing"">ARP spoofing attacks</a>, and unsecured or weakly-secured Wi-Fi networks.</p></blockquote><p>As this is a remote/online-only event, there is no physical class space, but attendance is still limited to 15 students, so <a href=""#tickets-workshop-2021-05-09-clearing-away-the-clouds-how-computer-networks-servers-and-the-internet-work"">purchase your ticket now</a> to reserve your spot.</p><p>To participate in our webinars, you will need access to a modern Web browser such as an up-to-date copy of <a href=""https://www.mozilla.org/firefox/"">Mozilla Firefox</a> or <a href=""https://www.google.com/chrome/"">Google Chrome</a>. You will also need a reliable Internet connection. We recommend disabling Wi-Fi and plugging your computer in to a hard-wired Ethernet network cable for the duration of the webinar, if possible.</p><p>If you would like to share your video screen or appear on camera, you will need to have and activate your own camera, such as the one built-in to many modern laptops. Similarly, to speak with the rest of the webinar participants, you will need a microphone. If you do choose to activate your microphone, we ask that you please plug in headphones/ear buds or use a headset in order to help reduce audio feedback loops that can degrade the webinar experience for other participants.</p><p>Please refer to <a href=""https://techlearningcollective.com/faq/#workshops-and-webinars"">our workshops and webinars FAQ</a> for additional tips and advice before you join the video conference.</p><p>As with all Tech Learning Collective events, racism, queerphobia, transphobia, sexism, “brogrammer,” “manarchist,” or any kind of similarly awful behavior <em>will</em> result in immediate removal from class without a refund. Please refer to <a href=""https://github.com/AnarchoTechNYC/meta/wiki/Social-rules"">our lightweight social rules</a> for details on our strictly enforced no-tolerance policy against bigotry of any kind.</p><h2 id=""about-tech-learning-collective"">About Tech Learning Collective</h2><p>Tech Learning Collective is an apprenticeship-based technology school that trains politically self-motivated individuals in the arts of hypermedia, Information Technology, and radical political practice. We offer unparalleled free, by-donation, and low-cost computer classes on topics ranging from fundamental computer literacy to the same offensive computer hacking techniques used by national intelligence agencies and military powers (cyber armies). For more information and to enroll, visit <a href=""https://techlearningcollective.com/"">TechLearningCollective.com</a>.</p>","There are no special instructions for this event.","techlearningcollective@riseup.net","","","","","","15","","","","17:00","05/09/21","true","","","","","","en","http://techlearningcollective.com/events/2021/05/workshop-2021-05-09-clearing-away-the-clouds-how-computer-networks-servers-and-the-internet-work","","","","","","","","","","","http://techlearningcollective.com/events/2021/05/workshop-2021-05-09-clearing-away-the-clouds-how-computer-networks-servers-and-the-internet-work"
