event_title,administrative_title,location_name,address,city,state,zip,country,time,date,timezone,host,attendee_pitch,attendee_instructions,host_contact_info,van_id,shift_id,role_id,status_id,custom_fields,rsvp_limit,automatic_notifications,display_sharing_options,submit_button_title,end_date,end_time,disable_discussions,reminder_message,reminder_from,reminder_subject,reminder_reply_to,allow_guests,language,redirect_url,email_response,response_message,response_from,response_subject,response_reply_to,twitter_share,email_share,facebook_title,facebook_link,facebook_description,direct_link
"Tor: What is it Good For? (Absolutely Everything!)","Tor: What is it Good For? (Absolutely Everything!) (at  on January 23, 2021)","","","","","","","15:30","01/23/21","","techlearningcollective@riseup.net","<p>Come learn how the free Tor Web Browser can be your gateway to the Dark Web while simultaneously keeping you safer and your personal info more private as you browse web sites big and small. In this deep dive workshop on Tor, the Tech Learning Collective’s cybersecurity trainers will show you how to make the most of this widely available and free digital safety tool.</p><h2 id=""workshop-description"">Workshop Description</h2><blockquote>  <p>From illegal online drug stores like Silk Road to DDoS botnet command and control headquarters, media attention has long painted “the Dark Web” as though nothing good can come of it. But learn just a little bit more about how Tor and “hidden services” work and you’ll find a treasure trove of valuable possibilities for day-to-day Internet use. The same technology that can hide the location of a drug ring can also serve as a free VPN-like service to protect your privacy while you browse the Internet, make censored websites available again, and even let you host your own Internet services for free, all without opening a single port on your firewall!</p>  <p>In this deep dive workshop on Tor, the Tech Learning Collective’s cybersecurity trainers will show you how to make the most of this widely available and free digital safety tool. They’ll demonstrate numerous Tor features such as Tor authentication, target service load balancing, and NAT-punching. In the process, you’ll finally understand—on a technical level—what the “Dark Web” actually is and how it works. Bring a laptop to class, and you’ll leave having run your own Dark Web site. This class is for everyone; whether you’re a veteran black hat or a timid newbie, this class will shine a light on the Dark Web once and for all.</p></blockquote><p>As this is a remote/online-only event, there is no physical class space, but attendance is still limited to 15 students, so <a href=""#tickets-workshop-2021-01-23-tor-what-is-it-good-for-absolutely-everything"">purchase your ticket now</a> to reserve your spot.</p><p>To participate in our webinars, you will need access to a modern Web browser such as an up-to-date copy of <a href=""https://www.mozilla.org/firefox/"">Mozilla Firefox</a> or <a href=""https://www.google.com/chrome/"">Google Chrome</a>. You will also need a reliable Internet connection. We recommend disabling Wi-Fi and plugging your computer in to a hard-wired Ethernet network cable for the duration of the webinar, if possible.</p><p>If you would like to share your video screen or appear on camera, you will need to have and activate your own camera, such as the one built-in to many modern laptops. Similarly, to speak with the rest of the webinar participants, you will need a microphone. If you do choose to activate your microphone, we ask that you please plug in headphones/ear buds or use a headset in order to help reduce audio feedback loops that can degrade the webinar experience for other participants.</p><p>Please refer to <a href=""https://techlearningcollective.com/faq/#workshops-and-webinars"">our workshops and webinars FAQ</a> for additional tips and advice before you join the video conference.</p><p>As with all Tech Learning Collective events, racism, queerphobia, transphobia, sexism, “brogrammer,” “manarchist,” or any kind of similarly awful behavior <em>will</em> result in immediate removal from class without a refund. Please refer to <a href=""https://github.com/AnarchoTechNYC/meta/wiki/Social-rules"">our lightweight social rules</a> for details on our strictly enforced no-tolerance policy against bigotry of any kind.</p><h2 id=""about-tech-learning-collective"">About Tech Learning Collective</h2><p>Tech Learning Collective is an apprenticeship-based technology school that trains politically self-motivated individuals in the arts of hypermedia, Information Technology, and radical political practice. We offer unparalleled free, by-donation, and low-cost computer classes on topics ranging from fundamental computer literacy to the same offensive computer hacking techniques used by national intelligence agencies and military powers (cyber armies). For more information and to enroll, visit <a href=""https://techlearningcollective.com/"">TechLearningCollective.com</a>.</p>","There are no special instructions for this event.","techlearningcollective@riseup.net","","","","","","15","","","","17:00","01/23/21","true","","","","","","en","http://techlearningcollective.com/events/2021/01/workshop-2021-01-23-tor-what-is-it-good-for-absolutely-everything","","","","","","","","","","","http://techlearningcollective.com/events/2021/01/workshop-2021-01-23-tor-what-is-it-good-for-absolutely-everything"
"Writing with Blue Fire: Shell Scripting for Beginners","Writing with Blue Fire: Shell Scripting for Beginners (at  on January 24, 2021)","","","","","","","15:30","01/24/21","","techlearningcollective@riseup.net","<p>Learn how to inscribe your thoughts, dreams, and desires into your computer and take your command line skills to the next level by learning how to write simple programs called shell scripts. In a way, invoking commands one at a time is like writing a program interactively, whereas writing a script inscribes that knowledge into a more permanent form. By learning how to turn commands into simple scripted programs, you can unlock the almost magical potential of your computer and more easily share that potential with others to whom you distribute your scripts.</p><h2 id=""workshop-description"">Workshop Description</h2><blockquote>  <p>At their core, digital computers are very complex writing instruments. Like pen and paper, they allow us to record our thoughts, dreams, and desires for later review. Unlike pen and paper, they allow us to do this at the speed of electricity and at a scale never before imagined possible, and their ability to directly manipulate the physical world through servomotors, industrial control systems, biomedical devices, and other robotic prosthesis means they can potentially supercharge every facet of our humanity.</p>  <p>When a system administrator or programmer uses a computer, they often issue instructions one by one using a special-purpose, text-only interface called a <em><a href=""https://techlearningcollective.com/foundations/"">command line</a></em>. Individually, these instructions are called <em>invocations</em>. (Yes, that’s their technical term!) In this beginner’s workshop, you’ll learn how to write whole spells, rituals, or (sacred) texts called <em>shell scripts</em> to inscribe your own thoughts, dreams, and desires in the electrified silicon and minerals of your computer.</p>  <p>By saving your scripts in files, you can invoke arbitrarily complex routines to reproduce tasks or automate complex procedures with a single command. Writing scripts also makes it possible to share what you can do with others and, as such, are one the simplest forms of computer program that you can write and distribute. Come learn how the magic of digital inscription can help you do your work, and increase your power to accomplish your dreams.</p></blockquote><p>As this is a remote/online-only event, there is no physical class space, but attendance is still limited to 15 students, so <a href=""#tickets-workshop-2021-01-24-writing-with-blue-fire-shell-scripting-for-beginners"">purchase your ticket now</a> to reserve your spot.</p><p>To participate in our webinars, you will need access to a modern Web browser such as an up-to-date copy of <a href=""https://www.mozilla.org/firefox/"">Mozilla Firefox</a> or <a href=""https://www.google.com/chrome/"">Google Chrome</a>. You will also need a reliable Internet connection. We recommend disabling Wi-Fi and plugging your computer in to a hard-wired Ethernet network cable for the duration of the webinar, if possible.</p><p>If you would like to share your video screen or appear on camera, you will need to have and activate your own camera, such as the one built-in to many modern laptops. Similarly, to speak with the rest of the webinar participants, you will need a microphone. If you do choose to activate your microphone, we ask that you please plug in headphones/ear buds or use a headset in order to help reduce audio feedback loops that can degrade the webinar experience for other participants.</p><p>Please refer to <a href=""https://techlearningcollective.com/faq/#workshops-and-webinars"">our workshops and webinars FAQ</a> for additional tips and advice before you join the video conference.</p><p>As with all Tech Learning Collective events, racism, queerphobia, transphobia, sexism, “brogrammer,” “manarchist,” or any kind of similarly awful behavior <em>will</em> result in immediate removal from class without a refund. Please refer to <a href=""https://github.com/AnarchoTechNYC/meta/wiki/Social-rules"">our lightweight social rules</a> for details on our strictly enforced no-tolerance policy against bigotry of any kind.</p><h2 id=""about-tech-learning-collective"">About Tech Learning Collective</h2><p>Tech Learning Collective is an apprenticeship-based technology school that trains politically self-motivated individuals in the arts of hypermedia, Information Technology, and radical political practice. We offer unparalleled free, by-donation, and low-cost computer classes on topics ranging from fundamental computer literacy to the same offensive computer hacking techniques used by national intelligence agencies and military powers (cyber armies). For more information and to enroll, visit <a href=""https://techlearningcollective.com/"">TechLearningCollective.com</a>.</p>","There are no special instructions for this event.","techlearningcollective@riseup.net","","","","","","15","","","","17:00","01/24/21","true","","","","","","en","http://techlearningcollective.com/events/2021/01/workshop-2021-01-24-writing-with-blue-fire-shell-scripting-for-beginners","","","","","","","","","","","http://techlearningcollective.com/events/2021/01/workshop-2021-01-24-writing-with-blue-fire-shell-scripting-for-beginners"
"Something for Everyone: File Servers and Other Network Attached Storage","Something for Everyone: File Servers and Other Network Attached Storage (at  on January 30, 2021)","","","","","","","15:30","01/30/21","","techlearningcollective@riseup.net","<p>Learn how to provide file sharing services by creating your own networked file server so that your family, friends, or colleagues have a private place to save, share, and work on documents or photos together. Maintaining the humble file server is among the most fundamental Information Technology (IT) department tasks in businesses or organizations big and small because most other activities revolve around document storage and retrieval. In this workshop, you’ll be introduced to numerous free and open technologies such as Nextcloud that can replace more familiar Web-based online file storage services like Google Docs, along with many of the file sharing protocols integral to Network Attached Storage (NAS) devices used in today’s enterprises, like NFS, SMB, and WebDAV.</p><h2 id=""workshop-description"">Workshop Description</h2><blockquote>  <p>As early as 1964, computer makers like IBM, Inc. were publicizing the idea that businesses could use computers to eliminate or drastically reduce the drudgery and tedium of paperwork by converting paper documents into electronic files. Of course, even today not all businesses have what IBM promised would be a “paperless office,” but many of them have a rapidly growing number of important digital documents that need to be stored reliably, secured properly, and shared privately. This is what makes the humble file server a centerpiece of Information Technology (IT) department responsibilities.</p>  <p>These days, however, it’s not just businesses who must manage loads of electronic documents. As society becomes increasingly digitized, individuals, community groups, political organizers, and even hobbyists are much more reliant on electronic files today than we have ever been before. This is where familiar Web-based online file storage services like Google Docs, Microsoft Office 365, and Dropbox Paper come in, making it easy for people to save their work in “the cloud,” as long as they’re comfortable letting the company providing the storage service have a peek at their work. But like most things in the Internet age, the file storage and retrieval services that these companies offer are built on the back of Free, Libre, and Open Source Software programs and protocols available to everyone from individuals to large enterprises without paying a dime for them in either monetary cost or privacy exposure.</p>  <p>In this workshop, you’ll learn what it takes to build your own online file storage service for yourself, for a small group of friends, or for a much larger organization. Starting with a simple “shared folder,” you’ll get introduced to network protocols like <a href=""https://en.wikipedia.org/wiki/WebDAV"">WebDAV</a> to see how they enable Web-based distributed authoring and versioning of files including Word documents, Excel spreadsheets, and PDFs, and how these protocols fit into enterprise-ready file storage systems like <a href=""https://nextcloud.com/"">Nextcloud</a>. We’ll also discuss filesystem-level networked filing protocols that define a whole category of computer equipment called <a href=""https://en.wikipedia.org/wiki/Network-attached_storage"">Network-Attached Storage (NAS)</a> devices like the <a href=""https://en.wikipedia.org/wiki/SSH_File_Transfer_Protocol"">(Secure) File Transfer Protocol (SFTP)</a> that are common in Web hosting environments, and the <a href=""https://en.wikipedia.org/wiki/Network_File_System_%28protocol%29"">Network File System (NFS)</a> and <a href=""https://en.wikipedia.org/wiki/Server_Message_Block"">Server Message Block (SMB)</a> protocols that are common in homes and offices.</p></blockquote><p>As this is a remote/online-only event, there is no physical class space, but attendance is still limited to 15 students, so <a href=""#tickets-workshop-2021-01-30-something-for-everyone-file-servers-and-other-network-attached-storage"">purchase your ticket now</a> to reserve your spot.</p><p>To participate in our webinars, you will need access to a modern Web browser such as an up-to-date copy of <a href=""https://www.mozilla.org/firefox/"">Mozilla Firefox</a> or <a href=""https://www.google.com/chrome/"">Google Chrome</a>. You will also need a reliable Internet connection. We recommend disabling Wi-Fi and plugging your computer in to a hard-wired Ethernet network cable for the duration of the webinar, if possible.</p><p>If you would like to share your video screen or appear on camera, you will need to have and activate your own camera, such as the one built-in to many modern laptops. Similarly, to speak with the rest of the webinar participants, you will need a microphone. If you do choose to activate your microphone, we ask that you please plug in headphones/ear buds or use a headset in order to help reduce audio feedback loops that can degrade the webinar experience for other participants.</p><p>Please refer to <a href=""https://techlearningcollective.com/faq/#workshops-and-webinars"">our workshops and webinars FAQ</a> for additional tips and advice before you join the video conference.</p><p>As with all Tech Learning Collective events, racism, queerphobia, transphobia, sexism, “brogrammer,” “manarchist,” or any kind of similarly awful behavior <em>will</em> result in immediate removal from class without a refund. Please refer to <a href=""https://github.com/AnarchoTechNYC/meta/wiki/Social-rules"">our lightweight social rules</a> for details on our strictly enforced no-tolerance policy against bigotry of any kind.</p><h2 id=""about-tech-learning-collective"">About Tech Learning Collective</h2><p>Tech Learning Collective is an apprenticeship-based technology school that trains politically self-motivated individuals in the arts of hypermedia, Information Technology, and radical political practice. We offer unparalleled free, by-donation, and low-cost computer classes on topics ranging from fundamental computer literacy to the same offensive computer hacking techniques used by national intelligence agencies and military powers (cyber armies). For more information and to enroll, visit <a href=""https://techlearningcollective.com/"">TechLearningCollective.com</a>.</p>","There are no special instructions for this event.","techlearningcollective@riseup.net","","","","","","15","","","","17:00","01/30/21","true","","","","","","en","http://techlearningcollective.com/events/2021/01/workshop-2021-01-30-something-for-everyone-file-servers-and-other-network-attached-storage","","","","","","","","","","","http://techlearningcollective.com/events/2021/01/workshop-2021-01-30-something-for-everyone-file-servers-and-other-network-attached-storage"
"Digital Defenses for the People: Practical Digital Security","Digital Defenses for the People: Practical Digital Security (at  on January 31, 2021)","","","","","","","15:30","01/31/21","","techlearningcollective@riseup.net","<p>This beginner-friendly introduction to digital safety will cut through the fear, uncertainty, and doubt generated by the frenetic news cycle and the latest Internet privacy listicle, and offer an opportunity to ask the Tech Learning Collective’s cybersecurity trainers your most pressing online privacy and digital security questions.</p><h2 id=""workshop-description"">Workshop Description</h2><blockquote>  <p>Learning how to stay safe online is on many people’s minds, but how do you start this process? With so many tools and suggestions from “experts,” how do you know which tool to use, when, and in what situation? Do you really need a VPN? (And what even is that?) What are the tools you really <em>should</em> use, and which tools aren’t worth it? Moreover, without being a cybersecurity expert yourself, how do you learn to sniff out the useful stuff from the placebos?</p>  <p>This beginner’s workshop taught by the <a href=""https://techlearningcollective.com/"">Tech Learning Collective</a>’s cybersecurity trainers offers <a href=""https://techlearningcollective.com/about/persona-matrix/"">a simple framework</a> anyone can use to understand what risks they might face and how to protect themselves from those risks. <a href=""https://github.com/AnarchoTechNYC/meta/wiki/Persona-based-training-matrix"">Developed and maintained by the Anarcho-Tech NYC Collective</a>, an independent cybersecurity research group that provides digital security services to anti-fascist groups in New York City, this framework now forms the basis of many digital safety workshops. It is a simple three-by-three grid in which you can place both yourself and your online safety concerns by answering a few intuitive questions like “How likely is it that I will be targeted?” and “How many resources (money, people, etcetera) does my attacker have?”</p>  <p>Although <a href=""https://prism-break.org/en/"">there are many good and free tools available</a>, most people only need to use a few basic ones: a secure messaging application (like <a href=""https://techlearningcollective.com/workshops/Signal-and-Surveillance-How-to-Exercise-Digital-Civil-Liberties-in-a-Surveillance-State"">Signal</a>), a password manager (like <a href=""https://keepass.info/"">KeePass</a> or <a href=""https://bitwarden.com/"">Bitwarden</a>, and a few of the built-in features of their existing computers, like the full-disk encryption software available for free on every modern laptop and smartphone. This short, calming introduction to digital safety cuts through the fear, uncertainty, and doubt generated by the frenetic news cycle and the latest Internet privacy listicle. You’ll leave this workshop with a security plan in place, and a much clearer picture of the first few steps you <em>should</em> take to protect yourself and your information both online and offline.</p></blockquote><p>As this is a remote/online-only event, there is no physical class space, but attendance is still limited to 15 students, so <a href=""#tickets-workshop-2021-01-31-digital-defenses-for-the-people-practical-digital-security"">purchase your ticket now</a> to reserve your spot.</p><p>To participate in our webinars, you will need access to a modern Web browser such as an up-to-date copy of <a href=""https://www.mozilla.org/firefox/"">Mozilla Firefox</a> or <a href=""https://www.google.com/chrome/"">Google Chrome</a>. You will also need a reliable Internet connection. We recommend disabling Wi-Fi and plugging your computer in to a hard-wired Ethernet network cable for the duration of the webinar, if possible.</p><p>If you would like to share your video screen or appear on camera, you will need to have and activate your own camera, such as the one built-in to many modern laptops. Similarly, to speak with the rest of the webinar participants, you will need a microphone. If you do choose to activate your microphone, we ask that you please plug in headphones/ear buds or use a headset in order to help reduce audio feedback loops that can degrade the webinar experience for other participants.</p><p>Please refer to <a href=""https://techlearningcollective.com/faq/#workshops-and-webinars"">our workshops and webinars FAQ</a> for additional tips and advice before you join the video conference.</p><p>As with all Tech Learning Collective events, racism, queerphobia, transphobia, sexism, “brogrammer,” “manarchist,” or any kind of similarly awful behavior <em>will</em> result in immediate removal from class without a refund. Please refer to <a href=""https://github.com/AnarchoTechNYC/meta/wiki/Social-rules"">our lightweight social rules</a> for details on our strictly enforced no-tolerance policy against bigotry of any kind.</p><h2 id=""about-tech-learning-collective"">About Tech Learning Collective</h2><p>Tech Learning Collective is an apprenticeship-based technology school that trains politically self-motivated individuals in the arts of hypermedia, Information Technology, and radical political practice. We offer unparalleled free, by-donation, and low-cost computer classes on topics ranging from fundamental computer literacy to the same offensive computer hacking techniques used by national intelligence agencies and military powers (cyber armies). For more information and to enroll, visit <a href=""https://techlearningcollective.com/"">TechLearningCollective.com</a>.</p>","There are no special instructions for this event.","techlearningcollective@riseup.net","","","","","","15","","","","17:00","01/31/21","true","","","","","","en","http://techlearningcollective.com/events/2021/01/workshop-2021-01-31-digital-defenses-for-the-people-practical-digital-security","","","","","","","","","","","http://techlearningcollective.com/events/2021/01/workshop-2021-01-31-digital-defenses-for-the-people-practical-digital-security"
