event_title,administrative_title,location_name,address,city,state,zip,country,time,date,timezone,host,attendee_pitch,attendee_instructions,host_contact_info,van_id,shift_id,role_id,status_id,custom_fields,rsvp_limit,automatic_notifications,display_sharing_options,submit_button_title,end_date,end_time,disable_discussions,reminder_message,reminder_from,reminder_subject,reminder_reply_to,allow_guests,language,redirect_url,email_response,response_message,response_from,response_subject,response_reply_to,twitter_share,email_share,facebook_title,facebook_link,facebook_description,direct_link
"The Imitation Game: Introduction to Administering Virtual Machine Systems","The Imitation Game: Introduction to Administering Virtual Machine Systems (at  on February 15, 2020)","","","","","","","19:00","02/15/20","","techlearningcollective@riseup.net","<p>This two-hour workshop is a practical introduction to creating, using, and administering virtual machine (VM) systems. Even if you’ve never heard of a virtual machine before, you probably already use the underlying technology. And you can get a lot out of using a virtual machine even if you aren’t a software developer because they can help secure your Web browsing activity, give you a sandbox in which to try out new software, and much more!</p><h2 id=""workshop-description"">Workshop Description</h2><blockquote>  <p>Virtualization and containerization are concepts almost as old as computing itself so, no matter what you’re doing on your computer, you’re probably using one form of it or another. For example, partitioning a hard disk chunks its total capacity into smaller units useful for specific purposes, much like the individual drawers in a dresser might separate undergarments from outerwear. Organizing, or “containerizing,” your closet this way is useful in its own right because it helps you keep things neat and orderly. But this organizing method also offers dramatic security enhancements because a misbehaving program (or dirty sock) will be confined to its own container.</p>  <p>Today, virtualization has become integral to how desktop computers, servers, and global data networks work, and cross-platform, Free Software virtualization programs have never been easier to use. Storage virtualization makes it possible for a single file on your computer to appear to be an entire hard disk drive (such as provided by <a href=""https://www.veracrypt.fr/"">VeraCrypt</a>), network virtualization makes it possible to simulate different networks (e.g., using <a href=""https://en.wikipedia.org/wiki/Virtual_LAN"">VLANs</a>) or even the whole Internet (using <a href=""https://www.inetsim.org/"">INetSim</a>), processor virtualization makes it possible to run programs built for one microchip architecture on computers running a completely different one (e.g., in <a href=""https://www.qemu.org/"">QEMU</a>), and fully-fledged virtual machine monitors (VMMs) or hypervisors can construct and modify entire hardware environments complete with virtual video monitors and other peripherals on the fly (as is offered by <a href=""https://www.proxmox.com/"">Proxmox</a>). Virtualization is even the bedrock of numerous Operating System and Web browser security features, such as in the <a href=""https://www.qubes-os.org/"">Qubes Operating System</a>, <a href=""https://developer.apple.com/library/archive/documentation/Security/Conceptual/AppSandboxDesignGuide/AboutAppSandbox/AboutAppSandbox.html"">macOS’s App Sandbox</a>, and <a href=""https://support.mozilla.org/kb/containers"">Firefox Containers</a>.</p>  <p>Whether you’re using your computer for fun or for profit, this workshop will get you up and running with Virtual Machines using the <a href=""https://virtualbox.org/"">VirtualBox</a> type-2 hypervisor so you can experiment with unfamiliar software more boldly, browse the Web more safely, and play games you otherwise wouldn’t have been able to. By learning how to take advantage of the virtualization capabilities your computer already offers, you can revive your love of that long-lost DOS point-and-click adventure, reliably build and test single- and multi-machine networked software systems, or simply create an almost unlimited number of purpose-built virtual machines that all exist, like inception, inside your existing laptop or other personal computer.</p></blockquote><p>As this is a remote/online-only event, there is no physical class space, but attendance is still limited to 15 students, so <a href=""#tickets-workshop-2020-02-15-the-imitation-game-introduction-to-administering-virtual-machine-systems"">purchase your ticket now</a> to reserve your spot.</p><p>To participate in our webinars, you will need access to a modern Web browser such as an up-to-date copy of <a href=""https://www.mozilla.org/firefox/"">Mozilla Firefox</a> or <a href=""https://www.google.com/chrome/"">Google Chrome</a>. You will also need a reliable Internet connection. We recommend disabling Wi-Fi and plugging your computer in to a hard-wired Ethernet network cable for the duration of the webinar, if possible.</p><p>If you would like to share your video screen or appear on camera, you will need to have and activate your own camera, such as the one built-in to many modern laptops. Similarly, to speak with the rest of the webinar participants, you will need a microphone. If you do choose to activate your microphone, we ask that you please plug in headphones/ear buds or use a headset in order to help reduce audio feedback loops that can degrade the webinar experience for other participants.</p><p>Please refer to <a href=""https://techlearningcollective.com/faq/#workshops-and-webinars"">our workshops and webinars FAQ</a> for additional tips and advice before you join the video conference.</p><p>As with all Tech Learning Collective events, racism, queerphobia, transphobia, sexism, “brogrammer,” “manarchist,” or any kind of similarly awful behavior <em>will</em> result in immediate removal from class without a refund. Please refer to <a href=""https://github.com/AnarchoTechNYC/meta/wiki/Social-rules"">our lightweight social rules</a> for details on our strictly enforced no-tolerance policy against bigotry of any kind.</p><h2 id=""about-the-tech-learning-collective"">About the Tech Learning Collective</h2><p>Tech Learning Collective is an apprenticeship-based technology school that trains politically self-motivated individuals in the arts of hypermedia, Information Technology, and radical political practice. We offer unparalleled free, by-donation, and low-cost computer classes on topics ranging from fundamental computer literacy to the same offensive computer hacking techniques used by national intelligence agencies and military powers (cyber armies). For more information and to enroll, visit <a href=""https://techlearningcollective.com/"">TechLearningCollective.com</a>.</p>","There are no special instructions for this event.","techlearningcollective@riseup.net","","","","","","15","","","","21:00","02/15/20","true","","","","","","en","http://techlearningcollective.com/events/2020/02/workshop-2020-02-15-the-imitation-game-introduction-to-administering-virtual-machine-systems","","","","","","","","","","","http://techlearningcollective.com/events/2020/02/workshop-2020-02-15-the-imitation-game-introduction-to-administering-virtual-machine-systems"
"Taming Daemons: System Administration and Operation Basics","Taming Daemons: System Administration and Operation Basics (at  on February 17, 2020)","","","","","","","19:30","02/17/20","","techlearningcollective@riseup.net","<p>Most individuals with access to a computer system have more power today than ever before, but rarely do they make use of it or even know how much power they truly have. In this beginner’s workshop, you’ll begin learning how to “speak with the machines.” By learning to communicate more expressively with the digital devices that are increasingly responsible for mediating contemporary society, you’ll gain the power to effectively and materially change your relationship not only with your laptop, but with global systems of law, finance, and even art, literature, and philosophy governing today’s world.</p><h2 id=""workshop-description"">Workshop Description</h2><blockquote>  <p>How much good does a powerful tool do for you if you don’t know how to use it well? How much more capable would you be if you mastered all the tools available to you? It might sound ridiculous, but failing to learn the practicalities of computer system operation basics is arguably the most common mistake people in the fast-paced tech scene make.</p>  <p>Modern computers are power tools, and behind each one of them is a human operator, or “system administrator,” responsible for configuring and maintaining that computer. If you have a personal computer such as a laptop or smartphone, then you are already a system administrator whether you realize it or not! Making sure the apps you want to use are installed and up to date, managing the amount of free space you have for your photos, and connecting or disconnecting from the Internet are all examples of simple system administration tasks that you probably already take on a daily basis.</p>  <p>In this beginner’s workshop, we’ll start by exploring what happens inside your computer when you take every-day tasks like open a Web browser or save files, and then dive down the rabbit hole to meet the special class of programs that make it possible for all your other programs to work. Called <em>daemons</em>, short for Disk Access and Execution Monitors, they make up the world of Operating System services, signals, sockets, and more under the hood of your desktop environment. By the end of this workshop, you’ll have a far deeper understanding of how to care for your computer, as well as the ability to understand any new tools or services you encounter a whole lot faster than ever before.</p></blockquote><p>As this is a remote/online-only event, there is no physical class space, but attendance is still limited to 15 students, so <a href=""#tickets-workshop-2020-02-17-taming-daemons-system-administration-and-operation-basics"">purchase your ticket now</a> to reserve your spot.</p><p>To participate in our webinars, you will need access to a modern Web browser such as an up-to-date copy of <a href=""https://www.mozilla.org/firefox/"">Mozilla Firefox</a> or <a href=""https://www.google.com/chrome/"">Google Chrome</a>. You will also need a reliable Internet connection. We recommend disabling Wi-Fi and plugging your computer in to a hard-wired Ethernet network cable for the duration of the webinar, if possible.</p><p>If you would like to share your video screen or appear on camera, you will need to have and activate your own camera, such as the one built-in to many modern laptops. Similarly, to speak with the rest of the webinar participants, you will need a microphone. If you do choose to activate your microphone, we ask that you please plug in headphones/ear buds or use a headset in order to help reduce audio feedback loops that can degrade the webinar experience for other participants.</p><p>Please refer to <a href=""https://techlearningcollective.com/faq/#workshops-and-webinars"">our workshops and webinars FAQ</a> for additional tips and advice before you join the video conference.</p><p>As with all Tech Learning Collective events, racism, queerphobia, transphobia, sexism, “brogrammer,” “manarchist,” or any kind of similarly awful behavior <em>will</em> result in immediate removal from class without a refund. Please refer to <a href=""https://github.com/AnarchoTechNYC/meta/wiki/Social-rules"">our lightweight social rules</a> for details on our strictly enforced no-tolerance policy against bigotry of any kind.</p><h2 id=""about-the-tech-learning-collective"">About the Tech Learning Collective</h2><p>Tech Learning Collective is an apprenticeship-based technology school that trains politically self-motivated individuals in the arts of hypermedia, Information Technology, and radical political practice. We offer unparalleled free, by-donation, and low-cost computer classes on topics ranging from fundamental computer literacy to the same offensive computer hacking techniques used by national intelligence agencies and military powers (cyber armies). For more information and to enroll, visit <a href=""https://techlearningcollective.com/"">TechLearningCollective.com</a>.</p>","There are no special instructions for this event.","techlearningcollective@riseup.net","","","","","","15","","","","21:00","02/17/20","true","","","","","","en","http://techlearningcollective.com/events/2020/02/workshop-2020-02-17-taming-daemons-system-administration-and-operation-basics","","","","","","","","","","","http://techlearningcollective.com/events/2020/02/workshop-2020-02-17-taming-daemons-system-administration-and-operation-basics"
"Collaboration Across Universes: Basics of Version Control with Git","Collaboration Across Universes: Basics of Version Control with Git (at  on February 19, 2020)","","","","","","","14:00","02/19/20","","techlearningcollective@riseup.net","<p>Ever work on a project with other people? Of course you do. If you’ve been saving files with names like “Project-outline-1” and then saving another version of that file as “Project-outline-2” then you already understand the importance of a Version Control System (VCS). In this beginner’s workshop, you’ll see the popular Git version control system in action and learn how to improve your collaborative workflow whether you’re a software engineer, novelist, or art designer.</p><h2 id=""workshop-description"">Workshop Description</h2><blockquote>  <p>As most of us know first-hand, the creative process involves many edits and revisions. Adding a little bit here, trimming a little bit there, but then hitting “undo” a bunch and experimenting with a new direction is quite normal! When your project is a single file, pressing “Save As…” many times might suffice, but what if your project spans dozens or even hundreds of files?</p>  <p>This is where version control systems (VCSs) shine. Designed to track, compare, and merge different versions of the same project, these tools give you the ability to make a snapshot of the state of your work at a given point in time so that you can “undo” or “redo” any number of times, across any number of files. Moreover, by naming different snapshots, you can create an infinite number of variations of your project and then build on those unique versions without affecting the others; it’s as though the new version is in its own alternate universe. This makes it possible to easily and safely experiment in one universe (called a <em>branch</em>) without throwing away or overwriting the original version of the project on which your changes were based.</p>  <p>In this beginner’s workshop, you’ll learn the basics of <a href=""https://git-scm.com/"">Git</a>, a free distributed version control system on which popular sites like <a href=""https://github.com/"">GitHub</a> are based. Git is lovingly called “the stupid content tracker” because it can track changes to everything and anything that can be digitized. Although it was originally invented for software programmers, Git is also useful for novelists, researchers, and anyone else whose work involves creativity in a digital medium.</p></blockquote><p>As this is a remote/online-only event, there is no physical class space, but attendance is still limited to 15 students, so <a href=""#tickets-workshop-2020-02-19-collaboration-across-universes-basics-of-version-control-with-git"">purchase your ticket now</a> to reserve your spot.</p><p>To participate in our webinars, you will need access to a modern Web browser such as an up-to-date copy of <a href=""https://www.mozilla.org/firefox/"">Mozilla Firefox</a> or <a href=""https://www.google.com/chrome/"">Google Chrome</a>. You will also need a reliable Internet connection. We recommend disabling Wi-Fi and plugging your computer in to a hard-wired Ethernet network cable for the duration of the webinar, if possible.</p><p>If you would like to share your video screen or appear on camera, you will need to have and activate your own camera, such as the one built-in to many modern laptops. Similarly, to speak with the rest of the webinar participants, you will need a microphone. If you do choose to activate your microphone, we ask that you please plug in headphones/ear buds or use a headset in order to help reduce audio feedback loops that can degrade the webinar experience for other participants.</p><p>Please refer to <a href=""https://techlearningcollective.com/faq/#workshops-and-webinars"">our workshops and webinars FAQ</a> for additional tips and advice before you join the video conference.</p><p>As with all Tech Learning Collective events, racism, queerphobia, transphobia, sexism, “brogrammer,” “manarchist,” or any kind of similarly awful behavior <em>will</em> result in immediate removal from class without a refund. Please refer to <a href=""https://github.com/AnarchoTechNYC/meta/wiki/Social-rules"">our lightweight social rules</a> for details on our strictly enforced no-tolerance policy against bigotry of any kind.</p><h2 id=""about-the-tech-learning-collective"">About the Tech Learning Collective</h2><p>Tech Learning Collective is an apprenticeship-based technology school that trains politically self-motivated individuals in the arts of hypermedia, Information Technology, and radical political practice. We offer unparalleled free, by-donation, and low-cost computer classes on topics ranging from fundamental computer literacy to the same offensive computer hacking techniques used by national intelligence agencies and military powers (cyber armies). For more information and to enroll, visit <a href=""https://techlearningcollective.com/"">TechLearningCollective.com</a>.</p>","There are no special instructions for this event.","techlearningcollective@riseup.net","","","","","","15","","","","15:30","02/19/20","true","","","","","","en","http://techlearningcollective.com/events/2020/02/workshop-2020-02-19-collaboration-across-universes-basics-of-version-control-with-git","","","","","","","","","","","http://techlearningcollective.com/events/2020/02/workshop-2020-02-19-collaboration-across-universes-basics-of-version-control-with-git"
"Clearing Away the Clouds: How Computer Networks, Servers, and the Internet Work","Clearing Away the Clouds: How Computer Networks, Servers, and the Internet Work (at  on February 19, 2020)","","","","","","","19:00","02/19/20","","techlearningcollective@riseup.net","<p>This two-hour workshop is all about the basics of computer networking. If you’ve ever been curious about what happens “on the wire” when you’re browsing a Web site, or if you ever wanted to take a look “under the hood” of your Wi-Fi connection, this is the class for you!</p><h2 id=""workshop-description"">Workshop Description</h2><blockquote>  <p>Our ability to browse Web sites, send and receive digital messages like emails and text messages, and make phone or video calls depends on the connections our digital devices make with one another. That makes it critical to understand how these connections are made, and where they lead to. Far from being an amorphous “cloud,” modern telecommunications networks and services like the Internet are made up of physical devices. Some of these you can see, like your own computer or the router and modem in your house, and others you can’t, like distant servers or Layer 2 switches that make up the network infrastructure itself.</p>  <p>In this workshop derived from a portion of the <a href=""https://techlearningcollective.com/courses/net101.html"">Tech Learning Collective’s NET101 course</a>, you’ll have the opportunity to actually look—visually and with great detail—at how your computer “talks” to other computers like those that power Google Drive, Facebook, and other cloud services. By using an industry-standard tool called <a href=""https://wireshark.org/"">Wireshark</a>, we’ll dissect a conversation between your computer and a server and walk through the process of encapsulating a packet of application layer data, emitting it onto a network, and watching it travel to its destination. We’ll also touch on some illustrative counter-examples to explore how things can go wrong on a network, such as <a href=""https://en.wikipedia.org/wiki/Dynamic_Host_Configuration_Protocol"">DHCP</a> server misconfigurations, <a href=""https://en.wikipedia.org/wiki/ARP_spoofing"">ARP spoofing attacks</a>, and unsecured or weakly-secured Wi-Fi networks.</p></blockquote><p>As this is a remote/online-only event, there is no physical class space, but attendance is still limited to 15 students, so <a href=""#tickets-workshop-2020-02-19-clearing-away-the-clouds-how-computer-networks-servers-and-the-internet-work"">purchase your ticket now</a> to reserve your spot.</p><p>To participate in our webinars, you will need access to a modern Web browser such as an up-to-date copy of <a href=""https://www.mozilla.org/firefox/"">Mozilla Firefox</a> or <a href=""https://www.google.com/chrome/"">Google Chrome</a>. You will also need a reliable Internet connection. We recommend disabling Wi-Fi and plugging your computer in to a hard-wired Ethernet network cable for the duration of the webinar, if possible.</p><p>If you would like to share your video screen or appear on camera, you will need to have and activate your own camera, such as the one built-in to many modern laptops. Similarly, to speak with the rest of the webinar participants, you will need a microphone. If you do choose to activate your microphone, we ask that you please plug in headphones/ear buds or use a headset in order to help reduce audio feedback loops that can degrade the webinar experience for other participants.</p><p>Please refer to <a href=""https://techlearningcollective.com/faq/#workshops-and-webinars"">our workshops and webinars FAQ</a> for additional tips and advice before you join the video conference.</p><p>As with all Tech Learning Collective events, racism, queerphobia, transphobia, sexism, “brogrammer,” “manarchist,” or any kind of similarly awful behavior <em>will</em> result in immediate removal from class without a refund. Please refer to <a href=""https://github.com/AnarchoTechNYC/meta/wiki/Social-rules"">our lightweight social rules</a> for details on our strictly enforced no-tolerance policy against bigotry of any kind.</p><h2 id=""about-the-tech-learning-collective"">About the Tech Learning Collective</h2><p>Tech Learning Collective is an apprenticeship-based technology school that trains politically self-motivated individuals in the arts of hypermedia, Information Technology, and radical political practice. We offer unparalleled free, by-donation, and low-cost computer classes on topics ranging from fundamental computer literacy to the same offensive computer hacking techniques used by national intelligence agencies and military powers (cyber armies). For more information and to enroll, visit <a href=""https://techlearningcollective.com/"">TechLearningCollective.com</a>.</p>","There are no special instructions for this event.","techlearningcollective@riseup.net","","","","","","15","","","","21:00","02/19/20","true","","","","","","en","http://techlearningcollective.com/events/2020/02/workshop-2020-02-19-clearing-away-the-clouds-how-computer-networks-servers-and-the-internet-work","","","","","","","","","","","http://techlearningcollective.com/events/2020/02/workshop-2020-02-19-clearing-away-the-clouds-how-computer-networks-servers-and-the-internet-work"
