event_title,administrative_title,location_name,address,city,state,zip,country,time,date,timezone,host,attendee_pitch,attendee_instructions,host_contact_info,van_id,shift_id,role_id,status_id,custom_fields,rsvp_limit,automatic_notifications,display_sharing_options,submit_button_title,end_date,end_time,disable_discussions,reminder_message,reminder_from,reminder_subject,reminder_reply_to,allow_guests,language,redirect_url,email_response,response_message,response_from,response_subject,response_reply_to,twitter_share,email_share,facebook_title,facebook_link,facebook_description,direct_link
"Guardians of the Watchtowers: Introduction to Service Monitoring and Observability","Guardians of the Watchtowers: Introduction to Service Monitoring and Observability (at  on May 22, 2022)","","","","","","","13:30","05/22/22","","techlearningcollective@riseup.net","<p>Knowing what’s happening on the computers you’re responsible for is a critical part of knowing how to care for and maintain any IT infrastructure. Learn how to automatically monitor and alert on operational issues such as resource exhaustion before they take down your servers and applications. In this workshop, you’ll learn about the “four golden signals” of observability, you’ll be introduced to time series databases and metrics collection with Prometheus, and you’ll learn how to create beautiful charts and graphs from that data with Grafana. Together, these free, industry-standard tools comprise the foundation of all modern and cloud-native IT monitoring stacks.</p><h2 id=""workshop-description"">Workshop Description</h2><blockquote>  <p>Every computer program needs certain resources to operate well, like memory and disk space and CPU cycles. This is true both for simple programs on your laptop and also for complex, cloud-native systems like those that run in massive compute clusters in public cloud or on-premises datacenters. On a single computer, tools like the <a href=""https://support.apple.com/guide/activity-monitor/welcome/mac"">Activity Monitor</a> on macOS or the <a href=""https://www.howtogeek.com/405806/windows-task-manager-the-complete-guide/"">Task Manager</a> on Windows can report which applications are taking up what amount of specific resources on your computer in near real-time, helping you keep watch over your digital domain. When you need to monitor whole fleets of servers, though, you need tools that can scrape or collect the same information from those servers over a network.</p>  <p>In decades past, IT teams were often limited to static data sets to perform tasks like asset tracking. As applications grew more complex, performance and reliability metrics became increasingly important, so instrumentation, profiling, and visualization tools like <a href=""https://kubernetes.io/docs/reference/using-api/health-checks/"">dedicated health and readiness checks</a> and <a href=""https://developer.mozilla.org/docs/Tools/Performance/Flame_Chart"">flame charts</a> were developed to help engineers figure out how to both optimize the code they wrote and how to integrate it with other systems more seamlessly. Today, specialized frameworks and burgeoning standards like <a href=""https://opentelemetry.io/"">OpenTelemetry</a> are designed to give system operators more visibility into both the current and historical usage trends and patterns of the resources their services need to run well. Equipped with this information, they can make better capacity planning decisions for the future or even help identify anomalous events like security breaches, bugs in code, and other subtle issues that might be hard or impossible to track down otherwise.</p>  <p>In this workshop, you’ll be introduced to the concepts and practices of observability for infrastructure at any level of scale. You’ll learn about the “four golden signals”—latency, traffic, errors, and saturation—and why they matter. Like the four Quarters that are called to cast a magical circle, each golden signal has a particular focus and almost elemental meaning. You’ll learn how to install and configure <a href=""https://prometheus.io/"">Prometheus</a>, the open, industry-standard metrics collection solution on which many commercial offerings are based, along with its accompanying components like <a href=""https://www.prometheus.io/docs/alerting/latest/alertmanager/"">Alertmanager</a>, metric <a href=""https://prometheus.io/docs/instrumenting/exporters/"">exporters</a>, and supplemental software like <a href=""https://grafana.com/"">Grafana</a> that can query Prometheus’s time series database to reveal trends, patterns, or anomalies in your systems’ stability over time. Finally, to make sense of all this data, you’ll get an introduction to <a href=""https://prometheus.io/docs/prometheus/latest/querying/basics/"">PromQL</a>, the purpose-built Prometheus Query Language used for everything from triggering alerts to making custom queries so you’ll always be able to know exactly what’s going on in your infrastructure when you need to.</p></blockquote><p>As this is a remote/online-only event, there is no physical class space, but attendance is still limited to 15 students, so <a href=""#tickets-workshop-2022-05-22-guardians-of-the-watchtowers-introduction-to-service-monitoring-and-observability"">purchase your ticket now</a> to reserve your spot.</p><p>To participate in our webinars, you will need access to a modern Web browser such as an up-to-date copy of <a href=""https://www.mozilla.org/firefox/"">Mozilla Firefox</a> or <a href=""https://www.google.com/chrome/"">Google Chrome</a>. You will also need a reliable Internet connection. We recommend disabling Wi-Fi and plugging your computer in to a hard-wired Ethernet network cable for the duration of the webinar, if possible.</p><p>If you would like to share your video screen or appear on camera, you will need to have and activate your own camera, such as the one built-in to many modern laptops. Similarly, to speak with the rest of the webinar participants, you will need a microphone. If you do choose to activate your microphone, we ask that you please plug in headphones/ear buds or use a headset in order to help reduce audio feedback loops that can degrade the webinar experience for other participants.</p><p>Please refer to <a href=""https://techlearningcollective.com/faq/#workshops-and-webinars"">our workshops and webinars FAQ</a> for additional tips and advice before you join the video conference.</p><p>As with all Tech Learning Collective events, racism, queerphobia, transphobia, sexism, “brogrammer,” “manarchist,” or any kind of similarly awful behavior <em>will</em> result in immediate removal from class without a refund. Please refer to <a href=""https://github.com/AnarchoTechNYC/meta/wiki/Social-rules"">our lightweight social rules</a> for details on our strictly enforced no-tolerance policy against bigotry of any kind.</p><h2 id=""about-tech-learning-collective"">About Tech Learning Collective</h2><p>Tech Learning Collective is an apprenticeship-based technology school that trains politically self-motivated individuals in the arts of hypermedia, Information Technology, and radical political practice. We offer unparalleled free, by-donation, and low-cost computer classes on topics ranging from fundamental computer literacy to the same offensive computer hacking techniques used by national intelligence agencies and military powers (cyber armies). For more information and to enroll, visit <a href=""https://techlearningcollective.com/"">TechLearningCollective.com</a>.</p>","There are no special instructions for this event.","techlearningcollective@riseup.net","","","","","","15","","","","15:00","05/22/22","true","","","","","","en","http://techlearningcollective.com/events/2022/05/workshop-2022-05-22-guardians-of-the-watchtowers-introduction-to-service-monitoring-and-observability","","","","","","","","","","","http://techlearningcollective.com/events/2022/05/workshop-2022-05-22-guardians-of-the-watchtowers-introduction-to-service-monitoring-and-observability"
"Taming Daemons: System Administration and Operation Basics","Taming Daemons: System Administration and Operation Basics (at  on May 28, 2022)","","","","","","","13:30","05/28/22","","techlearningcollective@riseup.net","<p>Most individuals with access to a computer system have more power today than ever before, but rarely do they make use of it or even know how much power they truly have. In this beginner’s workshop, you’ll begin learning how to “speak with the machines.” By learning to communicate more expressively with the digital devices that are increasingly responsible for mediating contemporary society, you’ll gain the power to effectively and materially change your relationship not only with your laptop, but with global systems of law, finance, and even art, literature, and philosophy governing today’s world.</p><h2 id=""workshop-description"">Workshop Description</h2><blockquote>  <p>How much good does a powerful tool do for you if you don’t know how to use it well? How much more capable would you be if you mastered all the tools available to you? It might sound ridiculous, but failing to learn the practicalities of computer system operation basics is arguably the most common mistake people in the fast-paced tech scene make.</p>  <p>Modern computers are power tools, and behind each one of them is a human operator, or “system administrator,” responsible for configuring and maintaining that computer. If you have a personal computer such as a laptop or smartphone, then you are already a system administrator whether you realize it or not! Making sure the apps you want to use are installed and up to date, managing the amount of free space you have for your photos, and connecting or disconnecting from the Internet are all examples of simple system administration tasks that you probably already take on a daily basis.</p>  <p>In this beginner’s workshop, we’ll start by exploring what happens inside your computer when you take every-day tasks like open a Web browser or save files, and then dive down the rabbit hole to meet the special class of programs that make it possible for all your other programs to work. Called <em>daemons</em>, short for Disk Access and Execution Monitors, they make up the world of Operating System services, signals, sockets, and more under the hood of your desktop environment. By the end of this workshop, you’ll have a far deeper understanding of how to care for your computer, as well as the ability to understand any new tools or services you encounter a whole lot faster than ever before.</p></blockquote><p>As this is a remote/online-only event, there is no physical class space, but attendance is still limited to 15 students, so <a href=""#tickets-workshop-2022-05-28-taming-daemons-system-administration-and-operation-basics"">purchase your ticket now</a> to reserve your spot.</p><p>To participate in our webinars, you will need access to a modern Web browser such as an up-to-date copy of <a href=""https://www.mozilla.org/firefox/"">Mozilla Firefox</a> or <a href=""https://www.google.com/chrome/"">Google Chrome</a>. You will also need a reliable Internet connection. We recommend disabling Wi-Fi and plugging your computer in to a hard-wired Ethernet network cable for the duration of the webinar, if possible.</p><p>If you would like to share your video screen or appear on camera, you will need to have and activate your own camera, such as the one built-in to many modern laptops. Similarly, to speak with the rest of the webinar participants, you will need a microphone. If you do choose to activate your microphone, we ask that you please plug in headphones/ear buds or use a headset in order to help reduce audio feedback loops that can degrade the webinar experience for other participants.</p><p>Please refer to <a href=""https://techlearningcollective.com/faq/#workshops-and-webinars"">our workshops and webinars FAQ</a> for additional tips and advice before you join the video conference.</p><p>As with all Tech Learning Collective events, racism, queerphobia, transphobia, sexism, “brogrammer,” “manarchist,” or any kind of similarly awful behavior <em>will</em> result in immediate removal from class without a refund. Please refer to <a href=""https://github.com/AnarchoTechNYC/meta/wiki/Social-rules"">our lightweight social rules</a> for details on our strictly enforced no-tolerance policy against bigotry of any kind.</p><h2 id=""about-tech-learning-collective"">About Tech Learning Collective</h2><p>Tech Learning Collective is an apprenticeship-based technology school that trains politically self-motivated individuals in the arts of hypermedia, Information Technology, and radical political practice. We offer unparalleled free, by-donation, and low-cost computer classes on topics ranging from fundamental computer literacy to the same offensive computer hacking techniques used by national intelligence agencies and military powers (cyber armies). For more information and to enroll, visit <a href=""https://techlearningcollective.com/"">TechLearningCollective.com</a>.</p>","There are no special instructions for this event.","techlearningcollective@riseup.net","","","","","","15","","","","15:00","05/28/22","true","","","","","","en","http://techlearningcollective.com/events/2022/05/workshop-2022-05-28-taming-daemons-system-administration-and-operation-basics","","","","","","","","","","","http://techlearningcollective.com/events/2022/05/workshop-2022-05-28-taming-daemons-system-administration-and-operation-basics"
"Securing Our Servers: Basic Network Operations for Autonomous Communities","Securing Our Servers: Basic Network Operations for Autonomous Communities (at  on May 29, 2022)","","","","","","","13:30","05/29/22","","techlearningcollective@riseup.net","<p>Learn the basics of securing digital infrastructure by taking a deep-dive into the Secure Shell (SSH) protocol, a fundamental component of safe administrative access to remote servers. Regardless of whether you rely on one or many thousands of servers to power your daily operations, securely managing those machines is essential to the success of your efforts. This intermediate-level workshop shows you how to securely set up, access, and debug connection issues over the SSH protocol so that you’ll be ready to operate self-hosted digital infrastructure for yourself, friends, or comrades.</p><h2 id=""workshop-description"">Workshop Description</h2><blockquote>  <p>Every app you use—from messengers like <a href=""https://signal.org/"">Signal</a> or WhatsApp to blogs and websites like <a href=""https://wordpress.org/"">WordPress</a> and even other coordination tools like digital calendars and <a href=""https://techlearningcollective.com/workshops/Our-Streets,-Our-Maps-Introduction-to-OpenStreetMap"">online maps</a>—relies on a computer called a server. Whether that computer is one in your hand (your smartphone), or a computer somewhere across the Internet (“in the cloud”), no meaningful digital communication happens without servers offering services, somewhere. So, do you know where <em>your</em> servers are? If not, you can’t know how safe your data is!</p>  <p>When you don’t have a clear map of how your messages and other data gets from here to there, you might be at risk of someone listening in on your conversations. When you rely on services that you don’t own yourself for critical day-to-day operations (like Google Calendar, or Facebook…) you risk losing access to those capabilities by having your account banned, even by mistake. Regardless of your specific situation, knowing more about the digital servers that are serving you is a vital first step for supporting communities or companies large and small.</p>  <p>This intermediate-level workshop combines various topics from the <a href=""https://techlearningcollective.com/courses/sys101.html"">Tech Learning Collective’s System Administration</a>, <a href=""https://techlearningcollective.com/courses/net101.html"">Networking</a>, and <a href=""https://techlearningcollective.com/courses/sec101.html"">Security</a> courses to offer an intensive crash course in secure server setup, monitoring, and maintenance. By taking a <a href=""https://github.com/AnarchoTechNYC/meta/blob/master/train-the-trainers/practice-labs/introduction-to-securing-virtualized-secure-shell-servers/README.md"">deep dive into the SSH protocol</a>, you’ll learn how to set up remote administrative access to a server in a safe way, and you’ll be exposed to the potential risks of network eavesdroppers, <a href=""https://en.wikipedia.org/wiki/Man-in-the-middle_attack"">Machine-in-the-Middle (MITM) attacks</a>, and much more. By the end of this workshop, you’ll have a basic understanding of how to safely operate self-hosted digital infrastructures for yourself, your friends, and your comrades, as well as what first steps you need to take to keep intruders and enemies at bay.</p></blockquote><p>As this is a remote/online-only event, there is no physical class space, but attendance is still limited to 15 students, so <a href=""#tickets-workshop-2022-05-29-securing-our-servers-basic-network-operations-for-autonomous-communities"">purchase your ticket now</a> to reserve your spot.</p><p>To participate in our webinars, you will need access to a modern Web browser such as an up-to-date copy of <a href=""https://www.mozilla.org/firefox/"">Mozilla Firefox</a> or <a href=""https://www.google.com/chrome/"">Google Chrome</a>. You will also need a reliable Internet connection. We recommend disabling Wi-Fi and plugging your computer in to a hard-wired Ethernet network cable for the duration of the webinar, if possible.</p><p>If you would like to share your video screen or appear on camera, you will need to have and activate your own camera, such as the one built-in to many modern laptops. Similarly, to speak with the rest of the webinar participants, you will need a microphone. If you do choose to activate your microphone, we ask that you please plug in headphones/ear buds or use a headset in order to help reduce audio feedback loops that can degrade the webinar experience for other participants.</p><p>Please refer to <a href=""https://techlearningcollective.com/faq/#workshops-and-webinars"">our workshops and webinars FAQ</a> for additional tips and advice before you join the video conference.</p><p>As with all Tech Learning Collective events, racism, queerphobia, transphobia, sexism, “brogrammer,” “manarchist,” or any kind of similarly awful behavior <em>will</em> result in immediate removal from class without a refund. Please refer to <a href=""https://github.com/AnarchoTechNYC/meta/wiki/Social-rules"">our lightweight social rules</a> for details on our strictly enforced no-tolerance policy against bigotry of any kind.</p><h2 id=""about-tech-learning-collective"">About Tech Learning Collective</h2><p>Tech Learning Collective is an apprenticeship-based technology school that trains politically self-motivated individuals in the arts of hypermedia, Information Technology, and radical political practice. We offer unparalleled free, by-donation, and low-cost computer classes on topics ranging from fundamental computer literacy to the same offensive computer hacking techniques used by national intelligence agencies and military powers (cyber armies). For more information and to enroll, visit <a href=""https://techlearningcollective.com/"">TechLearningCollective.com</a>.</p>","There are no special instructions for this event.","techlearningcollective@riseup.net","","","","","","15","","","","15:00","05/29/22","true","","","","","","en","http://techlearningcollective.com/events/2022/05/workshop-2022-05-29-securing-our-servers-basic-network-operations-for-autonomous-communities","","","","","","","","","","","http://techlearningcollective.com/events/2022/05/workshop-2022-05-29-securing-our-servers-basic-network-operations-for-autonomous-communities"
"NOT Worldwide: NYC Regional Launch","NOT Worldwide: NYC Regional Launch (at  on June  2, 2022)","","","","","","","22:00","06/02/22","","techlearningcollective@riseup.net","<p><a href=""https://notworldwide.org/"">New Order Technoism</a> and friends of Tech Learning Collective invite you to <a href=""https://www.liminalspace.nyc/"">Liminal Space</a> to experience the birth of a new machine, one made in and for a new world. Among other incredible performers, this event features DJ Niyah West, a semi-regular fixture at our own Hex90 queer hacker parties, along with livecoded visuals by Char Stiles, also a Hex90 favorite, who will be joined by Livecode.NYC star Indira! More tunes by BABES the DJ, a drag performance by God Complex, and you-have-to-see-it-to-believe-it installations by Ru Electra round out the lineup for this one of a kind enigmatic experience.</p><p>Come for the shows, <a href=""https://www.notworldwide.org/how-is-it"">buy a candle and pray with us</a>, or read the DOOM scrolls while basking in the healing light of retro tech diagnostic testing offered by Anya Volz that may repair—or worsen—all your corruptions.</p><blockquote>  <p>Have you wasted years of your life in service of a capitalist machine?</p>  <p>There is a new machine taking shape, ready to build a new world.</p>  <p>If your existence is passive, you are an existential risk.<br />To exist in the future through cognizance is limitless.</p>  <p>Find purpose, submit yourself to something greater.<br />Consider your second entropy.</p>  <p>Compromise for a better VOID!</p>  <p>Thurs June 2nd // 10pm<br />Liminal Space<br />1080 Wyckoff Ave.<br />((enter through The Deep End))</p>  <p>Queers + Femmes = $20 adv // $25 door<br />Cis + Str8ts = $25 adv // $30 door</p>  <p>~This is an inclusive space~<br />~This venue has gender neutral restrooms~<br />~No one will be turned away for lack of funds, email NewOrderTechnoism@gmail.com~</p></blockquote><h2 id=""about-dj-niyah-west"">About DJ Niyah West</h2><p>Niyah West (she/they) is a DJ, music curator and digital artist based in New York City. From the living rooms of dear friends to the night clubs, Niyah made her professional debut just this year during pride month. Thus, making her a bright newcomer in the queer DJ scene. She has amplified parties and dancefloors all over the boroughs, some recently including MEOW NYC, Gayjoy &amp; a residency at Kind Regards in the Lower East Side. She’s also a resident of Brooklyn based queer DJ collective XOXA NYC.</p><h2 id=""about-livecodenyc"">About <a href=""https://livecode.nyc/"">LiveCode.NYC</a></h2><p>We are primarily a meetup group who gets together to discuss programming in real time. We view live coding as a methodology and not medium specific. Some of our members code graphics, games, VR and a handful live code music. Many languages are used within the group, without one being prioritised. Many of us are artists. Sometimes we run events. The core of what we do is share live coding, whether discussing types at our meetups or teaching a system one of us built. We hope to continue to find ways in which we can do this, as a collective.</p><h2 id=""about-char-stiles"">About <a href=""http://charstiles.com/"">Char Stiles</a></h2><p>Char Stiles is an artist, educator and programmer based in Brooklyn, NY. She works creatively in the lower levels of computational systems to bring to light how computers work. Char works and collaborates across mediums such as interactive installation, video, performance and web. She is a part of the Livecode.nyc collective, where she organizes shows, and livecodes music and visuals.</p>","There are no special instructions for this event.","techlearningcollective@riseup.net","","","","","","","","","","03:00","06/03/22","true","","","","","","en","http://techlearningcollective.com/events/2022/06/event-2022-06-02-not-worldwide-nyc-regional-launch","","","","","","","","","","","http://techlearningcollective.com/events/2022/06/event-2022-06-02-not-worldwide-nyc-regional-launch"
