event_title,administrative_title,location_name,address,city,state,zip,country,time,date,timezone,host,attendee_pitch,attendee_instructions,host_contact_info,van_id,shift_id,role_id,status_id,custom_fields,rsvp_limit,automatic_notifications,display_sharing_options,submit_button_title,end_date,end_time,disable_discussions,reminder_message,reminder_from,reminder_subject,reminder_reply_to,allow_guests,language,redirect_url,email_response,response_message,response_from,response_subject,response_reply_to,twitter_share,email_share,facebook_title,facebook_link,facebook_description,direct_link
"Computer Language Foundations: Command Line Basics","Computer Language Foundations: Command Line Basics (at  on May 14, 2022)","","","","","","","13:30","05/14/22","","techlearningcollective@riseup.net","<p>You have read about people who can talk to machines. Maybe you imagined secret chambers, hidden away behind locked doors, with dark rooms basking in blue from electric fires. Some of these people seemed friendly, others scary, but all of them were powerful. How did they learn to communicate with their computers? This is your chance to learn the foundations of all computer languages, the command line, and actually begin to talk to a machine yourself.</p><h2 id=""workshop-description"">Workshop Description</h2><blockquote>  <p>To be useful, every computer must offer some way for you to control it. Generically, the way you can control a computer is called a <em>user interface</em> because it allows you (the user) to interact with (that is, “to interface with”) the computer system. Most people may already be familiar with <em>Graphical User Interfaces</em> or GUIs, which are the buttons, windows, and other controls that you can point-and-click on, but this way of controlling a computer comes with severe limitations. Chief among these is the fact that you are limited to using only one tip of one finger on one of your hands (called your <em>pointer</em> or <em>mouse cursor</em>) and, worse, you have no access to anything outside of your immediate reach. In a GUI, if you cannot see it or touch it with the mouse, you cannot manipulate it.</p>  <p>This is why almost all hackers, programmers, and system administrators prefer a Command Line Interface or CLI over the graphical options for many, if not most, of their day-to-day tasks. In a command-line, or “terminal,” you can use the complete expressive power of spoken language to control your computer. You can use symbolism and metaphor to express any idea that you have the words for. Moreover, you always have all the words you know at your disposal at any time, even if they refer to things that are far away or that you cannot currently see.</p>  <p>In this beginner’s workshop, you’ll learn how to access the command line interface of your computer, and you’ll learn the basic grammar of command line languages such as that provided by the ubiquitous Bash command interpreter. You’ll also be introduced to the basic set of utilities required to quickly accomplish tasks that require working with files and folders, processing text, and automating common workflows that would take dozens or even hundreds of clicks with a mouse to complete in a Graphical User Interface. By learning how to “speak” to your computer using a command language, you can save hours every day and take your first step toward using your computer the way the best hackers would.</p></blockquote><p>As this is a remote/online-only event, there is no physical class space, but attendance is still limited to 15 students, so <a href=""#tickets-workshop-2022-05-14-computer-language-foundations-command-line-basics"">purchase your ticket now</a> to reserve your spot.</p><p>To participate in our webinars, you will need access to a modern Web browser such as an up-to-date copy of <a href=""https://www.mozilla.org/firefox/"">Mozilla Firefox</a> or <a href=""https://www.google.com/chrome/"">Google Chrome</a>. You will also need a reliable Internet connection. We recommend disabling Wi-Fi and plugging your computer in to a hard-wired Ethernet network cable for the duration of the webinar, if possible.</p><p>If you would like to share your video screen or appear on camera, you will need to have and activate your own camera, such as the one built-in to many modern laptops. Similarly, to speak with the rest of the webinar participants, you will need a microphone. If you do choose to activate your microphone, we ask that you please plug in headphones/ear buds or use a headset in order to help reduce audio feedback loops that can degrade the webinar experience for other participants.</p><p>Please refer to <a href=""https://techlearningcollective.com/faq/#workshops-and-webinars"">our workshops and webinars FAQ</a> for additional tips and advice before you join the video conference.</p><p>As with all Tech Learning Collective events, racism, queerphobia, transphobia, sexism, “brogrammer,” “manarchist,” or any kind of similarly awful behavior <em>will</em> result in immediate removal from class without a refund. Please refer to <a href=""https://github.com/AnarchoTechNYC/meta/wiki/Social-rules"">our lightweight social rules</a> for details on our strictly enforced no-tolerance policy against bigotry of any kind.</p><h2 id=""about-tech-learning-collective"">About Tech Learning Collective</h2><p>Tech Learning Collective is an apprenticeship-based technology school that trains politically self-motivated individuals in the arts of hypermedia, Information Technology, and radical political practice. We offer unparalleled free, by-donation, and low-cost computer classes on topics ranging from fundamental computer literacy to the same offensive computer hacking techniques used by national intelligence agencies and military powers (cyber armies). For more information and to enroll, visit <a href=""https://techlearningcollective.com/"">TechLearningCollective.com</a>.</p>","There are no special instructions for this event.","techlearningcollective@riseup.net","","","","","","15","","","","15:00","05/14/22","true","","","","","","en","http://techlearningcollective.com/events/2022/05/workshop-2022-05-14-computer-language-foundations-command-line-basics","","","","","","","","","","","http://techlearningcollective.com/events/2022/05/workshop-2022-05-14-computer-language-foundations-command-line-basics"
"Getting the Right Stuff: Introduction to Data Files, Spreadsheets, and Databases","Getting the Right Stuff: Introduction to Data Files, Spreadsheets, and Databases (at  on May 15, 2022)","","","","","","","13:30","05/15/22","","techlearningcollective@riseup.net","<p>Learn how to collect, generate, and manipulate data of all kinds so that you can make decisions and meet the challenges you’re facing. You’ll see how simple, text-based data files and command-line utilities have been and are still being used in all sorts of applications today, what spreadsheets have to offer, and how all these tools differ from Relational Database Management Systems (RDMSs) like MySQL/MariaDB, PostgreSQL, Oracle, or Microsoft SQL Server. This workshop will also touch on Web scraping, form building, mail merges, data cleaning, and other techniques you need to know to make automating the boring parts of your day possible.</p><h2 id=""workshop-description"">Workshop Description</h2><blockquote>  <p>If knowledge is power, what is knowledge? On a computer, knowledge comes from data. By collecting data relevant to the problem you’re trying to solve, you can scrutinize it in various different ways until you’re able to draw meaningful conclusions from the dataset; you turn data into information, and from that information you gain knowledge, which gives you power. But this is all much easier said than done, especially if you are not already familiar with how to work with digital data.</p>  <p>This workshop introduces you to the concepts and techniques you need to know to collect, generate, and manipulate digital information regardless of the specific application or problem domain you’re working in. Ever since the dawn of computing, data has been a central element in computer use. After all, what good is a computer without data to compute? Early databases took the form of stacks of physical punch cards. Later on, databases were created out of structured text files (and many of these still exist on your computer today, whether you realize it or not). With the advent of “personal” computing in the 1980’s, digital spreadsheets in applications like Lotus 1-2-3 brought enterprise automation solutions to the masses—or it would have, if more people had the opportunity to learn how to use these powerful tools.</p>  <p>Today, massive datasets with billions or trillions of records are often stored in Relational Database Management Systems (RDMSs) and are accessed using specialized computer languages such as the Structured Query Language (SQL). These databases are thus the crown jewels of every company or organization conducting business online. Everything that matters to them gets stored in a database of some kind, from email subscriber lists, customer records, call logs, and purchase orders, to social media postings, blog comments, personal photos, and much more. Practice working with different kinds of data to learn the foundations relevant to all data exploration and transformation tasks in this introductory workshop that will help you ensure you can get the right stuff to construct successful solutions to any problem.</p></blockquote><p>As this is a remote/online-only event, there is no physical class space, but attendance is still limited to 15 students, so <a href=""#tickets-workshop-2022-05-15-getting-the-right-stuff-introduction-to-data-files-spreadsheets-and-databases"">purchase your ticket now</a> to reserve your spot.</p><p>To participate in our webinars, you will need access to a modern Web browser such as an up-to-date copy of <a href=""https://www.mozilla.org/firefox/"">Mozilla Firefox</a> or <a href=""https://www.google.com/chrome/"">Google Chrome</a>. You will also need a reliable Internet connection. We recommend disabling Wi-Fi and plugging your computer in to a hard-wired Ethernet network cable for the duration of the webinar, if possible.</p><p>If you would like to share your video screen or appear on camera, you will need to have and activate your own camera, such as the one built-in to many modern laptops. Similarly, to speak with the rest of the webinar participants, you will need a microphone. If you do choose to activate your microphone, we ask that you please plug in headphones/ear buds or use a headset in order to help reduce audio feedback loops that can degrade the webinar experience for other participants.</p><p>Please refer to <a href=""https://techlearningcollective.com/faq/#workshops-and-webinars"">our workshops and webinars FAQ</a> for additional tips and advice before you join the video conference.</p><p>As with all Tech Learning Collective events, racism, queerphobia, transphobia, sexism, “brogrammer,” “manarchist,” or any kind of similarly awful behavior <em>will</em> result in immediate removal from class without a refund. Please refer to <a href=""https://github.com/AnarchoTechNYC/meta/wiki/Social-rules"">our lightweight social rules</a> for details on our strictly enforced no-tolerance policy against bigotry of any kind.</p><h2 id=""about-tech-learning-collective"">About Tech Learning Collective</h2><p>Tech Learning Collective is an apprenticeship-based technology school that trains politically self-motivated individuals in the arts of hypermedia, Information Technology, and radical political practice. We offer unparalleled free, by-donation, and low-cost computer classes on topics ranging from fundamental computer literacy to the same offensive computer hacking techniques used by national intelligence agencies and military powers (cyber armies). For more information and to enroll, visit <a href=""https://techlearningcollective.com/"">TechLearningCollective.com</a>.</p>","There are no special instructions for this event.","techlearningcollective@riseup.net","","","","","","15","","","","15:00","05/15/22","true","","","","","","en","http://techlearningcollective.com/events/2022/05/workshop-2022-05-15-getting-the-right-stuff-introduction-to-data-files-spreadsheets-and-databases","","","","","","","","","","","http://techlearningcollective.com/events/2022/05/workshop-2022-05-15-getting-the-right-stuff-introduction-to-data-files-spreadsheets-and-databases"
"Digital Defenses for the People: Practical Digital Security","Digital Defenses for the People: Practical Digital Security (at  on May 21, 2022)","","","","","","","13:30","05/21/22","","techlearningcollective@riseup.net","<p>This beginner-friendly introduction to digital safety will cut through the fear, uncertainty, and doubt generated by the frenetic news cycle and the latest Internet privacy listicle, and offer an opportunity to ask your most pressing online privacy and digital security questions. By learning about foundational frameworks that cybersecurity professionals use to assess risk and safety such as the CIA triad and the three states of data, you’ll build an understanding of information security from first principles to advanced techniques. By the end of this workshop, you will be able to apply these building blocks to anything and everything you do online, or in the streets.</p><h2 id=""workshop-description"">Workshop Description</h2><blockquote>  <p>Learning how to stay safe online is on many people’s minds, but how do you start this process? With so many tools and suggestions from “experts,” how do you know which tool to use, when, and in what situation? Do you really need a VPN? (And what even is that?) What are the tools you really <em>should</em> use, and which tools aren’t worth it? Moreover, without being a cybersecurity expert yourself, how do you learn to sniff out the useful stuff from the placebos?</p>  <p>This beginner’s workshop taught by the <a href=""https://techlearningcollective.com/"">Tech Learning Collective</a>’s cybersecurity trainers offers <a href=""https://techlearningcollective.com/about/persona-matrix/"">a simple framework</a> anyone can use to understand what risks they might face and how to protect themselves from those risks. <a href=""https://github.com/AnarchoTechNYC/meta/wiki/Persona-based-training-matrix"">Developed and maintained by the Anarcho-Tech NYC Collective</a>, an independent cybersecurity research group that provides digital security services to anti-fascist groups in New York City, this framework now forms the basis of many digital safety workshops. It is a simple three-by-three grid in which you can place both yourself and your online safety concerns by answering a few intuitive questions like “How likely is it that I will be targeted?” and “How many resources (money, people, etcetera) does my attacker have?”</p>  <p>Although <a href=""https://prism-break.org/en/"">there are many good and free tools available</a>, most people only need to use a few basic ones: a secure messaging application (like <a href=""https://techlearningcollective.com/workshops/Signal-and-Surveillance-How-to-Exercise-Digital-Civil-Liberties-in-a-Surveillance-State"">Signal</a>), a password manager (like <a href=""https://keepass.info/"">KeePass</a> or <a href=""https://bitwarden.com/"">Bitwarden</a>, and a few of the built-in features of their existing computers, like the full-disk encryption software available for free on every modern laptop and smartphone. This short, calming introduction to digital safety cuts through the fear, uncertainty, and doubt generated by the frenetic news cycle and the latest Internet privacy listicle. You’ll leave this workshop with a security plan in place, and a much clearer picture of the first few steps you <em>should</em> take to protect yourself and your information both online and offline.</p></blockquote><p>As this is a remote/online-only event, there is no physical class space, but attendance is still limited to 15 students, so <a href=""#tickets-workshop-2022-05-21-digital-defenses-for-the-people-practical-digital-security"">purchase your ticket now</a> to reserve your spot.</p><p>To participate in our webinars, you will need access to a modern Web browser such as an up-to-date copy of <a href=""https://www.mozilla.org/firefox/"">Mozilla Firefox</a> or <a href=""https://www.google.com/chrome/"">Google Chrome</a>. You will also need a reliable Internet connection. We recommend disabling Wi-Fi and plugging your computer in to a hard-wired Ethernet network cable for the duration of the webinar, if possible.</p><p>If you would like to share your video screen or appear on camera, you will need to have and activate your own camera, such as the one built-in to many modern laptops. Similarly, to speak with the rest of the webinar participants, you will need a microphone. If you do choose to activate your microphone, we ask that you please plug in headphones/ear buds or use a headset in order to help reduce audio feedback loops that can degrade the webinar experience for other participants.</p><p>Please refer to <a href=""https://techlearningcollective.com/faq/#workshops-and-webinars"">our workshops and webinars FAQ</a> for additional tips and advice before you join the video conference.</p><p>As with all Tech Learning Collective events, racism, queerphobia, transphobia, sexism, “brogrammer,” “manarchist,” or any kind of similarly awful behavior <em>will</em> result in immediate removal from class without a refund. Please refer to <a href=""https://github.com/AnarchoTechNYC/meta/wiki/Social-rules"">our lightweight social rules</a> for details on our strictly enforced no-tolerance policy against bigotry of any kind.</p><h2 id=""about-tech-learning-collective"">About Tech Learning Collective</h2><p>Tech Learning Collective is an apprenticeship-based technology school that trains politically self-motivated individuals in the arts of hypermedia, Information Technology, and radical political practice. We offer unparalleled free, by-donation, and low-cost computer classes on topics ranging from fundamental computer literacy to the same offensive computer hacking techniques used by national intelligence agencies and military powers (cyber armies). For more information and to enroll, visit <a href=""https://techlearningcollective.com/"">TechLearningCollective.com</a>.</p>","There are no special instructions for this event.","techlearningcollective@riseup.net","","","","","","15","","","","15:00","05/21/22","true","","","","","","en","http://techlearningcollective.com/events/2022/05/workshop-2022-05-21-digital-defenses-for-the-people-practical-digital-security","","","","","","","","","","","http://techlearningcollective.com/events/2022/05/workshop-2022-05-21-digital-defenses-for-the-people-practical-digital-security"
