event_title,administrative_title,location_name,address,city,state,zip,country,time,date,timezone,host,attendee_pitch,attendee_instructions,host_contact_info,van_id,shift_id,role_id,status_id,custom_fields,rsvp_limit,automatic_notifications,display_sharing_options,submit_button_title,end_date,end_time,disable_discussions,reminder_message,reminder_from,reminder_subject,reminder_reply_to,allow_guests,language,redirect_url,email_response,response_message,response_from,response_subject,response_reply_to,twitter_share,email_share,facebook_title,facebook_link,facebook_description,direct_link
"Password Superpowers: How to Crack Hashes and Stump Hackers","Password Superpowers: How to Crack Hashes and Stump Hackers (at  on February  6, 2021)","","","","","","","15:30","02/06/21","","techlearningcollective@riseup.net","<p>Get an accessible introduction to the basics of password management by learning how to perform a password cracking attack yourself. Learn exactly what Web sites do with your password when you log in, how to find out if you have been “pwned,” what the risks are, and what you can do to protect yourself from brute-force, credential stuffing, and other forms of account takeover attacks.</p><h2 id=""workshop-description"">Workshop Description</h2><blockquote>  <p>Have you been “pwned”? For years, security researcher Troy Hunt has been running a website at <a href=""https://haveibeenpwned.com/"">HaveIBeenPwned.com</a> that lets you check to see if your online accounts have been pwned—that is, if your personal information such as your password, has been leaked, accessed, or (worst of all!) “cracked.” Go on, check for yourself!</p>  <p>If you’ve been “pwned,” this workshop is your chance to learn exactly what the risk might be, and what you can do about it. Derived from one portion of the <a href=""https://techlearningcollective.com/courses/sec101.html"">Tech Learning Collective’s popular “Hacking with Mr. Robot” (Security 101) course</a>, this class will clarify the basics of cryptography and encryption within a context that actually applies to your day to day life online.</p></blockquote><blockquote>  <p>Learn what websites do with your password when you log in to them, and why using free password management software can make you both safer and more productive. On the flip side, learn <a href=""https://github.com/AnarchoTechNYC/meta/blob/master/train-the-trainers/mr-robots-netflix-n-hack/week-2/strengthening-passwords-to-defend-against-john/README.md"">professional techniques for recovering passwords</a> from their “encrypted” (hashed) representation, such as using optimized wordlists, word-mangling rulesets, and employing basic doxing techniques for creating personally targeted password-cracking attacks.</p></blockquote><p>As this is a remote/online-only event, there is no physical class space, but attendance is still limited to 15 students, so <a href=""#tickets-workshop-2021-02-06-password-superpowers-how-to-crack-hashes-and-stump-hackers"">purchase your ticket now</a> to reserve your spot.</p><p>To participate in our webinars, you will need access to a modern Web browser such as an up-to-date copy of <a href=""https://www.mozilla.org/firefox/"">Mozilla Firefox</a> or <a href=""https://www.google.com/chrome/"">Google Chrome</a>. You will also need a reliable Internet connection. We recommend disabling Wi-Fi and plugging your computer in to a hard-wired Ethernet network cable for the duration of the webinar, if possible.</p><p>If you would like to share your video screen or appear on camera, you will need to have and activate your own camera, such as the one built-in to many modern laptops. Similarly, to speak with the rest of the webinar participants, you will need a microphone. If you do choose to activate your microphone, we ask that you please plug in headphones/ear buds or use a headset in order to help reduce audio feedback loops that can degrade the webinar experience for other participants.</p><p>Please refer to <a href=""https://techlearningcollective.com/faq/#workshops-and-webinars"">our workshops and webinars FAQ</a> for additional tips and advice before you join the video conference.</p><p>As with all Tech Learning Collective events, racism, queerphobia, transphobia, sexism, “brogrammer,” “manarchist,” or any kind of similarly awful behavior <em>will</em> result in immediate removal from class without a refund. Please refer to <a href=""https://github.com/AnarchoTechNYC/meta/wiki/Social-rules"">our lightweight social rules</a> for details on our strictly enforced no-tolerance policy against bigotry of any kind.</p><h2 id=""about-tech-learning-collective"">About Tech Learning Collective</h2><p>Tech Learning Collective is an apprenticeship-based technology school that trains politically self-motivated individuals in the arts of hypermedia, Information Technology, and radical political practice. We offer unparalleled free, by-donation, and low-cost computer classes on topics ranging from fundamental computer literacy to the same offensive computer hacking techniques used by national intelligence agencies and military powers (cyber armies). For more information and to enroll, visit <a href=""https://techlearningcollective.com/"">TechLearningCollective.com</a>.</p>","There are no special instructions for this event.","techlearningcollective@riseup.net","","","","","","15","","","","17:00","02/06/21","true","","","","","","en","http://techlearningcollective.com/events/2021/02/workshop-2021-02-06-password-superpowers-how-to-crack-hashes-and-stump-hackers","","","","","","","","","","","http://techlearningcollective.com/events/2021/02/workshop-2021-02-06-password-superpowers-how-to-crack-hashes-and-stump-hackers"
"The Genesis Project: Making and Maintaining Cloud Infrastructure with Terraform","The Genesis Project: Making and Maintaining Cloud Infrastructure with Terraform (at  on February  7, 2021)","","","","","","","15:30","02/07/21","","techlearningcollective@riseup.net","<p>Learn to manage your own Virtual Private Cloud (VPC) datacenter environment and make the most of cloud infrastructure providers (“IaaS platforms”) by automatically deploying underlying infrastructure, including network topology, firewall rulesets, DNS records, and other resources. This intermediate-level workshop introduces you to Terraform, a free, agentless, masterless, Infrastructure-as-Code (IaC) digital operations provisioning tool used by many of the largest organizations in the world but simple enough to use on a team of one.</p><h2 id=""workshop-description"">Workshop Description</h2><blockquote>  <p>In the beginning, there was the mainframe: a single, gigantic machine that held all the data and did all the work by itself, like a digital planet suspended in the vast emptiness of cyberspace. Then came networks, the personal computer, the Internet, Web 2.0, cloud computing, microservices, and containers—a whole <a href=""https://techlearningcollective.com/workshops/Exploring-Cyberspace-Network-Sniffing-and-Scanning"">cybergalaxy to explore</a>. While the world today looks very different than it did in the days of the mainframe, every project still needs to start at the beginning: get at least one computer to hold all project data and do all project work. So how do modern projects go from a single computer to a whole galaxy so quickly?</p>  <p>For many (including Tech Learning Collective!), the answer is <a href=""https://terraform.io/"">Terraform</a>, a free, open source, and extensible tool that can provision and manage any number of infrastructural resources from source code repositories to cloud compute instances to DNS records and much, much more. Using Terraform, engineers describe the digital environment they’d <em>like</em> to have by writing it down in a simple, declarative configuration language called <a href=""https://www.terraform.io/docs/configuration/syntax.html"">HCL</a>. Then, when instructed, Terraform does the work of metaphorically, well, terraforming cyberspace to match the engineer’s description.</p>  <p>In this workshop, you’ll learn the basics of how to set up Terraform for your organization. We’ll also go over best practices for ensuring testing, staging, and production infrastructures stay isolated from one another, how to compose reusable modules, and how to share your Terraform configurations as well as project state with collaborators. At the end of this workshop, you’ll understand how to bring the cloud down to earth.</p></blockquote><p>As this is a remote/online-only event, there is no physical class space, but attendance is still limited to 15 students, so <a href=""#tickets-workshop-2021-02-07-the-genesis-project-making-and-maintaining-cloud-infrastructure-with-terraform"">purchase your ticket now</a> to reserve your spot.</p><p>To participate in our webinars, you will need access to a modern Web browser such as an up-to-date copy of <a href=""https://www.mozilla.org/firefox/"">Mozilla Firefox</a> or <a href=""https://www.google.com/chrome/"">Google Chrome</a>. You will also need a reliable Internet connection. We recommend disabling Wi-Fi and plugging your computer in to a hard-wired Ethernet network cable for the duration of the webinar, if possible.</p><p>If you would like to share your video screen or appear on camera, you will need to have and activate your own camera, such as the one built-in to many modern laptops. Similarly, to speak with the rest of the webinar participants, you will need a microphone. If you do choose to activate your microphone, we ask that you please plug in headphones/ear buds or use a headset in order to help reduce audio feedback loops that can degrade the webinar experience for other participants.</p><p>Please refer to <a href=""https://techlearningcollective.com/faq/#workshops-and-webinars"">our workshops and webinars FAQ</a> for additional tips and advice before you join the video conference.</p><p>As with all Tech Learning Collective events, racism, queerphobia, transphobia, sexism, “brogrammer,” “manarchist,” or any kind of similarly awful behavior <em>will</em> result in immediate removal from class without a refund. Please refer to <a href=""https://github.com/AnarchoTechNYC/meta/wiki/Social-rules"">our lightweight social rules</a> for details on our strictly enforced no-tolerance policy against bigotry of any kind.</p><h2 id=""about-tech-learning-collective"">About Tech Learning Collective</h2><p>Tech Learning Collective is an apprenticeship-based technology school that trains politically self-motivated individuals in the arts of hypermedia, Information Technology, and radical political practice. We offer unparalleled free, by-donation, and low-cost computer classes on topics ranging from fundamental computer literacy to the same offensive computer hacking techniques used by national intelligence agencies and military powers (cyber armies). For more information and to enroll, visit <a href=""https://techlearningcollective.com/"">TechLearningCollective.com</a>.</p>","There are no special instructions for this event.","techlearningcollective@riseup.net","","","","","","15","","","","17:00","02/07/21","true","","","","","","en","http://techlearningcollective.com/events/2021/02/workshop-2021-02-07-the-genesis-project-making-and-maintaining-cloud-infrastructure-with-terraform","","","","","","","","","","","http://techlearningcollective.com/events/2021/02/workshop-2021-02-07-the-genesis-project-making-and-maintaining-cloud-infrastructure-with-terraform"
"The Web as a Language: What No One Ever Told You About HTML That You Didn't Know To Ask","The Web as a Language: What No One Ever Told You About HTML That You Didn't Know To Ask (at  on February 13, 2021)","","","","","","","15:30","02/13/21","","techlearningcollective@riseup.net","<p>To take full advantage of the Web, especially as a digital publishing medium, you need to start by using the full expressive power of its most fundamental part: the simple HTML “Web page.” This workshop covers HTML, the HyperText Markup Language, as though it were a language in which you can write poems as well as tables of facts and figures, because it is! Learn how to structure your pages in digital rhyme and meter and find out why this approach results in better code for both beautiful designs and automated processes.</p><h2 id=""workshop-description"">Workshop Description</h2><blockquote>  <p>The Hypertext Markup Language (HTML) is the de-facto standard for publishing information online, a kind of digital equivalent to learning to read and write. Why, then, is it so rarely explained in terms of the <em>language</em> that it actually is? What is HTML’s grammar, where do HTML “sentences” begin and end, and how is meaning represented in its elements? You don’t need a computer science degree to learn a foreign language, and that includes HTML.</p>  <p>This workshop is designed for anyone who ever wanted to toy with HTML once or twice, whether it was in the 90’s or just last week. Based on a portion of the <a href=""https://techlearningcollective.com/courses/web101.html"">Tech Learning Collective’s WEB101 course</a>, it is a remarkably thorough treatment of some of the Web’s most powerful and most-often overlooked parts. Covering the structure of HTML and extending to the richness of semantic data formats like <a href=""https://en.wikipedia.org/wiki/Microdata_%28HTML%29"">Microdata</a> and <a href=""https://en.wikipedia.org/wiki/RDFa"">RDFa</a>, learn how to write in the Web’s native language so that both humans (like your friends and comrades) and machines (like Google!) can find, use, and most importantly <em>understand</em> what you’re saying.</p></blockquote><p>As this is a remote/online-only event, there is no physical class space, but attendance is still limited to 15 students, so <a href=""#tickets-workshop-2021-02-13-the-web-as-a-language-what-no-one-ever-told-you-about-html-that-you-didnt-know-to-ask"">purchase your ticket now</a> to reserve your spot.</p><p>To participate in our webinars, you will need access to a modern Web browser such as an up-to-date copy of <a href=""https://www.mozilla.org/firefox/"">Mozilla Firefox</a> or <a href=""https://www.google.com/chrome/"">Google Chrome</a>. You will also need a reliable Internet connection. We recommend disabling Wi-Fi and plugging your computer in to a hard-wired Ethernet network cable for the duration of the webinar, if possible.</p><p>If you would like to share your video screen or appear on camera, you will need to have and activate your own camera, such as the one built-in to many modern laptops. Similarly, to speak with the rest of the webinar participants, you will need a microphone. If you do choose to activate your microphone, we ask that you please plug in headphones/ear buds or use a headset in order to help reduce audio feedback loops that can degrade the webinar experience for other participants.</p><p>Please refer to <a href=""https://techlearningcollective.com/faq/#workshops-and-webinars"">our workshops and webinars FAQ</a> for additional tips and advice before you join the video conference.</p><p>As with all Tech Learning Collective events, racism, queerphobia, transphobia, sexism, “brogrammer,” “manarchist,” or any kind of similarly awful behavior <em>will</em> result in immediate removal from class without a refund. Please refer to <a href=""https://github.com/AnarchoTechNYC/meta/wiki/Social-rules"">our lightweight social rules</a> for details on our strictly enforced no-tolerance policy against bigotry of any kind.</p><h2 id=""about-tech-learning-collective"">About Tech Learning Collective</h2><p>Tech Learning Collective is an apprenticeship-based technology school that trains politically self-motivated individuals in the arts of hypermedia, Information Technology, and radical political practice. We offer unparalleled free, by-donation, and low-cost computer classes on topics ranging from fundamental computer literacy to the same offensive computer hacking techniques used by national intelligence agencies and military powers (cyber armies). For more information and to enroll, visit <a href=""https://techlearningcollective.com/"">TechLearningCollective.com</a>.</p>","There are no special instructions for this event.","techlearningcollective@riseup.net","","","","","","15","","","","17:00","02/13/21","true","","","","","","en","http://techlearningcollective.com/events/2021/02/workshop-2021-02-13-the-web-as-a-language-what-no-one-ever-told-you-about-html-that-you-didnt-know-to-ask","","","","","","","","","","","http://techlearningcollective.com/events/2021/02/workshop-2021-02-13-the-web-as-a-language-what-no-one-ever-told-you-about-html-that-you-didnt-know-to-ask"
"Gone Phishing: How to Recognize Fake Websites and Other Online Scams","Gone Phishing: How to Recognize Fake Websites and Other Online Scams (at  on February 14, 2021)","","","","","","","15:30","02/14/21","","techlearningcollective@riseup.net","<p>The most common way hackers steal passwords, install malware on a victim’s computer, or get employees to grant them unauthorized access to critical business systems is through so-called phishing attacks. A phishing attack is surprisingly low-tech, which is part of what makes it so devastatingly effective. Learning to spot these attacks is one of the most important things you can do to protect yourself online, since a hacker’s tricks, called “lures,” can appear anywhere from an email, to a Facebook message, to a real Web site that looks exactly like one you recognize! In this workshop, you’ll learn how frighteningly easy it is to build these scam sites, and all about the tricks they use to fool you into falling for them.</p><h2 id=""workshop-description"">Workshop Description</h2><blockquote>  <p>Whether it’s corporate espionage, ransomware, or online fraud, most cyber attacks don’t start with sophisticated software exploits, but rather by employing relatively simple tricks. These tricks are called “phishing” attacks because, much like baiting a lure, they won’t work unless you bite. However, <em>many</em> people do get caught up by them.</p>  <p>In 2019, <a href=""https://retruster.com/blog/2019-phishing-and-email-fraud-statistics.html"">ninety percent (90%!)</a> of reported <a href=""https://www.privacyrights.org/data-breaches"">data breaches</a> began with a simple phishing scam, costing businesses <a href=""https://retruster.com/blog/2019-phishing-and-email-fraud-statistics.html"">over $12 billion in losses</a>. Phishing attacks are the most common type of cyberattack on the Internet today, with <a href=""https://www.webroot.com/us/en/about/press-room/releases/nearly-15-million-new-phishing-sites"">one and a half million new phishing websites launched every month</a>. Thankfully, it’s easy to spot—and even to perform—these tricks if you have the right guidance.</p>  <p>For example, when you’re at a cafe and you ask the patron next to you to watch your belongings, your stuff will probably be safe when you return. But how safe would you feel if the patron at the next table turned to you and <em>offered</em> to watch your belongings when you next needed to use the restroom? If you had two different reactions to these scenarios, you already have the intuition you need to understand how the overwhelming majority of cybercrime gets a foothold inside your company, home, or organization’s network.</p>  <p>In this workshop, derived from a portion of the <a href=""https://techlearningcollective.com/courses/sec101.html"">Tech Learning Collective’s popular “Hacking with Mr. Robot” Security 101 course</a>, you will have the opportunity to create and deploy your own phishing Web site that can steal usernames and passwords from unsuspecting victims. By learning how attackers build pixel-perfect replicas of familiar sites like the Facebook login screen, you will also gain the skills you need to more quickly recognize the signs of a malicious web site, email, or other online scam.</p></blockquote><p>As this is a remote/online-only event, there is no physical class space, but attendance is still limited to 15 students, so <a href=""#tickets-workshop-2021-02-14-gone-phishing-how-to-recognize-fake-websites-and-other-online-scams"">purchase your ticket now</a> to reserve your spot.</p><p>To participate in our webinars, you will need access to a modern Web browser such as an up-to-date copy of <a href=""https://www.mozilla.org/firefox/"">Mozilla Firefox</a> or <a href=""https://www.google.com/chrome/"">Google Chrome</a>. You will also need a reliable Internet connection. We recommend disabling Wi-Fi and plugging your computer in to a hard-wired Ethernet network cable for the duration of the webinar, if possible.</p><p>If you would like to share your video screen or appear on camera, you will need to have and activate your own camera, such as the one built-in to many modern laptops. Similarly, to speak with the rest of the webinar participants, you will need a microphone. If you do choose to activate your microphone, we ask that you please plug in headphones/ear buds or use a headset in order to help reduce audio feedback loops that can degrade the webinar experience for other participants.</p><p>Please refer to <a href=""https://techlearningcollective.com/faq/#workshops-and-webinars"">our workshops and webinars FAQ</a> for additional tips and advice before you join the video conference.</p><p>As with all Tech Learning Collective events, racism, queerphobia, transphobia, sexism, “brogrammer,” “manarchist,” or any kind of similarly awful behavior <em>will</em> result in immediate removal from class without a refund. Please refer to <a href=""https://github.com/AnarchoTechNYC/meta/wiki/Social-rules"">our lightweight social rules</a> for details on our strictly enforced no-tolerance policy against bigotry of any kind.</p><h2 id=""about-tech-learning-collective"">About Tech Learning Collective</h2><p>Tech Learning Collective is an apprenticeship-based technology school that trains politically self-motivated individuals in the arts of hypermedia, Information Technology, and radical political practice. We offer unparalleled free, by-donation, and low-cost computer classes on topics ranging from fundamental computer literacy to the same offensive computer hacking techniques used by national intelligence agencies and military powers (cyber armies). For more information and to enroll, visit <a href=""https://techlearningcollective.com/"">TechLearningCollective.com</a>.</p>","There are no special instructions for this event.","techlearningcollective@riseup.net","","","","","","15","","","","17:00","02/14/21","true","","","","","","en","http://techlearningcollective.com/events/2021/02/workshop-2021-02-14-gone-phishing-how-to-recognize-fake-websites-and-other-online-scams","","","","","","","","","","","http://techlearningcollective.com/events/2021/02/workshop-2021-02-14-gone-phishing-how-to-recognize-fake-websites-and-other-online-scams"
